date,transaction
2005-08-10,San Diego Padres Placed RHP Adam Eaton on the 15-day disabled list retroactive to Aug. 5 and activated LHP Chris Hammond from the 15-day disabled list.
2005-08-10,"San Francisco Giants Released OF Marquis Grissom, who had been designated for assignment on Aug. 2."
2005-08-10,St. Louis Cardinals Recalled OF Skip Schumaker from Triple-A Memphis and optioned OF John Gall to Memphis.
2005-08-11,"Atlanta Braves Placed C Johnny Estrada on the 15-day disabled list, retroactive to Aug. 6, with lower back spasms; Recalled C Brayan Pena from Triple-A Richmond."
2005-08-11,Baltimore Orioles Designated OF Midre Cummings for assignment.
2005-08-11,Chicago Cubs Recalled LHP John Koronka from Triple-A Iowa and optioned LHP Rich Hill to Iowa.
2005-08-11,Los Angeles Angels Optioned RHP Chris Bootcheck to Triple-A Salt Lake.
2005-08-11,Los Angeles Dodgers Activated OF Jayson Werth from 15-day disabled list; Placed LHP Wilson Alvarez on 15-day disabled list with a left shoulder impingement.
2005-08-11,"New York Mets Placed OF Mike Cameron on the 15-day disabled list with a broken nose, multiple fractures of both cheekbones and a slight concussion; Recalled OF Victor Diaz from Triple-A Norfolk."
2005-08-11,Pittsburgh Pirates Placed OF Jody Gerut on the 15-day disabled list with irritation of the patella tendon in the right knee and recalled OF Nate McLouth from Triple-A Indianapolis.
2005-08-12,Baltimore Orioles Recalled RHP John Maine from Triple-A Ottawa and optioned RHP Aaron Rakers to Ottawa.
2005-08-12,Cleveland Indians Activated LHP Arthur Rhodes from the bereavement list and optioned LHP Brian Tallet to Triple-A Buffalo.
2005-08-12,Los Angeles Angels Activated LHP Jarrod Washburn from the 15-day disabled list; Placed C Josh Paul on 15-day disabled list (retro to Aug. 8) due to a sprained right thumb; Recalled C Jeff Mathis from Triple-A Salt Lake.
2005-08-12,San Diego Padres Activated RHP Rudy Seanez from the 15-day disabled list and optioned LHP Craig Breslow to Triple-A Portland.
2005-08-12,"San Francisco Giants Placed OF Moises Alou on the 15-day disabled list (retroactive to Aug. 3) with a right hamstring strain, placed RHP Scott Munter on the 15-day disabled list with right elbow inflammation and recalled OF Todd Linden and RHP Jeremy Accardo from Triple-A Fresno."
2005-08-13,Arizona Diamondbacks Optioned C Koyie Hill to Triple-A Tucson; activated RHP Brandon Lyon from the 60-day disabled list and RHP Russ Ortiz from the 15-day disabled list; transferred LHP Shawn Estes from the 15-day to 60-day disabled list; optioned RHP Mike Koplove to Triple-A Tucson.
2005-08-13,Atlanta Braves Activated RHP John Thomson from the 60-day disabled list; optioned RHP Kyle Davies to Triple-A Richmond.
2005-08-13,Cincinnati Reds Activated RHP Ben Weber from 15-day disabled list and optioned him to Triple-A Louisville.
2005-08-13,"Cleveland Indians Placed LHP Arthur Rhodes on the 15-day disabled list, retroactive to Aug. 12, with right knee inflammation and recalled RHP Jeremy Guthrie from Triple-A Buffalo."
2005-08-13,Florida Marlins Activated 1B Carlos Delgado from the 15-day disabled list and designated LHP Valerio De Los Santos for assignment.
2005-08-13,Milwaukee Brewers Recalled OF Corey Hart from Triple-A Nashville and optioned INF Trent Durrington to Nashville.
2005-08-13,Texas Rangers Recalled RHP Juan Dominguez from Triple-A Oklahoma and optioned LHP Erasmo Ramirez to Oklahoma.
2005-08-14,Atlanta Braves Activated LHP Mike Hampton from the 15-day disabled list and optioned LHP Macay McBride to Triple-A Richmond.
2005-08-14,Chicago Cubs Recalled RHP Todd Wellemeyer from Triple-A Iowa and optioned LHP John Koronka to Iowa.
2005-08-14,Cleveland Indians Optioned RHP Jeremy Guthrie to Triple-A Buffalo and recalled OF Jason Dubois from Buffalo.
2005-08-14,"Milwaukee Brewers Transferred INF Jeff Cirillo to 60-day disabled list; Placed RHP Matt Wise on the 15-day disabled list, retroactive to Aug. 9, with a strained left intercostal; Placed RHP Julio Santana on 15-day disabled lsit, retroactive to Aug. 10, with right elbow tendinitis; Recalled RHP Jose Capellan from Triple-A Nashville and purchased the contract of RHP Kane Davis from Nashville."
2005-08-14,Oakland Athletics Nick Swisher placed on bereavement list and recalled Matt Watson from Triple-A Sacramento.
2005-08-14,San Francisco Giants Activated LHP Kirk Rueter from the 15-day disabled list and designated him for assignment.
2005-08-14,Seattle Mariners Optioned RHP Jeff Harris to Triple-A Tacoma.
2005-08-15,Boston Red Sox Optioned RHP Manny Delcarmen to Triple-A Pawtucket.
2005-08-15,"Chicago White Sox Placed OF Scott Podsednik on the 15-day disabled list, retroactive to Aug. 13, with a strained left adductor and purchased the contract of OF Brian Anderson from Triple-A Charlotte."
2005-08-15,Colorado Rockies Transferred RHP Dan Miceli from the 15-day to 60-day disabled list.
2005-08-15,Detroit Tigers Placed LF Rondell White on the 15-day disabled list with a dislocated left shoulder and recalled OF Curtis Granderson from Triple-A Toledo.
2005-08-15,Los Angeles Angels Recalled LHP Joe Saunders from Triple-A Salt Lake and optioned C Jeff Mathis to Salt Lake.
2005-08-15,"Minnesota Twins Placed INF Juan Castro on the 15-day disabled list, retroactive to Aug. 11, with a strained left knee and recalled INF Brent Abernathy from Triple-A Rochester."
2005-08-15,New York Yankees Activated RHP Jaret Wright from the 60-day disabled list and optioned LHP Wayne Franklin to Triple-A Columbus.
2005-08-15,San Diego Padres Placed SS Khalil Greene on the 15-day disabled list with a broken left big toe and purchased the contract of SS Wilson Valdez from Triple-A Portland.
2005-08-15,San Francisco Giants Activated RHP Armando Benitez from the 60-day disabled list and sent RHP Brian Cooper outright to Triple-A Fresno.
2005-08-15,Seattle Mariners Recalled OF Jamal Strong and C Miguel Ojeda from Triple-A Tacoma and optioned C Wiki Gonzalez to Tacoma.
2005-08-16,Boston Red Sox Activated INF John Olerud from the 15-day disabled list; Recalled RHP Jon Papelbon from Triple-A Pawtucket.
2005-08-16,Cincinnati Reds Placed IF/OF Ryan Freel on the 15-day disabled list with torn cartilage in his right knee and selected the contract of IF Aaron Holbert from Triple-A Louisville.
2005-08-16,Colorado Rockies Activated C Todd Greene from the 60-day disabled list; Optioned RHP Ryan Speier to Triple-A Colorado Springs.
2005-08-16,Los Angeles Angels Purchased the contract of RHP Greg Jones from Triple-A Salt Lake; Optioned LHP Joe Saunders to Triple-A Salt Lake.
2005-08-16,Pittsburgh Pirates Recalled LHP Mike Gonzalez from a rehab assignment and activated him from the 15-day disabled list and sent RHP Ian Snell to Triple-A Indianapolis.
2005-08-16,Texas Rangers Purchased the contracts of LHP Justin Thompson from Triple-A Oklahoma and RHP Scott Feldman from Double-A Frisco; Designated RHP James Baldwin for assignment and optioned RHP Kevin Gryboski to Oklahoma; Released nonroster RHP Aaron Sele from Triple-A Oklahoma.
2005-08-17,Arizona Diamondbacks Outrighted RHP Mike Koplove to Triple-A Tucson.
2005-08-17,Boston Red Sox Optioned INF Kevin Youkilis to Triple-A Pawtucket.
2005-08-17,Cleveland Indians Claimed RHP Jason Young off waivers from the Colorado Rockies and optioned him to AAA Buffalo; Designated RHP Francisco Cruceta for assignment.
2005-08-17,Colorado Rockies Announced that RHP Jason Young has been claimed off waivers by the Cleveland Indians.
2005-08-17,"Detroit Tigers Placed SS Carlos Guillen on the 15-day disabled list, retroactive to August 11, with a sore right knee; Recalled 1B Carlos Pena from Triple-A Toledo."
2005-08-17,"Milwaukee Brewers Recalled 1B Prince Fielder from Triple-A Nashville; Placed OF Brady Clark on the 15-day disabled list, retroactive to August 11, with a sore right knee."
2005-08-17,New York Mets Recalled C Mike Jacobs from Double-A Binghamton and designated RHP Jose Santiago for assignment.
2005-08-17,Washington Nationals Optioned OF Brandon Watson to Triple-A New Orleans and purchased the contract of LHP John Halama from Triple-A New Orleans.
2005-08-18,St. Louis Cardinals Activated C Yadier Molina from the 15-day disabled list; Optioned OF Skip Schumacher to Triple-A Memphis; Sent RHP Jimmy Journell outright to Triple-A Memphis.
2005-08-18,Texas Rangers Recalled INF Adrian Gonzalez from Triple-A Oklahoma and optioned RHP Scott Feldman to Double-A Frisco.
2005-08-19,Arizona Diamondbacks Recalled RHP Brandon Medders from Triple-A Tucson and optioned RHP Brian Bruney to Triple-A Tucson.
2005-08-19,Boston Red Sox Designated INF Mark Bellhorn for assignment.
2005-08-19,Chicago Cubs Recalled OF Jerry Hairston from his rehab assignment and reinstated him from the disabled list; Optioned OF Matt Murton to Triple-A Iowa.
2005-08-19,Oakland Athletics Activated OF Nick Swisher from the bereavement list and optioned OF Matt Watson to Triple-A Sacramento.
2005-08-19,San Francisco Giants Activated OF Moises Alou from the 15-day disabled list and optioned OF Jason Ellison to Triple-A Fresno.
2005-08-19,LHP Kirk Rueter has cleared waivers and been released.
2005-08-19,Seattle Mariners Sent C Wiki Gonzalez outright to Triple-A Tacoma; Released INF Scott Spiezio.
2005-08-20,Atlanta Braves Designated RHP Jim Brower for assignment and purchased the contract of RHP Joey Devine from Double-A Mississippi.
2005-08-20,Boston Red Sox Placed OF Adam Stern on the 15-day disabled list with a sprained right thumb; Recalled LHP Lenny DiNardo from Triple-A Pawtucket
2005-08-20,Cleveland Indians Optioned OF Jason Dubois to Triple-A Buffalo and recalled RHP Andrew Brown from Buffalo.
2005-08-20,Philadelphia Phillies Recalled RHP Aquilino Lopez from Triple-A Scranton/Wilkes-Barre and optioned RHP Geoff Geary to Triple-A.
2005-08-20,Seattle Mariners Placed RHP Gil Meche on the 15-day disabled list with patellar tendinitis in his right knee.
2005-08-20,St. Louis Cardinals Activated OF Larry Walker from the 15-day disabled list; Optioned C Mike Mahoney to Triple-A Memphis.
2005-08-21,Atlanta Braves Sent RHP Jim Brower outright to Triple-A Richmond.
2005-08-21,Los Angeles Angels Optioned RHP Greg Jones to Triple-A Salt Lake.
2005-08-21,"New York Mets Placed C Mike Piazza on the 15-day disabled list, retroactive to Aug. 17, and recalled C Mike DiFelice from Triple-A Norfolk; signed C Alberto Castillo to a Minor League contract and assigned him to Norfolk; Optioned LHP Dae-Sung Koo to Norfolk."
2005-08-21,"San Francisco Giants Placed RHP Tyler Walker on the 15-day disabled list, retroactive to Aug. 20, with inflammation in his right shoulder and purchased the contract of RHP Brian Cooper from Triple-A Fresno."
2005-08-21,Seattle Mariners Recalled RHP Clint Nageotte from Triple-A Tacoma and activated 1B Bucky Jacobsen from the 60-day disabled list and optioned him to Triple-A Tacoma.
2005-08-22,Atlanta Braves Activated C Johnny Estrada from the 15-day disabled list and optioned C Brayan Pena to Triple-A Richmond.
2005-08-22,Baltimore Orioles Claimed RHP James Baldwin off waivers from the Texas Rangers and transferred OF Eli Marrero from the 15-day to the 60-day disabled list.
2005-08-22,Colorado Rockies Placed OF Larry Bigbie on the 15-day disabled list retroactive to Aug. 21 with a strained right Achilles' tendon; Recalled OF Choo Freeman from Triple-A Colorado Springs.
2005-08-22,"Los Angeles Dodgers Placed LHP Odalis Perez on the 15-day disabled list, retroactive to Aug. 18, with a strained right oblique muscle; Recalled RHP Edwin Jackson from Double-A Jacksonville and optioned RHP Jonathan Broxton to Double-A Jacksonville."
2005-08-22,New York Mets Recalled RHP Heath Bell from Triple-A Norfolk and designated OF Ron Calloway for assignment.
2005-08-22,Pittsburgh Pirates Placed INF Jose Castillo on the 15-day disabled list with an injury to his left knee and recalled INF Ty Wigginton from Triple-A Indianapolis.
2005-08-23,Atlanta Braves Placed LHP Mike Hampton on the 15-day disabled list with a back injury.
2005-08-23,"Baltimore Orioles Placed RHP Daniel Cabrera on the 15-day disabled list with a lower back strain, retroactive to Aug. 17, and recalled RHP Chris Ray from Double-A Bowie."
2005-08-23,Boston Red Sox Activated OF Trot Nixon from the 15-day disabled list; Optioned LHP Lenny DiNardo to Triple-A Pawtucket.
2005-08-23,Cleveland Indians Optioned RHP Andrew Brown to Triple-A Buffalo and recalled LHP Brian Tallet from Triple-A Buffalo.
2005-08-23,Los Angeles Angels Activated INF Robb Quinlan from the 15-day disabled list.
2005-08-23,Los Angeles Dodgers Recalled RHP Franquelis Osoria from Triple-A Las Vegas.
2005-08-23,New York Mets Activated RHP Steve Trachsel from the 60-day disabled list; designated RHP Danny Graves for assignment.
2005-08-23,"Washington Nationals Placed RHP Ryan Drese on the 15-day disabled list, retroactive to Aug. 19 and recalled RHP Travis Hughes from Triple-A New Orleans."
2005-08-24,Atlanta Braves Recalled LHP Macay McBride from Triple-A Richmond.
2005-08-24,Baltimore Orioles Placed RHP Jason Grimsley on 15-day disabled list and optioned 1B Alejandro Freire to Double-A Bowie; Activated B.J. Surhoff from 15-day disabled list and added RHP James Baldwin to roster.
2005-08-25,Arizona Diamondbacks Recalled RHP Jason Bulger from Triple-A Tucson and optioned RHP Greg Aquino to Triple-A Tucson.
2005-08-25,Chicago White Sox Outrighted RHP Matt Smith to Triple-A.
2005-08-25,Kansas City Royals Placed INF Donnie Murphy on the 15-day disabled list with a fractured right finger; Purchased the contract of OF Aaron Guiel from Triple-A Omaha; Transferred RHP Steve Stemle to the 60-day disabled list.
2005-08-25,Los Angeles Dodgers Placed OF Milton Bradley on the 15-day disabled list with a torn patellar tendon in his left knee and recalled OF Mike Edwards from Triple-A Las Vegas.
2005-08-25,Seattle Mariners Recalled RHP Jeff Harris from Triple-A Tacoma; Optioned RHP Clint Nageotte to Tacoma.
2005-08-25,Washington Nationals Placed OF Ryan Church on the 15-day disabled list with a right fifth toe fracture.
2005-08-26,"Chicago Cubs Placed INF Aramis Ramirez on the 15-day disabled list, retroactive to Aug. 25, with a strained left quadricep and recalled INF Ronny Cedeno from Triple-A Iowa."
2005-08-26,Cleveland Indians Announced that RHP Francisco Cruceta was claimed off waivers by the Seattle Mariners.
2005-08-26,Kansas City Royals Placed RHP Runelvys Hernandez on the 15-day disabled list with a lower back strain; Recalled LHP J.P. Howell from Triple-A Omaha.
2005-08-26,Milwaukee Brewers Activated Brady Clark from the 15-day disabled list; Optioned RHP Justin Lehr to Triple-A Nashville.
2005-08-26,San Diego Padres Activated RHP Adam Eaton from the 15-day disabled list and optioned C David Ross to Triple-A Portland.
2005-08-26,"San Francisco Giants Purchased the contract of RHP Matt Cain from Triple-A Fresno, recalled LHP Jack Taschner from Triple-A Fresno, designated LHP Jason Christiansen for assignment and outrighted RHP Brian Cooper to Triple-A Fresno."
2005-08-26,Seattle Mariners Claimed RHP Francisco Cruceta off waivers from the Cleveland Indians.
2005-08-26,Toronto Blue Jays Recalled C Guillermo Quiroz from Triple-A Syracuse and designated C Ken Huckaby for assignment.
2005-08-26,Washington Nationals Purchased the contract of LHP Matt White from Triple-A New Orleans and optioned RHP Travis Hughes to New Orleans; Recalled OF Marlon Byrd from Triple-A New Orleans.
2005-08-27,Chicago Cubs Purchased the contract of 3B Scott McClain from Triple-A Iowa.
2005-08-27,Traded LF Matt Lawton to New York Yankees for Minor League RHP Justin Berg.
2005-08-27,Florida Marlins Recalled RHP John Riedling from Triple-A Albuquerque and optioned C Ryan Jorgensen to Albuquerque.
2005-08-27,Milwaukee Brewers Jeff Housman outrighted to Triple-A Nashville.
2005-08-27,Placed RHP Ben Sheets on the 15-day disabled list with a torn latissimus dorsi muscle; recalled RHP Justin Lehr from Triple-A Nashville and outrighted LHP Jeff Housman.
2005-08-27,New York Yankees Acquired OF Matt Lawton from the Cubs for Minor League RHP Justin Berg; Optioned RHP Scott Proctor to Triple-A Columbus.
2005-08-27,Oakland Athletics Recalled LHP Ron Flores from Triple-A Sacramento and optioned INF Keith Ginter to Sacramento.
2005-08-27,Pittsburgh Pirates Transferred IF Jose Castillo from 15-day disabled list to 60-day disabled list.
2005-08-27,Placed LHP Zach Duke on the 15-day disabled list with a sprained left ankle and purchased the contract of LHP Paul Maholm from Triple-A Indianapolis.
2005-08-27,San Francisco Giants Traded OF Michael Tucker to Philadelphia for Minor League RHP Kelvin Pichardo.
2005-08-27,Texas Rangers Recalled RHP Erasmo Ramirez from Triple-A Oklahoma and optioned LHP Justin Thompson to Oklahoma.
2005-08-27,Washington Nationals Optioned LHP Matt White to Triple-A New Orleans.
2005-08-28,"Baltimore Orioles Placed OF Sammy Sosa on the 15-day disabled list, retroactive to Aug. 26, with a right big toe lesion and recalled 1B Alejandro Freire from Double-A Bowie."
2005-08-28,Boston Red Sox Designated LHP Mike Remlinger for assignment and recalled LHP Abe Alvarez from Triple-A Pawtucket.
2005-08-28,Chicago White Sox Optioned RHP Jon Adkins and OF Brian Anderson to Charlotte.
2005-08-28,"Los Angeles Dodgers Placed SS Cesar Izturis on the 15-day disabled list, retroactive to Aug. 23, with a sore lower back and recalled 3B Willie Aybar from Triple-A Las Vegas."
2005-08-28,Minnesota Twins Recalled RHP Scott Baker from Triple-A Rochester and optioned INF Luis Rodriguez to Triple-A Rochester.
2005-08-28,"Philadelphia Phillies Placed RHP Cory Lidle (strained left oblique) on 15-day disabled list, retroactive to Aug. 25."
2005-08-28,Acquired OF Michael Tucker from the Giants for non-roster RHP Kelvin Pichardo.
2005-08-28,"Pittsburgh Pirates Activated OF Craig Wilson from the 15-day disabled list and placed OF Chris Duffy on the 15-day disabled list, retroactive to Aug. 26, with a strained left hamstring."
2005-08-28,Washington Nationals Purchased the contract of RHP Jason Bergmann from Triple-A New Orleans.
2005-08-29,Atlanta Braves Acquired OF Todd Hollandsworth from the Cubs for nonroster LHP Todd Blackford and nonroster RHP Angelo Burrows.
2005-08-29,Boston Red Sox Claimed RHP Chad Harville off waivers from the Houston Astros.
2005-08-29,Chicago Cubs Traded OF Todd Hollandsworth to Atlanta for nonroster RHP Todd Blackford and nonroster RHP Angelo Burrows.
2005-08-29,Chicago White Sox Returned OF Scott Podsednik from his rehabilitation assignment and reinstated him from the 15-day disabled list; Recalled RHP Jeff Bajenaru from Triple-A Charlotte.
2005-08-29,Cleveland Indians Recalled RHP Kyle Denney from Triple-A Buffalo and placed him on 60-day disabled list with post-concussive symptoms/skull fracture.
2005-08-29,Florida Marlins Placed RHP John Riedling on the 15-day disabled list with right shoulder tendinitis and recalled RHP Chris Resop from Double-A Carolina.
2005-08-29,Houston Astros Recalled OF Luke Scott from Triple-A Round Rock; Announced that RHP Chad Harville was claimed on outright waivers by the Boston Red Sox.
2005-08-29,Oakland Athletics Recalled INF Freddie Bynum from Triple-A Sacramento; Optioned LHP Ron Flores to Triple-A Sacramento.
2005-08-29,Philadelphia Phillies Transferred 1B Jim Thome from the 15-day to the 60-day disabled list.
2005-08-29,San Diego Padres Placed RHP Pedro Astacio on the 15-day disabled list with a strained right quadriceps; Recalled OF Ben Johnson from Triple-A Portland.
2005-08-29,San Francisco Giants Recalled OF Jason Ellison from Triple-A Fresno.
2005-08-30,Atlanta Braves Optioned RHP Joey Devine to Triple-A Richmond; Transferred C Eddie Perez from the 15-day to the 60-day disabled list.
2005-08-30,Boston Red Sox Recalled RHP Manny Delcarmen from Triple-A Pawtucket and optioned LHP Abe Alvarez to Pawtucket.
2005-08-30,Chicago Cubs Placed RHP Kerry Wood on the 15-day disabled list with a right shoulder injury; Recalled OF Matt Murton and RHP Jermaine Van Buren from Triple-A Iowa.
2005-08-30,"Chicago White Sox Placed 3B Joe Crede on the 15-day disabled list, retroactive to Aug. 26, with a fractured right index finger; Recalled INF Willie Harris and RHP Brandon McCarthy from Triple-A Charlotte; Optioned RHP Jeff Bajenaru to Charlotte."
2005-08-30,Florida Marlins Optioned RHP Chris Resop to Double-A Carolina.
2005-08-30,Kansas City Royals Recalled OF Matt Diaz from Triple-A Omaha; Optioned RHP Jonah Bayliss to Double-A Wichita.
2005-08-30,Los Angeles Angels Acquired LHP Jason Christiansen from the San Francisco Giants for LHP Dusty Bergman and RHP Ronnie Ray; Optioned RHP Joel Peralta to Triple-A Salt Lake.
2005-08-30,New York Yankees Signed INF Mark Bellhorn to a Major League contract; Transferred RHP Carl Pavano from the 15-day to the 60-day disabled list; Optioned INF Felix Escalona to Triple-A Columbus.
2005-08-30,San Diego Padres Activated INF Khalil Greene from the 15-day disabled list; Designated INF Wilson Valdez for assignment.
2005-08-30,San Francisco Giants Purchased the contract of IF Angel Chavez from Triple-A Fresno.
2005-08-30,Acquired LHP Dusty Bergman and RHP Ronnie Ray from the Los Angeles Angels of Anaheim in exchange for LHP Jason Christiansen.
2005-08-30,Acquired RHP Benjamin Cox from the Washington Nationals in exchange for IF Deivi Cruz.
2005-08-30,Seattle Mariners Placed INF Willie Bloomquist on 15-day disabled list with a strained left hamstring; Recalled INF Jose Lopez from Triple-A Tacoma.
2005-08-30,Texas Rangers Transferred DH Greg Colbrunn (right wrist surgery) from the 15-day to the 60-day disabled list; Purchased the contract of RHP Edison Volquez from Double-A Frisco; Optioned LHP C.J. Wilson to Frisco.
2005-08-30,Washington Nationals Acquired SS/2B Deivi Cruz from the San Francisco Giants for nonroster RHP Ben Cox; Outrighted RHP Danny Rueckel to Double-A Harrisburg.
2005-08-31,Boston Red Sox Recalled INF Kevin Youkilis from Triple-A Pawtucket and optioned RHP Manny Delcarmen to Pawtucket.
2005-08-31,Cleveland Indians Recalled OF Franklin Gutierrez from Triple-A Buffalo and optioned LHP Brian Tallet to Buffalo.
2005-08-31,Florida Marlins Selected the contract of OF Jeremy Hermida from Double-A Carolina.
2005-08-31,Houston Astros Purchased the contracts of C Raul Chavez and OF Charles Gipson from Triple-A Round Rock; Optioned RHP Mike Burns and C Humberto Quintero to Round Rock.
2005-08-31,Oakland Athletics Placed INF Bobby Crosby on the 15-day disabled list with a fractured left ankle; Recalled INF Keith Ginter from Triple-A Sacramento.
2005-08-31,"Philadelphia Phillies Purchased the contracts of C A.J. Hinch and OF Shane Victorino from Triple-A Scranton/Wilkes-Barre; Recalled RHP Geoff Geary, RHP Pedro Liriano and INF Matt Kata from Scranton/Wilkes-Barre."
2005-08-31,San Diego Padres Designated RHP Paul Quantrill for assignment and recalled 3B Sean Burroughs from Triple-A Portland; Acquired nonroster INF Manny Alexander from the Rangers for nonroster RHP Juan Jimenez.
2005-08-31,St. Louis Cardinals Optioned LHP Randy Flores to Triple-A Memphis and recalled C Mike Mahoney from Memphis.
2005-08-31,Tampa Bay Devil Rays Placed RHP Seth McClung on the bereavement list and recalled LHP Joe Beimel from Triple-A Durham.
2005-08-31,Texas Rangers Recalled RHP Scott Feldman from Double-A Frisco; Optioned INF Marshall McDougall to Frisco.
2005-08-31,Toronto Blue Jays Outrighted C Ken Huckaby to Triple-A Syracuse; recalled OF Gabe Gross from Syracuse.
2005-08-31,"Washington Nationals Recalled, not to report, and outrighted LHP Matt White to Triple-A New Orleans."
2005-09-01,"Atlanta Braves Recalled RHP Jim Brower, RHP Kyle Davies, C Brayan Pena and 3B Andy Marte from Triple-A Richmond; Activated OF Brian Jordan from the 15-day disabled list."
2005-09-01,Baltimore Orioles Recalled INF Walter Young from Triple-A Ottawa and purchased the contract of INF Bernie Castro from Triple-A Ottawa; Released RHP Sidney Ponson.
2005-09-01,"Boston Red Sox Activated RHP Keith Foulke from the 15-day disabled list, recalled INF Alejandro Machado from Triple-A Pawtucket, purchased the contract of LHP Matt Perisho from Triple-A and added RHP Chad Harville to the active roster."
2005-09-01,Chicago White Sox Recalled INF Ross Gload from Triple-A Charlotte; Purchased the contracts of C Raul Casanova and LHP David Sanders from Charlotte and transferred DH Frank Thomas from the 15-day to 60-day disabled list.
2005-09-01,Cincinnati Reds Returned RHP Josh Hancock from his rehabilitation assignment and was reinstated from the 60-day disabled list.
2005-09-01,Detroit Tigers Purchased the contract of LHP Doug Creek from Triple-A Toledo; Transferred OF Rondell White from the 15-day disabled list to the 60-day disabled list.
2005-09-01,Houston Astros Recalled RHP Travis Driskill from Triple-A Round Rock and sent INF Tommy Whiteman outright to Round Rock.
2005-09-01,Kansas City Royals Recalled 1B Justin Huber from Triple-A Omaha and RHP Leo Nunez from Double-A Wichita.
2005-09-01,Los Angeles Angels Purchased the contract of OF Curtis Pride from Triple-A Salt Lake and transferred 3B Dallas McPherson from the 15-day to the 60-day disabled list; Activated C Josh Paul from the 15-day disabled list and recalled RHP Greg Jones from Triple-A Salt Lake.
2005-09-01,"Milwaukee Brewers Recalled RHP Wes Obermueller from Triple-A Nashville, activated RHP Matt Wise from the 15-day disabled list and reinstated INF Jeff Cirillo from the 60-day disabled list."
2005-09-01,New York Mets Purchased the contracts of RHP Shingo Takatsu and LHP Tim Hamulack from Triple-A Norfolk; Recalled LHP Kaz Ishii from Triple-A Norfolk; Transferred OF Mike Cameron from 15-day disabled list to 60-day disabled list; Designated OF Ron Calloway for assignment.
