date,transaction
2005-01-03,"Cleveland Indians Sold the contract of non-roster infielder Erick Almonte to the Nippon Ham Fighters, Japan Pacific League."
2005-01-03,New York Yankees Re-signed RHP Tanyon Sturtze to a one-year contract with a club option for 2006.
2005-01-04,Detroit Tigers Agreed to terms on a one-year contract with INF Ramon Martinez.
2005-01-04,Minnesota Twins Signed RHP Pat Strange and INF Brent Abernathy to minor league contracts.
2005-01-04,Seattle Mariners Agreed to terms on a contract with SS Pokey Reese for the 2005 season with a club option for 2006; Placed INF Jolbert Cabrera on unconditional release waivers to allow him to play in Japan.
2005-01-04,Texas Rangers Jeff Zimmerman's minor league contract was voided by the Commissioner's Office.
2005-01-05,Boston Red Sox Signed RHP Josias Manzanillo to a minor league contract and invited him to Spring Training.
2005-01-06,Chicago White Sox Signed C A.J. Pierzynski to a one-year contract.
2005-01-06,Colorado Rockies Signed OF Dustan Mohr and INF Desi Relaford to one-year contracts with mutual options for 2006 and sent OF Tony Miller outright to Triple-A Colorado Springs.
2005-01-06,Detroit Tigers Designated OF Alexis Gomez for assignment.
2005-01-06,Acquired C Vance Wilson from the New York Mets in exchange for minor league INF Anderson Hernandez.
2005-01-06,Florida Marlins Signed RHP Ismael Valdez and RHP John Riedling to one-year contracts.
2005-01-06,"Houston Astros Signed OF Charles Gipson, LHP Phil Norton and 1B Carlos Rivera to minor league contracts with invitations to Spring Training."
2005-01-06,Kansas City Royals Signed RHP Ryan Jensen and OF Emil Brown to minor league contracts with invitations to Spring Training.
2005-01-06,New York Mets Traded C Vance Wilson to the Detroit Tigers in exchange for SS Anderson Hernandez.
2005-01-06,"Pittsburgh Pirates Agreed to terms with RHP Kirk Bullinger, RHP Brian Mallette, C Paul Chiaffredo and INF Graham Koonce on minor league contracts with invitations to Spring Training."
2005-01-06,St. Louis Cardinals Signed 2B Mark Grudzielanek to a one-year contract.
2005-01-06,Toronto Blue Jays Signed C Gregg Zaun to a one-year contract with an option for 2006.
2005-01-06,Washington Nationals Agreed to terms with OF/1B Brad Wilkerson on a one-year contract.
2005-01-07,Atlanta Braves Agreed to terms with LHP Gabe White on a one-year contract.
2005-01-07,Chicago White Sox Designated C Jamie Burke for assignment.
2005-01-07,Cleveland Indians Signed 2B Warren Morris to a minor league contract and invited him to Spring Training.
2005-01-07,Detroit Tigers Agreed to terms with 1B Carlos Pena on a one-year contract.
2005-01-07,"Los Angeles Angels Signed INF Dave Matranga, OF Tommy Murphy, RHP Greg Jones, OF Zach Sorensen, LHP Corey Lee, OF Chris Prieto, RHP Joel Peralta, RHP Evan Thomas, LHP Dusty Bergman, C Ryan Budde, INF Erick Aybar, OF Brian Gordon, LHP Eric Cyr, C Tom Gregorio, OF Nick Gorneault and RHP Delvin James to minor league contracts with invitations to Spring Training."
2005-01-07,Los Angeles Dodgers Signed LHP Odalis Perez to a three-year contract with a club option for a fourth year.
2005-01-07,Pittsburgh Pirates Agreed to terms with SS Jack Wilson on a two-year contract.
2005-01-08,Boston Red Sox Re-signed 1B David McCarty to a minor league contract and invited him to Spring Training.
2005-01-08,Cleveland Indians Signed RHP Kevin Millwood to a one-year contract.
2005-01-08,Texas Rangers Re-signed C Rod Barajas to a one-year contract.
2005-01-09,Atlanta Braves Signed OF Esix Snead to a minor league contract and invited him to Spring Training.
2005-01-09,New York Mets Signed LHP Koo Dae-sung to a one-year contract with a club option for 2006.
2005-01-09,Pittsburgh Pirates Signed IF Cesar Crespo to a minor league contract with an invitation to Spring Training.
2005-01-10,Arizona Diamondbacks Traded LHP Stephen Randolph to the Chicago Cubs in exchange for a player to be named later.
2005-01-10,Chicago Cubs Acquired LHP Stephen Randolph from the Arizona Diamondbacks in exchange for a player to be named later.
2005-01-10,Chicago White Sox Acquired 1B Travis Hinton from the Milwaukee Brewers as the player to be named later in the Carlos Lee trade.
2005-01-10,Florida Marlins Signed LHP Matt Perisho to a one-year contract.
2005-01-10,"New York Mets Agreed to terms with RHP Victor Zambrano on a one-year contract, avoiding arbitration."
2005-01-10,Signed INF Miguel Cairo to a one-year contract.
2005-01-10,Pittsburgh Pirates Signed RHP Todd Ritchie to a minor league contract with an invitation to Spring Training.
2005-01-10,Toronto Blue Jays Signed RHP Billy Koch to a one-year contract.
2005-01-10,Signed C Ken Huckaby and RHP Pete Walker to minor league contracts with invitations to Spring Training.
2005-01-11,"Arizona Diamondbacks Acquired OF Shawn Green from the Dodgers in exchange for C Dioner Navarro, RHP Danny Muegge, RHP Beltran Perez and RHP William Juarez."
2005-01-11,"Acquired RHP Javier Vazquez, LHP Brad Halsey, C Dioner Navarro and cash from the Yankees in exchange for LHP Randy Johnson."
2005-01-11,Baltimore Orioles Signed RHP James Baldwin and C Brandon Marsters to minor league contracts with invitations to Spring Training.
2005-01-11,Cleveland Indians Signed OF Juan Gonzalez to a minor league contract with an invitation to Spring Training.
2005-01-11,"Colorado Rockies Signed RHP Tim Drew, RHP Eddie Gaillard and LHP Darren Oliver to minor league contracts and invited them to Spring Training."
2005-01-11,Los Angeles Dodgers Signed RHP Derek Lowe to a four-year contract.
2005-01-11,"Acquired C Dioner Navarro, RHP Danny Muegge, RHP Beltran Perez and RHP William Juarez from the Diamondbacks for OF Shawn Green and cash."
2005-01-11,"Milwaukee Brewers Signed C Julio Mosquera, INF Steve Scarborough and RHP Chris Saenz to minor league contracts with invitations to Spring Training."
2005-01-11,New York Mets Signed OF Carlos Beltran to a seven-year contract.
2005-01-11,"New York Yankees Acquired LHP Randy Johnson from the Diamondbacks in exchange for RHP Javier Vazquez, LHP Brad Halsey, C Dioner Navarro and cash."
2005-01-11,Philadelphia Phillies Signed RHP Terry Adams to a one-year contract.
2005-01-11,San Diego Padres Signed LHP Chris Hammond to a one-year contract.
2005-01-11,Seattle Mariners Agreed to terms with RHP Gil Meche on a one-year deal.
2005-01-11,Toronto Blue Jays Signed LHP Scott Schoeneweis to a two-year contract.
2005-01-12,Arizona Diamondbacks Traded INF Shea Hillenbrand to the Blue Jays for RHP Adam Peterson.
2005-01-12,Signed LHP Shawn Estes to a one-year contract.
2005-01-12,Florida Marlins Signed C Paul Lo Duca to a three-year contract.
2005-01-12,Houston Astros Signed RHP Turk Wendell to a minor league contract and invited him to Spring Training.
2005-01-12,Los Angeles Dodgers Designated OF Henri Stanley and 2B Joe Thurston for assignment.
2005-01-12,Oakland Athletics Signed RHP Keiichi Yabu to a one-year contract.
2005-01-12,"St. Louis Cardinals Signed RHP Toby Borland, RHP Chris Gissell, RHP Bob File, INF Mike Bell, INF Wilton Guerrero, OF Raul Gonzalez and OF Brandon Berger to minor league contracts with invitations to Spring Training."
2005-01-12,Tampa Bay Devil Rays Signed LHP Mark Guthrie to a minor league contract and invited him to Spring Training.
2005-01-12,Signed INF Alex Gonzalez to a one-year contract.
2005-01-12,Toronto Blue Jays Acquired INF Shea Hillenbrand from the Diamondbacks in exchange for RHP Adam Peterson.
2005-01-13,Arizona Diamondbacks Designated RHP Casey Daigle for assignment.
2005-01-13,Houston Astros Signed RHP Dave Burba to a minor league contract with an invitation to Spring Training.
2005-01-13,Los Angeles Dodgers Signed C Paul Bako to a one-year contract.
2005-01-13,New York Yankees Re-signed DH Ruben Sierra to a one-year contract.
2005-01-13,Texas Rangers Sent INF Ruddy Yan outright to Triple-A Oklahoma.
2005-01-14,Atlanta Braves Signed OF Raul Mondesi to a one-year contract.
2005-01-14,Chicago Cubs Agreed to terms with RHP Chad Fox on a minor league contract with an invitation to Spring Training.
2005-01-14,Chicago White Sox Agreed to terms with OF Aaron Rowand on a two-year contract with mutual options for 2007; Outrighted C Jamie Burke to Triple-A Charlotte.
2005-01-14,Detroit Tigers Outrighted the contract of OF Alexis Gomez to Triple-A Toledo.
2005-01-14,Los Angeles Dodgers Designated OF Chin-Feng Chen for assignment.
2005-01-14,Oakland Athletics Signed DH Erubiel Durazo to a one-year contract and IF Bobby Smith to a minor league contract.
2005-01-14,San Diego Padres Agreed to terms with RHP Scott Linebrink on a two-year contract and RHP Miguel Asencio on a one-year contract.
2005-01-14,Seattle Mariners Agreed to terms with IF Benji Gil on a minor league contract.
2005-01-14,Washington Nationals Agreed to terms with 1B Nick Johnson a one-year contract.
2005-01-15,San Diego Padres Sent LHP Darrell May outright to Triple-A Portland and invited him to Spring Training.
2005-01-17,Arizona Diamondbacks Agreed to terms with LHP Randy Choate on a two-year contract.
2005-01-17,"Atlanta Braves Signed SS Rafael Furcal, RHP Dan Kolb and RHP Chris Reitsma to one-year contracts."
2005-01-17,Cincinnati Reds Agreed to terms with OF Adam Dunn and OF Austin Kearns on one-year contracts.
2005-01-17,"Florida Marlins Signed RHP A.J. Burnett, RHP Guillermo Mota and RHP Tim Spooneybarger to one-year contracts."
2005-01-17,Houston Astros Signed RHP Brandon Duckworth to a one-year contract.
2005-01-17,Los Angeles Angels Signed OF Jeff DaVanon to a one-year contract.
2005-01-17,San Francisco Giants Signed IF/OF Pedro Feliz to a two-year contract; signed C Yorvit Torrealba to a one-year contract.
2005-01-17,St. Louis Cardinals Agreed to terms with RHP Jason Marquis on a one-year contract.
2005-01-17,Texas Rangers Signed 2B Alfonso Soriano to a one-year contract.
2005-01-18,Arizona Diamondbacks Agreed to terms with RHP Brandon Lyon on a one-year contract.
2005-01-18,"Baltimore Orioles Signed RHP Jay Witasick, 2B Enrique Wilson, 3B Chris Stynes, OF Midre Cummings and C Keith McDonald to minor league contracts with invitations to Spring Training."
2005-01-18,"Signed LHP B.J. Ryan, RHP Rodrigo Lopez, OF Luis Matos and 2B Jerry Hairston to one-year contracts."
2005-01-18,Boston Red Sox Agreed to terms with INF Mark Bellhorn and RHP Bronson Arroyo on one-year contracts.
2005-01-18,Chicago Cubs Agreed to terms with RHP Kyle Farnsworth and OF Corey Patterson on one-year contracts.
2005-01-18,Signed C Michael Barrett to a three-year contract.
2005-01-18,Agreed to terms with RHP Scott Williamson on a minor league contract with an invitation to Spring Training.
2005-01-18,Chicago White Sox Agreed to terms with RHP Luis Vizcaino on a one-year contract.
2005-01-18,Cleveland Indians Designated INF Corey Smith for assignment.
2005-01-18,Signed INF Alex Cora to a two-year contract.
2005-01-18,Colorado Rockies Agreed to terms with RHP Jason Jennings on a two-year contract with a third-year club option and LHP Joe Kennedy to a one-year deal.
2005-01-18,Kansas City Royals Signed INF Denny Hocking to a minor league contract with an invitation to Spring Training.
2005-01-18,New York Mets Signed RHP Roberto Hernandez to a minor league contract with an invitation to Spring Training.
2005-01-18,Oakland Athletics Agreed to terms with RHP Octavio Dotel and OF Bobby Kielty on one-year contracts.
2005-01-18,"Philadelphia Phillies Agreed to terms with SS Jimmy Rollins, INF Placido Polanco and RHP Vicente Padilla on one-year contracts."
2005-01-18,Pittsburgh Pirates Agreed to terms with RHP Josh Fogg and OF/1B Craig Wilson on one-year contracts.
2005-01-18,"San Diego Padres Agreed to terms with RHP Joe Dawley, RHP Brian Falkenborg, RHP Danny Patterson and C Michel Hernandez on minor league contracts with invitations to Spring Training."
2005-01-18,Agreed to terms with 3B Sean Burroughs on a one-year contract.
2005-01-18,Seattle Mariners Signed LHP Ron Villone to a two-year contract.
2005-01-18,St. Louis Cardinals Agreed to terms with LHP Rick Ankiel on a one-year contract.
2005-01-18,Tampa Bay Devil Rays Signed OF Danny Bautista to a one-year contract and designated C Pete Laforest for assignment.
2005-01-18,Texas Rangers Agreed to terms with OF Gary Matthews Jr. on a one-year contract.
2005-01-19,Arizona Diamondbacks Signed RHP Jose Jimenez to a minor league contract with an invitation to Spring Training.
2005-01-19,Atlanta Braves Signed OF Brian Jordan to a one-year contract.
2005-01-19,Baltimore Orioles Signed LHP Tony Saunders to a minor league contract with an invitation to Spring Training.
2005-01-19,"Chicago White Sox Agreed to terms with C Raul Casanova, C Chris Widger, INF Pablo Ozuna, INF Jorge Toca and OF Tony Alvarez on minor league contracts with invitations to Spring Training."
2005-01-19,Milwaukee Brewers Signed RHP Ricky Bottalico and RHP Brooks Kieschnick to one-year contracts.
2005-01-19,Philadelphia Phillies Signed IF/OF Jose Offerman to minor league contract with an invitation to Spring Training.
2005-01-19,"Tampa Bay Devil Rays Agreed to terms with OF Dee Brown, OF Marty Cordova, LHP Mark Guthrie, INF Shane Halter and RHP Brian Sweeney on minor league contracts with invitations to Spring Training."
2005-01-19,Texas Rangers Agreed to terms with RHP Carlos Almanzar on a one-year contract and signed INF Mark DeRosa to a minor league contract with an invitation to Spring Training.
2005-01-19,Washington Nationals Signed RHP Antonio Osuna and RHP Esteban Loaiza to one-year contracts; Designated RHP Sun-Woo Kim for assignment.
2005-01-20,Atlanta Braves Signed 2B Marcus Giles to a one-year contract.
2005-01-20,"Chicago Cubs Signed LHP Jimmy Anderson, LHP Eddie Oropesa, C Casey Kopitzke, C Jose Reyes, INF Danny Klassen, INF Cody Ransom, OF Peter Bergeron, OF Angel Echevarria, OF Calvin Murray and OF Rene Reyes to minor league contracts with invitations to Spring Training; Invited minor league RHP Jermaine Van Buren, minor league OF Adam Greenberg and Cuban expat LHP Raul Valdez to Spring Training."
2005-01-20,Kansas City Royals Signed RHP Steve Stemle to a minor league contract with an invitation Spring Training; Invited minor league OF Alan Moye to Spring Training.
2005-01-20,Tampa Bay Devil Rays Signed 2B Roberto Alomar to a one-year contract.
2005-01-21,Baltimore Orioles Designated RHP Dave Borkowski and RHP Brian Forystek for assignment.
2005-01-21,Signed RHP Steve Reed to a one-year contract with a club option for 2006 and purchased the contract of INF Chris Gomez from Triple-A Ottawa.
2005-01-21,Cleveland Indians Signed INF/OF Casey Blake to a two-year contract through 2006 with a club option for 2007.
2005-01-21,Colorado Rockies Invited minor league RHP Mike Esposito and LHP Justin Hampson to Spring Training.
2005-01-21,Houston Astros Signed RHP Roger Clemens to a one-year contract.
2005-01-21,"Los Angeles Angels Agreed to terms with INF Lou Merloni on a one-year minor league contract; invited RHP Von Stertzbach and RHP Bob Zimmerman to Spring Training; announced that RHP Greg Jones will not attend Spring Training, recovering from shoulder surgery."
2005-01-21,New York Mets Sold the contract of LHP Pedro Feliciano to the Fukuoka Daiei Hawks of the Japanese Pacific League.
2005-01-21,Philadelphia Phillies Claimed RHP Edwin Moreno off waivers from the Texas Rangers.
2005-01-21,Pittsburgh Pirates Signed RHP Albie Lopez to a minor league contract with an invitation to Spring Training.
2005-01-21,San Diego Padres Agreed to terms with RHP Steve Sparks on a minor league contract with an invitation to Spring Training.
2005-01-23,Houston Astros Signed LHP John Franco to a one-year contract.
2005-01-24,Arizona Diamondbacks Signed 1B Tony Clark to a one-year contract.
2005-01-24,Cleveland Indians Signed RHP Jake Westbrook to a two-year contract through 2006 with a club option for 2007.
2005-01-24,Tampa Bay Devil Rays Outrighted C Pete Laforest to Triple-A Durham with an invitation to Spring Training and agreed to terms with OF Chris Singleton on a minor league contract with an invitation to Spring Training.
2005-01-25,Los Angeles Dodgers Sent OF Henri Stanley outright to Triple-A Las Vegas and invited him to Spring Training.
2005-01-25,Minnesota Twins Signed LHP C.J. Nitkowski to a minor league contract with an invitation to Spring Training.
2005-01-25,Pittsburgh Pirates Signed OF Ben Grieve to a minor league contract with an invitation to Spring Training.
2005-01-25,"Seattle Mariners Signed RHP Aaron Sele, LHP Nate Bland, RHP Dan Reichert, C Kit Pellow, INF Mickey Lopez, INF Ramon Santiago, RHP Rett Johnson, RHP Masao Kida, C Ryan Christianson and C Wiki Gonzalez to minor league contracts with invitations to Spring Training; Invited INF Adam Jones, RHP Felix Hernandez and 2004 draft pick SS Matt Tuiasosopo to Spring Training."
2005-01-26,Florida Marlins Signed 1B Carlos Delgado to a four-year contract.
2005-01-26,Seattle Mariners Designated RHP Aaron Looper for assignment.
2005-01-26,Signed Cuban expat INF Yuniesky Betancourt to a Major League contract. Length of the contract was not immediately disclosed.
2005-01-26,"Tampa Bay Devil Rays Invited minor league RHP Chad Orvella to Spring Training; Sent RHP John Webb outright to Triple-A Durham with an invitation to Spring Training; Agreed to terms with RHP Doug Waechter, LHP Scott Kazmir and LHP Chris Seddon on one-year contracts and 2004 draft pick RHP Jeff Niemann to a five-year contract."
2005-01-27,Arizona Diamondbacks Agreed to terms with RHP Mike Koplove on a two-year contract.
2005-01-27,Atlanta Braves Signed RHP Kevin Gryboski to a one-year contract; Signed RHP Jay Powell to a minor league contract with an invitation to Spring Training.
2005-01-27,Chicago White Sox Signed Japanese INF Tadahito Iguchi to a two-year contract with a club option for 2007.
2005-01-27,Los Angeles Angels Signed C Josh Paul to a one-year contract.
2005-01-27,"Milwaukee Brewers Signed OF Brady Clark to a one-year contract, avoiding arbitration."
2005-01-27,"Minnesota Twins Re-signed C Chris Heintz, C Gabby Torres, OF Todd Dunwoody, OF Josh Rabe and RHP Willie Eyre to minor league contracts with invitations to Spring Training; Signed INF Glenn Williams to a minor league contract with invitations to Spring Training; Invited minor league INF Luis Maza to Spring Training."
2005-01-27,New York Mets Acquired 1B Doug Mientkiewicz and conditional cash from the Red Sox for nonroster 1B Ian Bladergroen.
2005-01-27,Pittsburgh Pirates Signed RHP Rick White to a minor league contract with an invitation to Spring Training.
2005-01-27,"St. Louis Cardinals Re-signed RHP Jeremy Cummings, RHP Nerio Rodriguez and C Dan Moylan to minor league contracts with invitations to Spring Training; Signed C Brad Cresse to a minor league contract with an invitation to Spring Training; Invited minor league RHP Brad Thompson, minor league C Gabe Johnson, minor league C Jason Motte and minor league OF Skip Schumaker to Spring Training."
2005-01-27,Tampa Bay Devil Rays Signed RHP Hideo Nomo to a minor league contract with an invitation to Spring Training.
2005-01-27,Washington Nationals Signed INF George Arias to a minor league contract with an invitation to Spring Training.
2005-01-28,"Arizona Diamondbacks Designated C Robby Hammock for assignment; Re-signed LHP Jon Cannon, RHP Brandon Medders, LHP Shane Nance, C Craig Ansman, C Juan Brito and C Corey Myers to minor league contracts with invitations to Spring Training; Signed LHP Kevin Tolar to a minor league contract with an invitation to Spring Training; Invited minor league OF Conor Jackson to Spring Training."
2005-01-28,Chicago White Sox Designated RHP Jason Grilli for assignment.
2005-01-28,Minnesota Twins Signed OF Armando Rios to a minor league contract with an invitation to Spring Training.
2005-01-28,New York Mets Signed LHP Mike Matthews to a minor league contract with an invitation to Spring Training.
2005-01-28,"New York Yankees Re-signed LHP Danny Borrell, 2B Homer Bush, INF Caonabo Cosme, C Jon Mark Sprowl and OF Mike Vento to minor league contracts with invitations to Spring Training; Signed C Joe DePastino, OF Doug Glanville, OF Noah Hall, C Ryan Hankins, INF Russ Johnson, C David Parrish, OF Colin Porter, INF Damian Rolls, RHP Aaron Small, RHP Marc Valdes and RHP Brad Voyles to minor league contracts with invitations to Spring Training; Invited minor league C Irwil Rojas and minor league C Omir Santos to Spring Training."
2005-01-31,Colorado Rockies Signed C Tom Wilson to a minor league contract with an invitation to Spring Training.
2005-01-31,"Detroit Tigers Agreed to terms with RHP Roberto Novoa, RHP Fernando Rodney, RHP Mark Woodyard, INF Ryan Raburn, OF Byron Gettis and OF Curtis Granderson on contracts for 2005."
2005-01-31,"New York Mets Signed LHP Scott Stewart, RHP Eric Junge and INF Jed Hansen to minor league contracts."
2005-01-31,Seattle Mariners Signed RHP Jeff Nelson to a minor league contract with an invitation to Spring Training.
2005-02-01,Baltimore Orioles Signed LHP Horacio Estrada to a minor league contract.
2005-02-01,"Boston Red Sox Signed RHP Jack Cressend, RHP Jeremi Gonzalez, C Shawn Wooten, INF Dave Berg, INF Tim Hummel and INF Kenny Perez to minor league contracts with invitations to Spring Training."
2005-02-01,Los Angeles Angels Signed LHP Mark Watson to a minor league contract with an invitation to Spring Training.
2005-02-01,"New York Mets Signed LHP Tim Hamulack, LHP Blake McGinley, C Joe Hietpas, C John Pachot and INF Danny Garcia to minor league contracts with invitations to Spring Training; Invited minor league RHP Yusmeiro Petit and C Jesus Flores to Spring Training."
2005-02-01,"Oakland Athletics Invited minor league RHP Brad Sullivan, C Daric Barton, C Kurt Suzuki, IF Omar Quintanilla, IF Brian Snyder, and OF Richie Robnet to Spring Training."
2005-02-01,Philadelphia Phillies Reassigned LHP Cole Hamels to minor league camp after he broke his throwing hand.
2005-02-01,Tampa Bay Devil Rays Agreed to terms with RHP Jesus Colome on a one-year contract.
2005-02-02,"Baltimore Orioles Acquired OF Sammy Sosa from Chicago Cubs for OF Jerry Hairston, INF Mike Fontenot and RHP Dave Crouthers."
2005-02-02,Chicago Cubs Signed OF Jeromy Burnitz to a one-year contract with a mutual option for 2006.
2005-02-02,"Acquired INF/OF Jerry Hairston, INF Mike Fontenot and RHP Dave Crouthers from the Orioles for OF Sammy Sosa and cash considerations."
2005-02-02,Cleveland Indians Acquired 3B Jake Gautreau from the Padres for 3B Corey Smith and invited him to Spring Training.
2005-02-02,Florida Marlins Signed RHP Jim Mecir to a one-year contract and designated RHP Kevin Cave for assignment.
2005-02-02,"Philadelphia Phillies Signed RHP Martire Franco, RHP Dan Giese, C Chris Coste, C A.J. Hinch, INF Anthony Medrano, INF Danny Sandoval, OF Mark Budzinski, OF John Castellano and OF Jim Rushford to minor league contracts with invitations to Spring Training."
2005-02-02,San Diego Padres Acquired IF Corey Smith from the Cleveland Indians for IF Jake Gautreau.
2005-02-03,Colorado Rockies Signed RHP Scott Chiasson and C Pascual Matos to minor league contracts with invitations to Spring Training.
2005-02-03,Los Angeles Dodgers Agreed to terms with Japanese 3B Norihiro Nakamura on a one-year minor league contract with an invitation to Spring Training.
2005-02-03,"Pittsburgh Pirates Signed RHP Justin Reid, INF Howie Clark and OF Rich Thompson to minor league contracts with invitations to Spring Training; Invited minor league RHP Bryan Bullington, LHP Jeremy Harts, LHP Paul Maholm and C Neil Walker to Spring Training."
2005-02-03,Tampa Bay Devil Rays Signed C Dan Massiatte and C Paul Hooverto to minor league contracts with invitations to Spring Training.
2005-02-04,Chicago Cubs Agreed with 3B Aramis Ramirez and RHP Carlos Zambrano on one-year contracts; Agreed to terms with IF Dave Hansen on a minor league contract with an invitation to Spring Training.
2005-02-04,"Los Angeles Angels Agreed to terms with IF/OF Robb Quinlan, RHP Matt Hensley and LHP Joe Saunders on one-year contracts."
2005-02-04,"Milwaukee Brewers Signed 2B Junior Spivey to a one-year contract, avoiding arbitration, and signed IF Jeff Cirillo to a minor league contract with an invitation to Spring Training."
2005-02-04,Texas Rangers Signed RHP Pedro Astacio to a one-year contract and claimed RHP Ryan Bukvich off waivers from the Padres.
2005-02-06,Arizona Diamondbacks Acquired OF Jose Cruz Jr. and cash from the Devil Rays in exchange for LHP Casey Fossum.
2005-02-06,"Tampa Bay Devil Rays Signed 1B Travis Lee to a one-year contract, traded OF Jose Cruz Jr. and cash considerations to the Arizona Diamondbacks in exchange for LHP Casey Fossum, and designated OF Matt Diaz for assignment."
2005-02-07,Detroit Tigers Designated OF Dewayne Wise for assignment.
2005-02-07,Signed OF Magglio Ordonez to a five-year contract with vesting options for 2010 and 2011.
2005-02-07,Houston Astros Signed RHP Tim Redding to a one-year contract.
2005-02-07,New York Yankees Signed LHP Buddy Groom to a minor league contract with an invitation to Spring Training.
2005-02-07,"Pittsburgh Pirates Agreed to terms with RHP Bobby Bradley, RHP Jeff Miller, C Ryan Doumit, OF Nate McLouth and OF Chris Duffy on one-year contracts."
2005-02-07,Tampa Bay Devil Rays Agreed to terms with LHP Trever Miller on a one-year contract and signed LHP Denny Neagle to a minor league deal with an invitation to Spring Training.
2005-02-08,Boston Red Sox Agreed to terms with 1B Roberto Petagine on a minor league contract with an invitation to Spring Training.
2005-02-08,"Colorado Rockies Agreed to terms with INF Clint Barmes, C J.D. Closser, LHP Jeff Francis, OF Choo Freeman and RHP Chin-hui Tsao on one-year contracts."
2005-02-08,"Milwaukee Brewers Agreed to terms with LHP Jorge De La Rosa, RHP Jose Capellan, RHP Justin Lehr, RPH Luis Pena and OF Corey Hart on one-year contracts."
