date,transaction
2009-05-02,Oakland Athletics recalled Gio Gonzalez from Sacramento River Cats.
2009-05-02,"Seattle Mariners placed RHP Brandon Morrow on the 15-day disabled list retroactive to April 24, 2009. Right biceps tendinitis."
2009-05-02,Seattle Mariners selected the contract of RHP Denny Stark from Tacoma Rainiers.
2009-05-02,Los Angeles Dodgers recalled Brent Leach from Chattanooga Lookouts.
2009-05-02,"Oakland Athletics placed RHP Santiago Casilla on the 15-day disabled list retroactive to April 29, 2009. Sprained right knee."
2009-05-02,Baltimore Orioles placed RHP Dennis Sarfate on the 15-day disabled list. Right middle finger injury
2009-05-03,Anthony Claggett assigned to New York Yankees from Scranton/Wilkes-Barre Yankees.
2009-05-03,Kansas City Royals placed SS Tony Pena Jr. on the 15-day disabled list. Fractured left hamate bone
2009-05-03,Baltimore Orioles recalled RHP Bob McCrory from Norfolk Tides.
2009-05-03,Kansas City Royals selected the contract of SS Luis Hernandez from Omaha Royals.
2009-05-03,"New York Yankees placed LHP Damaso Marte on the 15-day disabled list retroactive to April 26, 2009. Left shoulder tendinitis."
2009-05-03,New York Yankees recalled Anthony Claggett from Scranton/Wilkes-Barre Yankees.
2009-05-03,Texas Rangers sent RHP Kris Benson on a rehab assignment to Frisco RoughRiders.
2009-05-03,Minnesota Twins optioned Jose Morales to Rochester Red Wings.
2009-05-03,Baltimore Orioles activated RHP Bob McCrory.
2009-05-04,Jesse Crain roster status changed by Minnesota Twins.
2009-05-04,Los Angeles Angels optioned Fernando Rodriguez to Salt Lake Bees.
2009-05-04,Houston Astros placed RHP Doug Brocail on the 15-day disabled list. Left hamstring strain.
2009-05-04,Texas Rangers optioned C Max Ramirez to Oklahoma City RedHawks.
2009-05-04,Texas Rangers recalled Greg Golson from Oklahoma City RedHawks.
2009-05-04,Boston Red Sox sent RF Rocco Baldelli on a rehab assignment to Pawtucket Red Sox.
2009-05-04,Los Angeles Angels optioned Kevin Jepsen to Salt Lake Bees.
2009-05-04,St. Louis Cardinals optioned P.J. Walters to Memphis Redbirds.
2009-05-04,St. Louis Cardinals recalled RHP Brad Thompson from Memphis Redbirds.
2009-05-04,Ervin Santana assigned to Rancho Cucamonga Quakes from Los Angeles Angels.
2009-05-04,New York Yankees optioned Anthony Claggett to Scranton/Wilkes-Barre Yankees.
2009-05-04,New York Yankees recalled RHP Alfredo Aceves from Scranton/Wilkes-Barre Yankees.
2009-05-04,Oakland Athletics recalled Sean Gallagher from Sacramento River Cats.
2009-05-04,Oakland Athletics recalled Jerry Blevins from Sacramento River Cats.
2009-05-04,Oakland Athletics optioned Gio Gonzalez to Sacramento River Cats.
2009-05-04,Oakland Athletics optioned Eric Patterson to Sacramento River Cats.
2009-05-04,Chicago Cubs placed RHP Carlos Zambrano on the 15-day disabled list. Strained left hamstring.
2009-05-04,Chicago Cubs selected the contract of Bobby Scales from Iowa Cubs.
2009-05-04,Kansas City Royals sent RHP Doug Waechter on a rehab assignment to Omaha Royals.
2009-05-04,Houston Astros activated RHP Brian Moehler from the 15-day disabled list.
2009-05-04,San Diego Padres sent RHP Walter Silva on a rehab assignment to Portland Beavers.
2009-05-04,Arizona Diamondbacks placed RHP Tom Gordon on the 15-day disabled list. left hamstring strain
2009-05-04,Arizona Diamondbacks recalled Leo Rosales from Reno Aces.
2009-05-04,Los Angeles Angels activated LHP Darren Oliver from the 15-day disabled list.
2009-05-04,Tampa Bay Rays sent C Shawn Riggans on a rehab assignment to Montgomery Biscuits.
2009-05-04,Matt Treanor roster status changed by Detroit Tigers.
2009-05-05,New York Mets sent RHP Tim Redding on a rehab assignment to Buffalo Bisons.
2009-05-05,Boston Red Sox sent RHP Daisuke Matsuzaka on a rehab assignment to Pawtucket Red Sox.
2009-05-05,Los Angeles Angels sent RHP John Lackey on a rehab assignment to Salt Lake Bees.
2009-05-05,Kansas City Royals sent LHP John Bale on a rehab assignment to Northwest Arkansas Naturals.
2009-05-05,Detroit Tigers placed LF Carlos Guillen on the 15-day disabled list. Right shoulder inflammation.
2009-05-05,Detroit Tigers recalled Jeff Larish from Toledo Mud Hens.
2009-05-05,Detroit Tigers optioned Clay Rapada to Toledo Mud Hens.
2009-05-05,Detroit Tigers recalled Clete Thomas from Toledo Mud Hens.
2009-05-05,New York Yankees placed C Jorge Posada on the 15-day disabled list. Strained right hamstring
2009-05-05,New York Yankees recalled Francisco Cervelli from Trenton Thunder.
2009-05-05,Atlanta Braves activated LF Garret Anderson from the 15-day disabled list.
2009-05-05,Atlanta Braves optioned Brandon Jones to Gwinnett Braves.
2009-05-05,Oakland Athletics activated RF Ben Copeland from the 15-day disabled list.
2009-05-05,Oakland Athletics optioned Dana Eveland to Sacramento River Cats.
2009-05-05,Francisco Cervelli roster status changed by New York Yankees.
2009-05-06,Kansas City Royals sent Brayan Pena outright to Omaha Royals.
2009-05-06,Toronto Blue Jays sent Brian Burres outright to Las Vegas 51s.
2009-05-06,Andrew Miller roster status changed by Jupiter Hammerheads.
2009-05-06,Minnesota Twins optioned Alexi Casilla to Rochester Red Wings.
2009-05-06,Minnesota Twins recalled Matt Tolbert from Rochester Red Wings.
2009-05-06,Atlanta Braves sent C Brian McCann on a rehab assignment to Gwinnett Braves.
2009-05-06,Joe Beimel roster status changed by Washington Nationals.
2009-05-06,Washington Nationals optioned Saul Rivera to Syracuse Chiefs.
2009-05-06,Seattle Mariners placed RHP Shawn Kelley on the 15-day disabled list. Strained left oblique.
2009-05-06,Seattle Mariners recalled Garrett Olson from Tacoma Rainiers.
2009-05-06,Cleveland Indians released RHP Juan Salas.
2009-05-06,Cleveland Indians selected the contract of RHP Matt Herges from Columbus Clippers.
2009-05-06,Cleveland Indians optioned Rafael Perez to Columbus Clippers.
2009-05-06,Los Angeles Angels optioned Brandon Wood to Salt Lake Bees.
2009-05-06,Los Angeles Angels recalled Reggie Willits from Salt Lake Bees.
2009-05-06,Seattle Mariners sent Jamie Burke outright to Tacoma Rainiers.
2009-05-06,Chicago Cubs selected the contract of RHP Chad Fox from Iowa Cubs.
2009-05-06,Chicago Cubs optioned Jeff Samardzija to Iowa Cubs.
2009-05-06,Houston Astros designated 2B Jason Smith for assignment.
2009-05-06,Houston Astros recalled RHP Alberto Arias from Round Rock Express.
2009-05-06,Kris Benson roster status changed by Texas Rangers.
2009-05-06,Texas Rangers optioned RHP Luis Mendoza to Oklahoma City RedHawks.
2009-05-06,Arizona Diamondbacks recalled Josh Whitesell from Reno Aces.
2009-05-06,"Arizona Diamondbacks placed 1B Tony Clark on the 15-day disabled list retroactive to May 5, 2009. Sprained right hand."
2009-05-07,Florida Marlins optioned Graham Taylor to Jacksonville Suns.
2009-05-07,Florida Marlins recalled Carlos Martinez from New Orleans Zephyrs.
2009-05-07,Toronto Blue Jays sent Bryan Bullington outright to Las Vegas 51s.
2009-05-07,Cleveland Indians sent 2B Tony Graffanino outright to Columbus Clippers.
2009-05-07,New York Mets recalled Jon Niese from Buffalo Bisons.
2009-05-07,Cleveland Indians designated RHP Vinnie Chulk for assignment.
2009-05-07,Cleveland Indians recalled Jeremy Sowers from Columbus Clippers.
2009-05-07,St. Louis Cardinals selected the contract of Shane Robinson from Memphis Redbirds.
2009-05-07,Los Angeles Dodgers placed LF Manny Ramirez on the restricted list.
2009-05-07,Los Angeles Dodgers recalled CF Xavier Paul from Albuquerque Isotopes.
2009-05-07,Boston Red Sox activated RF Rocco Baldelli from the 15-day disabled list.
2009-05-07,Boston Red Sox optioned CF Jonathan Van Every to Pawtucket Red Sox.
2009-05-07,Washington Nationals selected the contract of LHP Ron Villone from Syracuse Chiefs.
2009-05-07,Washington Nationals designated LHP Mike Hinckley for assignment.
2009-05-07,Toronto Blue Jays sent LHP B.J. Ryan on a rehab assignment to Dunedin Blue Jays.
2009-05-07,"New York Mets placed LHP Oliver Perez on the 15-day disabled list retroactive to May 3, 2009. Right knee tendinitis."
2009-05-07,"St. Louis Cardinals placed CF Rick Ankiel on the 15-day disabled list retroactive to May 5, 2009. Bruised right shoulder"
2009-05-07,Frank Francisco roster status changed by Texas Rangers.
2009-05-08,San Diego Padres sent RHP Cha Seung Baek on a rehab assignment to Portland Beavers.
2009-05-08,Pittsburgh Pirates sent SS Jack Wilson on a rehab assignment to Indianapolis Indians.
2009-05-08,Florida Marlins placed RHP Anibal Sanchez on the 15-day disabled list. Right shoulder strain.
2009-05-08,Florida Marlins selected the contract of LF Chris Coghlan from New Orleans Zephyrs.
2009-05-08,Houston Astros sent C Humberto Quintero on a rehab assignment to Round Rock Express.
2009-05-08,Cleveland Indians sent 2B Jamey Carroll on a rehab assignment to Columbus Clippers.
2009-05-08,Chicago Cubs sent CF Joey Gathright outright to Iowa Cubs.
2009-05-08,Iowa Cubs Traded CF Joey Gathright to Norfolk Tides and Baltimore Orioles Traded 3B Ryan Freel to Chicago Cubs.
2009-05-08,Chicago Cubs recalled RHP Randy Wells from Iowa Cubs.
2009-05-08,New York Yankees activated 3B Alex Rodriguez from the 15-day disabled list.
2009-05-08,New York Yankees placed C Jose Molina on the 15-day disabled list. Strained left quad
2009-05-08,New York Yankees selected the contract of Kevin Cash from Scranton/Wilkes-Barre Yankees.
2009-05-08,New York Yankees optioned Mark Melancon to Scranton/Wilkes-Barre Yankees.
2009-05-08,Atlanta Braves optioned Clint Sammons to Gwinnett Braves.
2009-05-08,Atlanta Braves activated C Brian McCann from the 15-day disabled list.
2009-05-08,New York Yankees designated RHP Steven Jackson for assignment.
2009-05-08,Ricky Romero assigned to Dunedin Blue Jays from Toronto Blue Jays.
2009-05-08,Indianapolis Indians signed free agent C Adam Melhuse.
2009-05-09,Houston Astros sent Jason Smith outright to Round Rock Express.
2009-05-09,Oakland Athletics designated RF Ben Copeland for assignment.
2009-05-09,Oakland Athletics optioned Gregorio Petit to Sacramento River Cats.
2009-05-09,Oakland Athletics recalled Jeff Gray from Sacramento River Cats.
2009-05-09,Oakland Athletics selected the contract of 2B Adam Kennedy from Sacramento River Cats.
2009-05-09,Los Angeles Angels sent RHP Ervin Santana on a rehab assignment to Salt Lake Bees.
2009-05-09,Texas Rangers recalled Joaquin Arias from Oklahoma City RedHawks.
2009-05-09,Texas Rangers optioned Greg Golson to Oklahoma City RedHawks.
2009-05-09,Seattle Mariners activated RHP Brandon Morrow from the 15-day disabled list.
2009-05-09,"Seattle Mariners placed RHP Carlos Silva on the 15-day disabled list retroactive to May 7, 2009. Right should inflammation"
2009-05-09,Oakland Athletics sent RHP Santiago Casilla on a rehab assignment to Stockton Ports.
2009-05-09,Chicago Cubs placed 3B Aramis Ramirez on the 15-day disabled list. Dislocated left shoulder
2009-05-09,New York Yankees optioned David Robertson to Scranton/Wilkes-Barre Yankees.
2009-05-09,New York Yankees selected the contract of RHP Brett Tomko from Scranton/Wilkes-Barre Yankees.
2009-05-09,Arizona Diamondbacks recalled Bobby Korecky from Reno Aces.
2009-05-09,Arizona Diamondbacks placed RHP Yusmeiro Petit on the 15-day disabled list. Right Shoulder Strain
2009-05-09,New York Yankees designated RHP Eric Hacker for assignment.
2009-05-10,Texas Rangers sent CF Josh Hamilton on a rehab assignment to Oklahoma City RedHawks.
2009-05-10,Chicago Cubs placed RHP Chad Fox on the 15-day disabled list. Right elbow inflammation.
2009-05-10,Chicago Cubs recalled Jose Ascanio from Iowa Cubs.
2009-05-10,Houston Astros optioned Jeff Fulchino to Round Rock Express.
2009-05-10,Arizona Diamondbacks sent SS Stephen Drew on a rehab assignment to Reno Aces.
2009-05-10,Houston Astros selected the contract of 2B Jason Smith from Round Rock Express.
2009-05-10,Boston Red Sox selected the contract of Daniel Bard from Pawtucket Red Sox.
2009-05-10,Boston Red Sox designated LHP Javier Lopez for assignment.
2009-05-11,Florida Marlins optioned CF Cameron Maybin to New Orleans Zephyrs.
2009-05-11,San Diego Padres optioned LHP Arturo Lopez to Portland Beavers.
2009-05-11,San Diego Padres recalled Drew Macias from Portland Beavers.
2009-05-11,"Kansas City Royals placed RHP Joakim Soria on the 15-day disabled list retroactive to May 8, 2009. Sore right shoulder."
2009-05-11,Kansas City Royals recalled Luke Hochevar from Omaha Royals.
2009-05-11,Houston Astros optioned C J.R. Towles to Round Rock Express.
2009-05-11,Chicago White Sox optioned Jose Contreras to Charlotte Knights.
2009-05-11,Chicago White Sox selected the contract of LHP Jimmy Gobble from Charlotte Knights.
2009-05-11,Florida Marlins selected the contract of LHP John Koronka from New Orleans Zephyrs.
2009-05-11,Colorado Rockies sent RHP Ryan Speier on a rehab assignment to Modesto Nuts.
2009-05-11,Los Angeles Angels optioned Anthony Ortega to Salt Lake Bees.
2009-05-11,Pittsburgh Pirates optioned Brian Bixler to Indianapolis Indians.
2009-05-11,Florida Marlins transferred RHP Scott Proctor from the 15-day disabled list to the 60-day disabled list.
2009-05-11,Terrell Young roster status changed by Washington Nationals.
2009-05-12,Houston Astros activated C Humberto Quintero from the 15-day disabled list.
2009-05-12,Los Angeles Angels recalled C Bobby Wilson from Salt Lake Bees.
2009-05-12,Jason Schmidt assigned to Inland Empire 66ers from Los Angeles Dodgers.
2009-05-12,Cleveland Indians activated 2B Jamey Carroll from the 15-day disabled list.
2009-05-12,Cleveland Indians optioned Josh Barfield to Columbus Clippers.
2009-05-12,Arizona Diamondbacks recalled LHP Clay Zavada from Mobile BayBears.
2009-05-12,SS Jack Wilson roster status changed by Pittsburgh Pirates.
2009-05-12,New York Yankees sent RHP Chien-Ming Wang on a rehab assignment to Scranton/Wilkes-Barre Yankees.
2009-05-12,New York Mets sent CF Angel Pagan on a rehab assignment to Buffalo Bisons.
2009-05-12,Arizona Diamondbacks selected the contract of Gerardo Parra from Mobile BayBears.
2009-05-12,Oakland Athletics sent RHP Santiago Casilla on a rehab assignment to Sacramento River Cats.
2009-05-12,Texas Rangers activated CF Josh Hamilton from the 15-day disabled list.
2009-05-12,Texas Rangers optioned Joaquin Arias to Oklahoma City RedHawks.
2009-05-12,St. Louis Cardinals sent SS Brendan Ryan on a rehab assignment to Memphis Redbirds.
2009-05-12,San Francisco Giants recalled Pat Misch from Fresno Grizzlies.
2009-05-12,San Francisco Giants optioned RHP Osiris Matos to Fresno Grizzlies.
2009-05-12,Arizona Diamondbacks optioned RHP Bobby Korecky to Reno Aces.
2009-05-12,Arizona Diamondbacks placed LF Conor Jackson on the 15-day disabled list. General illness
2009-05-12,Boston Red Sox recalled Gil Velazquez from Pawtucket Red Sox.
2009-05-12,"Boston Red Sox placed 1B Kevin Youkilis on the 15-day disabled list retroactive to May 5, 2009. Left oblique strain."
2009-05-12,Arizona Diamondbacks activated LHP Clay Zavada.
2009-05-12,Los Angeles Angels activated C Bobby Wilson.
2009-05-12,Pittsburgh Pirates activated SS Jack Wilson from the 15-day disabled list.
2009-05-13,Detroit Tigers designated Juan Rincon for assignment.
2009-05-13,Detroit Tigers activated LHP Dontrelle Willis from the 15-day disabled list.
2009-05-13,Terrell Young returned to Louisville Bats from Washington Nationals.
2009-05-13,St. Louis Cardinals placed RF Ryan Ludwick on the 15-day disabled list. Strained right hamstring.
2009-05-13,St. Louis Cardinals recalled Nick Stavinoha from Memphis Redbirds.
2009-05-13,Arizona Diamondbacks selected the contract of Bryan Augenstein from Mobile BayBears.
2009-05-13,Chicago White Sox sent CF Brian Anderson on a rehab assignment to Charlotte Knights.
2009-05-13,Arizona Diamondbacks optioned Clay Zavada to Mobile BayBears.
2009-05-13,Arizona Diamondbacks designated SS Josh Wilson for assignment.
2009-05-14,Baltimore Orioles optioned Bob McCrory to Norfolk Tides.
2009-05-14,Baltimore Orioles recalled LF Nolan Reimold from Norfolk Tides.
2009-05-14,"Detroit Tigers placed LHP Nate Robertson on the 15-day disabled list retroactive to May 6, 2009. Low back muscle strain."
2009-05-14,Detroit Tigers selected the contract of Luke French from Toledo Mud Hens.
2009-05-14,Cleveland Indians optioned Jeremy Sowers to Columbus Clippers.
2009-05-14,Cleveland Indians signed free agent RHP Luis Vizcaino.
2009-05-14,Milwaukee Brewers recalled Mat Gamel from Nashville Sounds.
2009-05-14,Houston Astros placed RHP Geoff Geary on the 15-day disabled list. Right biceps tendinitis.
2009-05-14,Houston Astros recalled RHP Jeff Fulchino from Round Rock Express.
2009-05-14,Los Angeles Angels optioned Rafael Rodriguez to Salt Lake Bees.
2009-05-14,Milwaukee Brewers activated C Mike Rivera from the 15-day disabled list.
2009-05-14,Milwaukee Brewers optioned Carlos Corporan to Nashville Sounds.
2009-05-14,Los Angeles Angels activated RHP Ervin Santana from the 15-day disabled list.
2009-05-14,Milwaukee Brewers sent Brad Nelson outright to Nashville Sounds.
2009-05-14,Cleveland Indians sent RHP Vinnie Chulk outright to Columbus Clippers.
2009-05-14,San Francisco Giants sent RHP Sergio Romo on a rehab assignment to San Jose Giants.
2009-05-14,Washington Nationals recalled C Josh Bard from Syracuse Chiefs.
2009-05-14,New York Mets selected the contract of RHP Nelson Figueroa from Buffalo Bisons.
2009-05-14,Oakland Athletics optioned Jeff Gray to Sacramento River Cats.
2009-05-15,Toronto Blue Jays optioned Bill Murphy to Las Vegas 51s.
2009-05-15,Toronto Blue Jays activated LHP B.J. Ryan from the 15-day disabled list.
2009-05-15,OF Ben Copeland returned to Fresno Grizzlies from Oakland Athletics.
2009-05-15,Minnesota Twins placed LF Delmon Young on the bereavement list.
2009-05-15,Minnesota Twins recalled C Jose Morales from Rochester Red Wings.
2009-05-15,Oakland Athletics activated RHP Santiago Casilla from the 15-day disabled list.
2009-05-15,Oakland Athletics optioned Jerry Blevins to Sacramento River Cats.
2009-05-15,Oakland Athletics recalled LF Aaron Cunningham from Sacramento River Cats.
2009-05-15,Washington Nationals selected the contract of RHP Jesus Colome from Syracuse Chiefs.
2009-05-15,"Washington Nationals placed C Jesus Flores on the 15-day disabled list retroactive to May 10, 2009. Riight shoulder contusion."
2009-05-15,Washington Nationals designated RHP Logan Kensing for assignment.
2009-05-15,San Francisco Giants sent CF Andres Torres on a rehab assignment to San Jose Giants.
2009-05-15,Colorado Rockies selected the contract of Randy Flores from Colorado Springs Sky Sox.
2009-05-15,Cleveland Indians sent DH Travis Hafner on a rehab assignment to Columbus Clippers.
2009-05-15,Colorado Rockies designated LHP Glendon Rusch for assignment.
2009-05-15,Boston Red Sox sent LHP Javier Lopez outright to Pawtucket Red Sox.
2009-05-15,Los Angeles Dodgers optioned James McDonald to Albuquerque Isotopes.
2009-05-15,Los Angeles Dodgers selected the contract of LHP Eric Milton from Albuquerque Isotopes.
2009-05-15,San Diego Padres recalled Joe Thatcher from Portland Beavers.
2009-05-15,San Diego Padres optioned Edwin Moreno to Portland Beavers.
2009-05-15,San Diego Padres selected the contract of RHP Greg Burke from Portland Beavers.
2009-05-15,San Diego Padres released RHP Duaner Sanchez.
2009-05-15,"San Diego Padres placed SS Luis Rodriguez on the 15-day disabled list retroactive to May 14, 2009. Sprained left ankle"
2009-05-15,San Diego Padres transferred RHP Cha Seung Baek from the 15-day disabled list to the 60-day disabled list. Strained right forearm
2009-05-15,San Diego Padres claimed Josh Wilson off waivers from Arizona Diamondbacks.
2009-05-15,Brendan Ryan roster status changed by St. Louis Cardinals.
2009-05-15,St. Louis Cardinals optioned Mitchell Boggs to Memphis Redbirds.
2009-05-15,Toronto Blue Jays optioned Ricky Romero to Las Vegas 51s.
2009-05-15,Oakland Athletics activated LF Aaron Cunningham.
2009-05-16,Florida Marlins optioned Brett Carroll to New Orleans Zephyrs.
2009-05-16,Washington Nationals sent Mike Hinckley outright to Syracuse Chiefs.
2009-05-16,Philadelphia Phillies designated 2B Miguel Cairo for assignment.
2009-05-16,Philadelphia Phillies recalled RHP Drew Carpenter from Lehigh Valley IronPigs.
2009-05-16,"New York Mets placed 1B Carlos Delgado on the 15-day disabled list retroactive to May 11, 2009. Right hip impingement."
2009-05-16,Los Angeles Angels optioned Bobby Wilson to Salt Lake Bees.
2009-05-16,Los Angeles Angels activated RHP John Lackey from the 15-day disabled list.
2009-05-16,"Baltimore Orioles placed LF Luke Scott on the 15-day disabled list retroactive to May 11, 2009. Strained left shoulder."
2009-05-16,Baltimore Orioles activated LHP Rich Hill from the 15-day disabled list.
2009-05-16,New York Mets activated CF Angel Pagan from the 15-day disabled list.
2009-05-16,Pittsburgh Pirates transferred LHP Phil Dumatrait from the 15-day disabled list to the 60-day disabled list.
2009-05-16,New York Yankees Traded RHP Eric Hacker to Pittsburgh Pirates and Indianapolis Indians Traded RHP Romulo Sanchez to Scranton/Wilkes-Barre Yankees.
2009-05-16,Chicago Cubs sent RHP Carlos Zambrano on a rehab assignment to Daytona Cubs.
2009-05-16,Andrew Miller roster status changed by Florida Marlins.
2009-05-16,Texas Rangers recalled Warner Madrigal from Oklahoma City RedHawks.
2009-05-16,"Texas Rangers placed RHP Frank Francisco on the 15-day disabled list retroactive to May 7, 2009. Right biceps tendinitis."
2009-05-16,Detroit Tigers sent RHP Jeremy Bonderman on a rehab assignment to West Michigan Whitecaps.
2009-05-16,Atlanta Braves sent RHP Jorge Campillo on a rehab assignment to Mississippi Braves.
2009-05-16,Pittsburgh Pirates optioned Eric Hacker to Indianapolis Indians.
2009-05-17,Washington Nationals placed LHP Scott Olsen on the 15-day disabled list. Left shoulder tendinitis.
2009-05-17,Washington Nationals recalled Ross Detwiler from Harrisburg Senators.
2009-05-17,San Francisco Giants recalled Kevin Frandsen from Fresno Grizzlies.
2009-05-17,Philadelphia Phillies optioned Drew Carpenter to Lehigh Valley IronPigs.
2009-05-17,Philadelphia Phillies recalled Sergio Escalona from Reading Phillies.
2009-05-17,Cleveland Indians selected the contract of David Huff from Columbus Clippers.
2009-05-17,Cleveland Indians selected the contract of RHP Greg Aquino from Columbus Clippers.
2009-05-17,Cleveland Indians optioned Tony Sipp to Columbus Clippers.
2009-05-17,Cleveland Indians sent RHP Masa Kobayashi outright to Columbus Clippers.
2009-05-17,New York Yankees sent RHP Brian Bruney on a rehab assignment to Scranton/Wilkes-Barre Yankees.
2009-05-17,Scott Lewis roster status changed by Cleveland Indians.
2009-05-17,"Pittsburgh Pirates placed RHP Tyler Yates on the 15-day disabled list retroactive to May 16, 2009. Right elbow inflammation."
2009-05-17,Pittsburgh Pirates recalled Tom Gorzelanny from Indianapolis Indians.
2009-05-17,Rick van den Hurk roster status changed by Florida Marlins.
2009-05-17,Florida Marlins optioned RHP Carlos Martinez to New Orleans Zephyrs.
2009-05-17,Florida Marlins selected the contract of Alejandro De Aza from New Orleans Zephyrs.
2009-05-17,"Tampa Bay Rays placed DH Pat Burrell on the 15-day disabled list retroactive to May 12, 2009. Stiff neck."
2009-05-17,San Francisco Giants placed 2B Juan Uribe on the bereavement list.
2009-05-18,Florida Marlins designated LHP John Koronka for assignment.
2009-05-18,Colorado Rockies placed RHP Matt Daley on the 15-day disabled list. Sprained left foot.
2009-05-18,Tampa Bay Rays activated RHP Jason Isringhausen from the 15-day disabled list.
2009-05-18,J.C. Romero assigned to Lehigh Valley IronPigs from Philadelphia Phillies.
2009-05-18,Florida Marlins selected the contract of RHP Brian Sanches from New Orleans Zephyrs.
2009-05-18,"Oakland Athletics placed RHP Dan Giese on the 15-day disabled list retroactive to May 16, 2009. Right elbow ulnaritis."
2009-05-18,Oakland Athletics recalled LHP Gio Gonzalez from Sacramento River Cats.
2009-05-18,Pittsburgh Pirates claimed RHP Steven Jackson off waivers from New York Yankees.
2009-05-18,Pittsburgh Pirates optioned Steven Jackson to Indianapolis Indians.
2009-05-18,Pittsburgh Pirates released RHP Jimmy Barthmaier.
2009-05-18,Colorado Rockies selected the contract of RHP Joel Peralta from Colorado Springs Sky Sox.
2009-05-18,Colorado Rockies designated RHP Steven Register for assignment.
2009-05-18,San Francisco Giants sent RHP Sergio Romo on a rehab assignment to Fresno Grizzlies.
2009-05-18,San Francisco Giants sent CF Andres Torres on a rehab assignment to Fresno Grizzlies.
2009-05-18,Boston Red Sox sent 1B Kevin Youkilis on a rehab assignment to Pawtucket Red Sox.
2009-05-18,New York Mets activated RHP Tim Redding from the 15-day disabled list.
2009-05-18,New York Mets designated RHP Nelson Figueroa for assignment.
2009-05-18,New York Mets placed 2B Alex Cora on the 15-day disabled list. Torn ligament in right thumb
2009-05-18,New York Mets selected the contract of SS Ramon Martinez from Buffalo Bisons.
2009-05-18,RF Magglio Ordonez roster status changed by Detroit Tigers.
2009-05-19,Minnesota Twins placed LHP Glen Perkins on the 15-day disabled list. Left elbow inflammation
2009-05-19,Minnesota Twins selected the contract of Sean Henn from Rochester Red Wings.
2009-05-19,Philadelphia Phillies sent Miguel Cairo outright to Lehigh Valley IronPigs.
2009-05-19,"Cincinnati Reds placed RHP Nick Masset on the 15-day disabled list retroactive to May 11, 2009. Strained left oblique."
2009-05-19,Cincinnati Reds recalled Ramon A. Ramirez from Louisville Bats.
2009-05-19,Detroit Tigers recalled Wilkin Ramirez from Toledo Mud Hens.
2009-05-19,Milwaukee Brewers recalled Hernan Iribarren from Nashville Sounds.
2009-05-19,Brian Anderson roster status changed by Chicago White Sox.
2009-05-19,Chicago White Sox optioned Brent Lillibridge to Charlotte Knights.
