date,transaction
2009-08-17,Lakeland Flying Tigers Traded RHP Brett Jacobson to Frederick Keys and Baltimore Orioles Traded 1B Aubrey Huff to Detroit Tigers.
2009-08-17,Detroit Tigers transferred RHP Joel Zumaya from the 15-day disabled list to the 60-day disabled list.
2009-08-17,Washington Nationals selected the contract of 1B Michael Morse from Syracuse Chiefs.
2009-08-17,Chicago Cubs optioned Justin Berg to Iowa Cubs.
2009-08-17,Chicago Cubs activated LHP Ted Lilly from the 15-day disabled list.
2009-08-17,St. Louis Cardinals signed RHP Shelby Miller.
2009-08-17,Kansas City Royals signed C Wil Myers.
2009-08-17,Kansas City Royals signed LHP Chris Dwyer.
2009-08-17,Oakland Athletics optioned Aaron Cunningham to Sacramento River Cats.
2009-08-17,Florida Marlins signed LHP Chad James.
2009-08-17,Florida Marlins signed RHP Bryan Berglund.
2009-08-17,Milwaukee Brewers signed OF Kentrail Davis.
2009-08-17,Milwaukee Brewers signed SS Scooter Gennett.
2009-08-17,San Diego Padres signed OF Donavan Tate.
2009-08-17,San Diego Padres signed RHP Keyvius Sampson.
2009-08-17,San Diego Padres signed OF Everett Williams.
2009-08-17,Toronto Blue Jays signed OF Jake Marisnick.
2009-08-17,Toronto Blue Jays signed 1B K.C. Hobson.
2009-08-17,Oakland Athletics signed LHP Ian Krol.
2009-08-17,Oakland Athletics signed SS Grant Green.
2009-08-17,Minnesota Twins signed RHP Kyle Gibson.
2009-08-17,Seattle Mariners signed 2B Dustin Ackley.
2009-08-17,Baltimore Orioles signed SS Mychal Givens.
2009-08-17,Washington Nationals signed RHP Nathan Karns.
2009-08-17,Seattle Mariners signed RHP Tyler Blandford.
2009-08-17,Washington Nationals signed RHP Stephen Strasburg.
2009-08-17,Cleveland Indians signed RHP Alex White.
2009-08-17,Texas Rangers signed LHP Paul Strong.
2009-08-17,Colorado Rockies signed LHP Tyler Matzek.
2009-08-17,San Francisco Giants signed RHP Zack Wheeler.
2009-08-17,San Francisco Giants signed C Tommy Joseph.
2009-08-17,Detroit Tigers signed RHP Jacob Turner.
2009-08-17,Detroit Tigers signed LHP Andy Oliver.
2009-08-17,Detroit Tigers signed SS Daniel Fields.
2009-08-17,Boston Red Sox signed 3B David Renfroe.
2009-08-17,Boston Red Sox signed RHP Madison Younginer.
2009-08-17,Boston Red Sox signed RHP Kendal Volz.
2009-08-17,New York Mets signed LHP Steven Matz.
2009-08-17,New York Mets signed C Jeff Glenn.
2009-08-17,Milwaukee Brewers signed RHP Leonard Lorenzo.
2009-08-17,Baltimore Orioles signed OF Kyle Hoppy.
2009-08-17,San Francisco Giants signed free agent 1B Brandon Belt to a minor league contract.
2009-08-17,Oakland Athletics signed C Max Stassi.
2009-08-17,New York Yankees signed RHP Bryan Mitchell.
2009-08-18,Baltimore Orioles optioned Matt Albers to Norfolk Tides.
2009-08-18,Baltimore Orioles recalled RHP Kam Mickolio from Norfolk Tides.
2009-08-18,Minnesota Twins placed LHP Francisco Liriano on the 15-day disabled list. Left arm fatigue.
2009-08-18,Minnesota Twins selected the contract of Philip Humber from Rochester Red Wings.
2009-08-18,Detroit Tigers designated RHP Chris Lambert for assignment.
2009-08-18,Florida Marlins recalled Gaby Sanchez from New Orleans Zephyrs.
2009-08-18,Florida Marlins optioned Rick van den Hurk to New Orleans Zephyrs.
2009-08-18,Detroit Tigers optioned Eddie Bonine to Toledo Mud Hens.
2009-08-18,Detroit Tigers activated 1B Aubrey Huff.
2009-08-18,Daniel Cabrera assigned to Reno Aces from Arizona Diamondbacks.
2009-08-18,Kansas City Royals optioned Alex Gordon to Omaha Royals.
2009-08-18,Chicago White Sox selected the contract of RHP Freddy Garcia from Charlotte Knights.
2009-08-18,"Chicago White Sox placed CF Dewayne Wise on the 15-day disabled list retroactive to August 15, 2009. Strained right shoulder."
2009-08-18,Texas Rangers recalled Guillermo Moscoso from Oklahoma City RedHawks.
2009-08-18,Guillermo Moscoso roster status changed by Texas Rangers.
2009-08-18,"Texas Rangers placed 2B Esteban German on the 15-day disabled list retroactive to August 14, 2009. Right groin strain."
2009-08-18,Toronto Blue Jays recalled Travis Snider from Las Vegas 51s.
2009-08-18,Toronto Blue Jays optioned Joe Inglett to Las Vegas 51s.
2009-08-18,Baltimore Orioles selected the contract of Michael Aubrey from Norfolk Tides.
2009-08-18,New York Mets selected the contract of Wilson Valdez from Buffalo Bisons.
2009-08-18,Kyle Farnsworth roster status changed by Kansas City Royals.
2009-08-18,Houston Astros Traded C Ivan Rodriguez to Texas Rangers and Hickory Crawdads Traded RHP Matt Nevarez to Astros Organization.
2009-08-18,Houston Astros recalled Edwin Maysonet from Round Rock Express.
2009-08-18,RHP Leonard Lorenzo assigned to DSL Orioles/Brewers from Milwaukee Brewers.
2009-08-18,Texas Rangers designated C Kevin Richardson for assignment.
2009-08-18,"Houston Astros placed LHP Mike Hampton on the 15-day disabled list retroactive to August 14, 2009. Strained left shoulder."
2009-08-18,Nick Franklin assigned to AZL Mariners from Seattle Mariners.
2009-08-18,Boston Red Sox sent Chris Woodward outright to Pawtucket Red Sox.
2009-08-18,Minnesota Twins designated 1B Matt Macri for assignment.
2009-08-18,"New York Mets placed SS Alex Cora on the 60-day disabled list retroactive to August 13, 2009. Ligament injuries to both thumbs."
2009-08-18,New York Yankees signed JR Murphy.
2009-08-18,Arizona Diamondbacks signed Matt Helm.
2009-08-18,Freddy Sanchez roster status changed by San Francisco Giants.
2009-08-18,RHP Nathan Karns assigned to GCL Nationals from Washington Nationals.
2009-08-19,Houston Astros recalled RHP Felipe Paulino from Round Rock Express.
2009-08-19,Tampa Bay Rays optioned Reid Brignac to Durham Bulls.
2009-08-19,Tampa Bay Rays activated RHP Chad Bradford from the 15-day disabled list.
2009-08-19,St. Louis Cardinals signed free agent RHP John Smoltz.
2009-08-19,"Cleveland Indians placed RF Trevor Crowe on the 15-day disabled list retroactive to August 17, 2009. right internal oblique strain"
2009-08-19,Cleveland Indians recalled Matt LaPorta from Columbus Clippers.
2009-08-19,"Texas Rangers placed LHP Eddie Guardado on the 15-day disabled list retroactive to August 15, 2009. Left knee inflammation."
2009-08-19,Texas Rangers recalled Willie Eyre from Oklahoma City RedHawks.
2009-08-19,Cincinnati Reds selected the contract of CF Drew Stubbs from Louisville Bats.
2009-08-19,Cincinnati Reds placed CF Willy Taveras on the 15-day disabled list. Strained left quadriceps muscle.
2009-08-19,Los Angeles Dodgers recalled Tony Abreu from Albuquerque Isotopes.
2009-08-19,Milwaukee Brewers Traded Bill Hall to Seattle Mariners and High Desert Mavericks Traded RHP Ruben Flores to Brevard County Manatees.
2009-08-19,"Los Angeles Dodgers placed RHP Hiroki Kuroda on the 15-day disabled list retroactive to August 16, 2009. Concussion"
2009-08-19,Oakland Athletics sent Chris Schroder outright to Sacramento River Cats.
2009-08-19,St. Louis Cardinals optioned Mitchell Boggs to Memphis Redbirds.
2009-08-19,Detroit Tigers signed 1B James Robbins.
2009-08-19,Seattle Mariners transferred LHP Erik Bedard from the 15-day disabled list to the 60-day disabled list.
2009-08-19,Kansas City Royals released 3B Travis Metcalf.
2009-08-19,Boston Red Sox signed RHP Eric Curtis.
2009-08-20,Los Angeles Dodgers signed free agent RHP Vicente Padilla to a minor league contract.
2009-08-20,JR Murphy assigned to GCL Yankees from New York Yankees.
2009-08-20,Seattle Mariners optioned Garrett Olson to Tacoma Rainiers.
2009-08-20,"Cincinnati Reds placed RHP Johnny Cueto on the 15-day disabled list retroactive to August 16, 2009. Right shoulder inflammation."
2009-08-20,Micah Owings roster status changed by Cincinnati Reds.
2009-08-20,Baltimore Orioles claimed RHP Chris Lambert off waivers from Detroit Tigers.
2009-08-20,Baltimore Orioles optioned Chris Lambert to Norfolk Tides.
2009-08-20,Matt Helm assigned to Yakima Bears from Arizona Diamondbacks.
2009-08-20,Texas Rangers traded 2B Jose Vallejo to Houston Astros.
2009-08-20,Texas Rangers optioned Guillermo Moscoso to Oklahoma City RedHawks.
2009-08-20,Texas Rangers activated RF Nelson Cruz from the 15-day disabled list.
2009-08-20,New York Mets released RHP Livan Hernandez.
2009-08-20,Billy Wagner roster status changed by New York Mets.
2009-08-20,Portland Beavers traded RHP Scott Patterson to Oakland Athletics.
2009-08-20,RHP John Smoltz assigned to St. Louis Cardinals.
2009-08-20,St. Louis Cardinals optioned LHP Jaime Garcia to Memphis Redbirds.
2009-08-20,Pittsburgh Pirates sent OF Jeff Salazar outright to Indianapolis Indians.
2009-08-20,Detroit Tigers signed Austin Wood.
2009-08-20,San Diego Padres signed Jorge Reyes.
2009-08-20,Edwin Encarnacion roster status changed by Toronto Blue Jays.
2009-08-21,Florida Marlins optioned Cristhian Martinez to Jacksonville Suns.
2009-08-21,Anibal Sanchez roster status changed by Florida Marlins.
2009-08-21,Jeff Malm assigned to GCL Rays from Tampa Bay Rays.
2009-08-21,Boston Red Sox optioned Brian Anderson to Pawtucket Red Sox.
2009-08-21,Boston Red Sox activated RF Rocco Baldelli from the 15-day disabled list.
2009-08-21,"Milwaukee Brewers placed RHP Jesus Colome on the 15-day disabled list retroactive to August 18, 2009. Right forearm strain."
2009-08-21,Milwaukee Brewers selected the contract of LHP Chris Narveson from Helena Brewers.
2009-08-21,Milwaukee Brewers designated C Carlos Corporan for assignment.
2009-08-21,Boston Red Sox recalled Michael Bowden from Pawtucket Red Sox.
2009-08-21,Boston Red Sox designated RHP Fernando Cabrera for assignment.
2009-08-21,"Oakland Athletics placed 1B Bobby Crosby on the 15-day disabled list retroactive to August 18, 2009. strained left calf"
2009-08-21,Daric Barton roster status changed by Oakland Athletics.
2009-08-21,Texas Rangers sent Kevin Richardson outright to Oklahoma City RedHawks.
2009-08-21,New York Yankees activated LHP Damaso Marte from the 60-day disabled list.
2009-08-21,New York Yankees optioned 3B Ramiro Pena to Scranton/Wilkes-Barre Yankees.
2009-08-21,Pittsburgh Pirates placed RHP Jeff Karstens on the bereavement list.
2009-08-21,Pittsburgh Pirates activated LHP Phil Dumatrait from the 60-day disabled list.
2009-08-21,Pittsburgh Pirates transferred RHP Evan Meek from the 15-day disabled list to the 60-day disabled list.
2009-08-21,Baltimore Orioles signed Michael Ohlman.
2009-08-21,Boston Red Sox activated RHP Michael Bowden.
2009-08-22,Minnesota Twins optioned Anthony Swarzak to Rochester Red Wings.
2009-08-22,Boston Red Sox optioned Michael Bowden to Pawtucket Red Sox.
2009-08-22,Austin Wood assigned to GCL Tigers from Detroit Tigers.
2009-08-22,Los Angeles Angels recalled Rafael Rodriguez from Salt Lake Bees.
2009-08-22,Los Angeles Angels optioned Sean O'Sullivan to Salt Lake Bees.
2009-08-22,Boston Red Sox selected the contract of RHP Enrique Gonzalez from Pawtucket Red Sox.
2009-08-22,C Joey Schoenfeld assigned to GCL Pirates from Pittsburgh Pirates.
2009-08-22,Seattle Mariners optioned Chris Jakubauskas to Tacoma Rainiers.
2009-08-22,Seattle Mariners selected the contract of Randy Messenger from Tacoma Rainiers.
2009-08-22,Seattle Mariners released RHP Luis Pena.
2009-08-22,Houston Astros signed free agent RHP Armando Benitez to a minor league contract.
2009-08-22,Jason Grilli roster status changed by Texas Rangers.
2009-08-22,Texas Rangers optioned RHP Willie Eyre to Oklahoma City RedHawks.
2009-08-22,Jorge Reyes assigned to Eugene Emeralds from San Diego Padres.
2009-08-22,Arizona Diamondbacks optioned Josh Whitesell to Reno Aces.
2009-08-22,Arizona Diamondbacks recalled Brandon Allen from Reno Aces.
2009-08-22,New York Mets designated Andy Green for assignment.
2009-08-22,New York Mets recalled Pat Misch from Buffalo Bisons.
2009-08-22,Colorado Rockies selected the contract of RHP Matt Herges from Colorado Springs Sky Sox.
2009-08-22,Vicente Padilla assigned to Albuquerque Isotopes from Los Angeles Dodgers.
2009-08-22,Colorado Rockies placed RHP Aaron Cook on the 15-day disabled list. right shoulder strain
2009-08-22,Colorado Rockies transferred RHP Manny Corpas from the 15-day disabled list to the 60-day disabled list. right elbow inflammation
2009-08-22,Pat Misch roster status changed by New York Mets.
2009-08-22,St. Louis Cardinals placed RHP Kyle Lohse on the 15-day disabled list. Strained left groin.
2009-08-22,St. Louis Cardinals recalled RHP Mitchell Boggs from Memphis Redbirds.
2009-08-22,New York Yankees signed CF Slade Heathcott.
2009-08-23,RHP Armando Benitez assigned to Round Rock Express from Houston Astros.
2009-08-23,Florida Marlins placed RHP Brendan Donnelly on the 15-day disabled list. strained right calf
2009-08-23,Florida Marlins recalled Cristhian Martinez from Jacksonville Suns.
2009-08-23,Michael Ohlman assigned to GCL Orioles from Baltimore Orioles.
2009-08-23,Philadelphia Phillies selected the contract of SS Miguel Cairo from Lehigh Valley IronPigs.
2009-08-23,Cincinnati Reds activated 3B Scott Rolen from the 15-day disabled list.
2009-08-23,"Cincinnati Reds placed RHP Aaron Harang on the 15-day disabled list retroactive to August 21, 2008. Appendectomy"
2009-08-23,"Philadelphia Phillies placed 3B Greg Dobbs on the 15-day disabled list retroactive to August 22, 2009. Strained right calf"
2009-08-23,Philadelphia Phillies transferred LHP Antonio Bastardo from the 15-day disabled list to the 60-day disabled list.
2009-08-23,Dennys Reyes roster status changed by St. Louis Cardinals.
2009-08-24,New York Mets recalled LHP Ken Takahashi from Buffalo Bisons.
2009-08-24,New York Mets optioned LHP Pat Misch to Buffalo Bisons.
2009-08-24,Colorado Rockies signed free agent 1B Jason Giambi to a minor league contract.
2009-08-24,Jason Giambi assigned to Colorado Springs Sky Sox from Colorado Rockies.
2009-08-24,Minnesota Twins recalled Armando Gabino from Rochester Red Wings.
2009-08-24,Everett Williams assigned to AZL Padres from San Diego Padres.
2009-08-24,Keyvius Sampson assigned to AZL Padres from San Diego Padres.
2009-08-24,Kansas City Royals selected the contract of RHP Yasuhiko Yabuta from Omaha Royals.
2009-08-24,Kansas City Royals designated Ron Mahay for assignment.
2009-08-24,Cincinnati Reds placed LF Chris Dickerson on the 15-day disabled list. Severely sprained his left ankle.
2009-08-24,Cincinnati Reds placed C Ryan Hanigan on the 15-day disabled list. Concussion.
2009-08-24,Toronto Blue Jays activated LHP Scott Downs from the 15-day disabled list.
2009-08-24,"Toronto Blue Jays placed 3B Edwin Encarnacion on the 15-day disabled list retroactive to August 21, 2009. Strained left hamstring."
2009-08-24,New York Mets optioned Andy Green to Buffalo Bisons.
2009-08-24,San Diego Padres optioned Cesar Carrillo to Portland Beavers.
2009-08-24,San Diego Padres recalled Adam Russell from Portland Beavers.
2009-08-24,Adam Russell roster status changed by San Diego Padres.
2009-08-25,Cincinnati Reds selected the contract of Darnell McDonald from Louisville Bats.
2009-08-25,Cincinnati Reds selected the contract of Corky Miller from Louisville Bats.
2009-08-25,New York Mets traded LHP Billy Wagner to Boston Red Sox.
2009-08-25,New York Mets recalled Pat Misch from Buffalo Bisons.
2009-08-25,New York Mets recalled Nick Evans from Buffalo Bisons.
2009-08-25,"New York Mets placed LHP Johan Santana on the 15-day disabled list retroactive to August 21, 2009. Bone chips in his left elbow."
2009-08-25,Cincinnati Reds transferred RHP Mike Lincoln from the 15-day disabled list to the 60-day disabled list.
2009-08-25,Cincinnati Reds transferred RHP Edinson Volquez from the 15-day disabled list to the 60-day disabled list.
2009-08-25,Milwaukee Brewers optioned Hernan Iribarren to Nashville Sounds.
2009-08-25,Milwaukee Brewers activated RHP Jeff Suppan from the 15-day disabled list.
2009-08-25,Texas Rangers recalled Chris Davis from Oklahoma City RedHawks.
2009-08-25,"Texas Rangers placed RF Andruw Jones on the 15-day disabled list retroactive to August 24, 2009. left hamstring strain"
2009-08-25,Chicago Cubs optioned Esmailin Caridad to Iowa Cubs.
2009-08-25,Chicago Cubs activated RHP Carlos Zambrano from the 15-day disabled list.
2009-08-25,Colorado Rockies placed CF Dexter Fowler on the 15-day disabled list. bruised right knee
2009-08-25,Colorado Rockies optioned RHP Adam Eaton to Colorado Springs Sky Sox.
2009-08-25,Colorado Rockies recalled Matt Murton from Colorado Springs Sky Sox.
2009-08-25,Colorado Rockies recalled Eric Young from Colorado Springs Sky Sox.
2009-08-25,San Francisco Giants recalled Ryan Rohlinger from Fresno Grizzlies.
2009-08-25,"San Francisco Giants placed 2B Freddy Sanchez on the 15-day disabled list retroactive to August 18, 2009. Strained left shoulder."
2009-08-26,Washington Nationals signed free agent RHP Livan Hernandez.
2009-08-26,Washington Nationals transferred 1B Dmitri Young from the 15-day disabled list to the 60-day disabled list.
2009-08-26,Washington Nationals optioned Collin Balester to Syracuse Chiefs.
2009-08-26,"Florida Marlins placed 1B Nick Johnson on the 15-day disabled list retroactive to August 17, 2009. Strained right hamstring."
2009-08-26,San Diego Padres recalled Drew Macias from Portland Beavers.
2009-08-26,"San Diego Padres placed RHP Mike Adams on the 15-day disabled list retroactive to August 22, 2009. Strained right shoulder."
2009-08-26,Joe Saunders roster status changed by Los Angeles Angels.
2009-08-26,Los Angeles Angels designated RHP Shane Loux for assignment.
2009-08-26,Florida Marlins recalled RF Brett Carroll from New Orleans Zephyrs.
2009-08-26,Shelby Miller assigned to Quad Cities River Bandits from St. Louis Cardinals.
2009-08-26,Kyle Hoppy assigned to GCL Orioles from Baltimore Orioles.
2009-08-26,Tim Wakefield roster status changed by Boston Red Sox.
2009-08-26,Boston Red Sox designated RHP Enrique Gonzalez for assignment.
2009-08-26,Detroit Tigers optioned Armando Galarraga to Toledo Mud Hens.
2009-08-26,New York Mets placed LHP Oliver Perez on the 15-day disabled list. Patellar tendinitis in his right knee.
2009-08-26,New York Mets recalled Lance Broadway from Buffalo Bisons.
2009-08-26,Colorado Rockies activated RHP Juan Rincon from the 15-day disabled list.
2009-08-26,Colorado Rockies designated Matt Murton for assignment.
2009-08-26,Justin Upton roster status changed by Arizona Diamondbacks.
2009-08-26,Arizona Diamondbacks optioned Daniel Schlereth to Reno Aces.
2009-08-26,"Pittsburgh Pirates placed RHP Jeff Karstens on the 15-day disabled list retroactive to August 25, 2009. Strained lower back."
2009-08-26,Milwaukee Brewers sent Chase Wright outright to Nashville Sounds.
2009-08-27,Texas Rangers purchased contract of RHP Pedro Strop from Oklahoma City RedHawks.
2009-08-27,Milwaukee Brewers activated RHP Dave Bush from the 15-day disabled list.
2009-08-27,Milwaukee Brewers optioned RHP Mike Burns to Nashville Sounds.
2009-08-27,Boston Red Sox released RHP Brad Penny.
2009-08-27,Texas Rangers designated Jason Jennings for assignment.
2009-08-27,Los Angeles Dodgers recalled RHP Vicente Padilla from Albuquerque Isotopes.
2009-08-27,Los Angeles Dodgers transferred RHP Jason Schmidt from the 15-day disabled list to the 60-day disabled list.
2009-08-27,Los Angeles Dodgers optioned Tony Abreu to Albuquerque Isotopes.
2009-08-27,Boston Red Sox activated LHP Billy Wagner.
2009-08-27,Fernando Cabrera assigned to Pawtucket Red Sox from Boston Red Sox.
2009-08-27,Atlanta Braves optioned Manny Acosta to Gwinnett Braves.
2009-08-27,Atlanta Braves recalled Buddy Carlyle from Gwinnett Braves.
2009-08-27,Baltimore Orioles signed Jeff Walters.
2009-08-28,Washington Nationals selected the contract of Pete Orr from Syracuse Chiefs.
2009-08-28,Washington Nationals placed CF Nyjer Morgan on the 15-day disabled list. Fractured left hand.
2009-08-28,Washington Nationals transferred RHP Jordan Zimmermann from the 15-day disabled list to the 60-day disabled list.
2009-08-28,Houston Astros recalled Wilton Lopez from Corpus Christi Hooks.
2009-08-28,"Houston Astros placed RHP Alberto Arias on the 15-day disabled list retroactive to August 24, 2009. Strained right hamstring."
2009-08-28,Arizona Diamondbacks traded RHP Jon Rauch to Minnesota Twins.
2009-08-28,Minnesota Twins sent RHP Philip Humber outright to Rochester Red Wings.
2009-08-28,Nate Robertson roster status changed by Detroit Tigers.
2009-08-28,Minnesota Twins traded RHP Yohan Pino to Cleveland Indians.
2009-08-28,Oakland Athletics recalled Eric Patterson from Sacramento River Cats.
2009-08-28,Oakland Athletics optioned Tommy Everidge to Sacramento River Cats.
2009-08-28,Arizona Diamondbacks selected the contract of John Hester from Reno Aces.
2009-08-28,San Francisco Giants recalled Alex Hinshaw from Fresno Grizzlies.
2009-08-28,San Francisco Giants optioned Joe Martinez to Fresno Grizzlies.
2009-08-28,Texas Rangers signed free agent RF Ryan Freel to a minor league contract.
2009-08-28,Boston Red Sox sent RHP Enrique Gonzalez outright to Pawtucket Red Sox.
2009-08-28,Colorado Rockies optioned Matt Murton to Colorado Springs Sky Sox.
2009-08-29,"Minnesota Twins placed 3B Joe Crede on the 15-day disabled list retroactive to August 22, 2009. Strained lower back."
2009-08-29,Minnesota Twins recalled C Jose Morales from Rochester Red Wings.
2009-08-29,Minnesota Twins optioned Armando Gabino to Rochester Red Wings.
2009-08-29,Rancho Cucamonga Quakes Traded 3B Matthew Sweeney to Charlotte Stone Crabs; Arkansas Travelers Traded LHP Alex Torres to Montgomery Biscuits and Tampa Bay Rays Traded LHP Scott Kazmir to Los Angeles Angels.
2009-08-29,Florida Marlins optioned Gaby Sanchez to New Orleans Zephyrs.
2009-08-29,Florida Marlins optioned Chris Volstad to New Orleans Zephyrs.
2009-08-29,Los Angeles Angels sent RHP Shane Loux outright to Salt Lake Bees.
2009-08-29,Akinori Iwamura roster status changed by Tampa Bay Rays.
2009-08-29,Minnesota Twins designated RHP R.A. Dickey for assignment.
2009-08-29,Minnesota Twins signed free agent LHP Ron Mahay.
2009-08-29,Cincinnati Reds optioned Kevin Barker to Louisville Bats.
2009-08-29,Cincinnati Reds recalled Matt Maloney from Louisville Bats.
2009-08-29,Florida Marlins recalled RHP Luis Ayala from New Orleans Zephyrs.
2009-08-29,Florida Marlins recalled Tim Wood from New Orleans Zephyrs.
2009-08-29,San Diego Padres placed RF Kyle Blanks on the 15-day disabled list. strained arch in right foot
2009-08-29,San Diego Padres recalled Wade LeBlanc from Portland Beavers.
2009-08-29,OF Ryan Freel assigned to Oklahoma City RedHawks from Texas Rangers.
2009-08-29,Arizona Diamondbacks optioned Trent Oeltjen to Reno Aces.
2009-08-29,Arizona Diamondbacks recalled CF Chris Young from Reno Aces.
2009-08-29,Arizona Diamondbacks recalled Daniel Schlereth from Reno Aces.
2009-08-29,Boston Red Sox recalled Marcus McBeth from Pawtucket Red Sox.
2009-08-29,Boston Red Sox optioned Junichi Tazawa to GCL Red Sox.
2009-08-29,Seattle Mariners placed 1B Russell Branyan on the 15-day disabled list. Herniated disk
2009-08-29,Seattle Mariners recalled Chris Jakubauskas from Tacoma Rainiers.
2009-08-29,"Arizona Diamondbacks placed C Chris Snyder on the 15-day disabled list retroactive to August 23, 2009. Lower back inflammation."
2009-08-30,Los Angeles Angels optioned Rafael Rodriguez to Salt Lake Bees.
2009-08-30,Boston Red Sox selected the contract of RHP Paul Byrd from Pawtucket Red Sox.
2009-08-30,Boston Red Sox optioned RHP Marcus McBeth to Pawtucket Red Sox.
2009-08-30,Great Lakes Loons traded RHP Luis Garcia to Washington Nationals.
2009-08-30,Philadelphia Phillies signed RHP Brody Colvin.
2009-08-30,Los Angeles Dodgers placed RHP Guillermo Mota on the 15-day disabled list.
2009-08-30,San Diego Padres signed free agent RHP Sean Heimpel to a minor league contract.
2009-08-31,Washington Nationals traded 2B Ronnie Belliard to Los Angeles Dodgers.
2009-08-31,Pittsburgh Pirates optioned Brian Bixler to Indianapolis Indians.
2009-08-31,Los Angeles Dodgers designated RHP Jesus Castillo for assignment.
2009-08-31,Pittsburgh Pirates selected the contract of Daniel McCutchen from Indianapolis Indians.
2009-08-31,Philadelphia Phillies selected the contract of RHP John Ennis from Lehigh Valley IronPigs.
2009-08-31,Philadelphia Phillies designated 2B Brad Harman for assignment.
2009-08-31,Pittsburgh Pirates designated RHP Jon Meloan for assignment.
2009-08-31,Cincinnati Reds activated RHP Johnny Cueto from the 15-day disabled list.
2009-08-31,Cincinnati Reds optioned Matt Maloney to Carolina Mudcats.
2009-08-31,Cincinnati Reds optioned Carlos Fisher to Sarasota Reds.
2009-08-31,Cincinnati Reds recalled Kevin Barker from Louisville Bats.
2009-08-31,Cincinnati Reds recalled Ramon A. Ramirez from Louisville Bats.
2009-08-31,Cincinnati Reds placed LF Laynce Nix on the 15-day disabled list. Bulging cervical disc
2009-08-31,Chad Qualls roster status changed by Arizona Diamondbacks.
2009-08-31,Arizona Diamondbacks recalled Billy Buckner from Reno Aces.
2009-08-31,Washington Nationals recalled Justin Maxwell from Syracuse Chiefs.
2009-08-31,Guillermo Mota roster status changed by Los Angeles Dodgers.
2009-08-31,Chicago White Sox Traded 1B Jim Thome to Los Angeles Dodgers and Inland Empire 66ers Traded SS Justin Fuller to Winston-Salem Dash.
2009-08-31,Arizona Diamondbacks traded RHP Jon Garland to Los Angeles Dodgers.
2009-08-31,Chicago White Sox Traded RHP Jose Contreras to Colorado Rockies and Colorado Springs Sky Sox Traded RHP Brandon Hynick to Charlotte Knights.
2009-08-31,Atlanta Braves sent Brian Barton outright to Gwinnett Braves.
2009-08-31,Zack Dodson assigned to GCL Pirates from Pittsburgh Pirates.
2009-08-31,Colorado Rockies designated C Edwin Bellorin for assignment.
2009-08-31,Los Angeles Dodgers recalled RHP Travis Schlichting from Albuquerque Isotopes.
2009-09-01,New York Mets selected the contract of Josh Thole from Binghamton Mets.
2009-09-01,San Francisco Giants signed free agent RHP Brad Penny.
2009-09-01,Florida Marlins designated Luis Ayala for assignment.
2009-09-01,Florida Marlins recalled Cameron Maybin from New Orleans Zephyrs.
