date,transaction
2009-06-20,Tampa Bay Rays signed Jason Patton.
2009-06-20,Tampa Bay Rays signed Cody Rogers.
2009-06-20,Tampa Bay Rays signed Daniel Rhault.
2009-06-20,Tampa Bay Rays signed Kyle Spraker.
2009-06-20,Tampa Bay Rays signed Ryan Wiegand.
2009-06-20,Boston Red Sox signed OF Seth Schwindenhammer.
2009-06-20,Boston Red Sox signed RHP Tom Ebert.
2009-06-20,Boston Red Sox signed RHP Jordan Flasher.
2009-06-20,Boston Red Sox signed RHP Kyle Rutter.
2009-06-20,Boston Red Sox signed 2B Jordan Sallis.
2009-06-20,Pittsburgh Pirates signed RHP Vic Black.
2009-06-20,Colorado Rockies signed Dustin Garneau.
2009-06-20,Colorado Rockies signed Nathan Hines.
2009-06-20,Colorado Rockies signed Chris Balcom-Miller.
2009-06-20,Colorado Rockies signed Paul Bargas.
2009-06-20,Colorado Rockies signed Clinton McKinney.
2009-06-20,Colorado Rockies signed Clint Tilford.
2009-06-20,Arizona Diamondbacks signed Keon Broxton.
2009-06-20,Arizona Diamondbacks signed Paul Goldschmidt.
2009-06-20,Arizona Diamondbacks signed David Narodowski.
2009-06-20,Arizona Diamondbacks signed Roidany Aguila.
2009-06-20,Arizona Diamondbacks signed Scottie Allen.
2009-06-20,Arizona Diamondbacks signed Chase Anderson.
2009-06-20,Arizona Diamondbacks signed Mike Belfiore.
2009-06-20,Arizona Diamondbacks signed Charles Brewer.
2009-06-20,Arizona Diamondbacks signed Keith Cantwell.
2009-06-20,Arizona Diamondbacks signed Bradin Hagens.
2009-06-20,Arizona Diamondbacks signed Ryan Robowski.
2009-06-20,Arizona Diamondbacks signed Adam Worthington.
2009-06-21,Toronto Blue Jays optioned Joe Inglett to Las Vegas 51s.
2009-06-21,Toronto Blue Jays selected the contract of LF Russ Adams from Las Vegas 51s.
2009-06-21,Chicago Cubs signed RHP Robert Whitenack.
2009-06-21,Washington Nationals recalled RHP Tyler Clippard from Syracuse Chiefs.
2009-06-21,Chicago Cubs recalled Kevin Hart from Iowa Cubs.
2009-06-21,Chicago Cubs placed RHP Angel Guzman on the 15-day disabled list. right triceps strain
2009-06-21,"Boston Red Sox placed RHP Daisuke Matsuzaka on the 15-day disabled list retroactive to June 20, 2009. mild right shoulder strain"
2009-06-21,Boston Red Sox recalled Dusty Brown from Pawtucket Red Sox.
2009-06-21,Justin Bour assigned to AZL Cubs from Chicago Cubs.
2009-06-21,Florida Marlins recalled Tim Wood from New Orleans Zephyrs.
2009-06-21,Los Angeles Dodgers sent LHP Eric Milton on a rehab assignment to Inland Empire 66ers.
2009-06-21,Tim Clubb assigned to AZL Cubs from Chicago Cubs.
2009-06-21,Barrett Dail assigned to AZL Cubs from Chicago Cubs.
2009-06-21,Jesse Ginley assigned to AZL Cubs from Chicago Cubs.
2009-06-21,Steve Grife assigned to AZL Cubs from Chicago Cubs.
2009-06-21,Matt Williams assigned to AZL Cubs from Chicago Cubs.
2009-06-21,D.J. Fitzgerald assigned to AZL Cubs from Chicago Cubs.
2009-06-21,San Francisco Giants signed 3B Kyle Mach.
2009-06-21,Kyle Mach assigned to AZL Giants from San Francisco Giants.
2009-06-21,Leonardo Ochoa assigned to AZL Giants from San Francisco Giants.
2009-06-21,Baltimore Orioles optioned Alberto Castillo to Norfolk Tides.
2009-06-21,Gus Benusa assigned to AZL Giants from San Francisco Giants.
2009-06-21,Luis Munoz assigned to AZL Giants from San Francisco Giants.
2009-06-21,Ryan Scoma assigned to AZL Giants from San Francisco Giants.
2009-06-21,Jonathan White assigned to AZL Giants from San Francisco Giants.
2009-06-21,Jed Lowrie assigned to Pawtucket Red Sox from Boston Red Sox.
2009-06-21,LF Kyle Jensen assigned to Jamestown Jammers from Florida Marlins.
2009-06-21,RHP Aaron Davidson assigned to AZL Giants from San Francisco Giants.
2009-06-21,Kaohi Downing assigned to AZL Giants from San Francisco Giants.
2009-06-21,Addison Proszek assigned to AZL Giants from San Francisco Giants.
2009-06-21,Bryan Salsbury assigned to AZL Giants from San Francisco Giants.
2009-06-21,RHP Kevin Childs assigned to AZL Dodgers from Los Angeles Dodgers.
2009-06-21,RHP Justin Dignelli assigned to AZL Dodgers from Los Angeles Dodgers.
2009-06-21,Steve Cilladi assigned to AZL Dodgers from Los Angeles Dodgers.
2009-06-21,Michael Pericht assigned to AZL Dodgers from Los Angeles Dodgers.
2009-06-21,Casio Grider assigned to AZL Dodgers from Los Angeles Dodgers.
2009-06-21,Chris Henderson assigned to AZL Dodgers from Los Angeles Dodgers.
2009-06-21,Nick Akins assigned to AZL Dodgers from Los Angeles Dodgers.
2009-06-21,Stetson Banks assigned to AZL Dodgers from Los Angeles Dodgers.
2009-06-21,Austin King assigned to AZL Dodgers from Los Angeles Dodgers.
2009-06-21,Jon Berger assigned to AZL Padres from San Diego Padres.
2009-06-21,Brett Holland assigned to AZL Padres from San Diego Padres.
2009-06-21,RHP Kendall Korbal assigned to AZL Padres from San Diego Padres.
2009-06-21,RHP Tom Porter assigned to AZL Padres from San Diego Padres.
2009-06-21,Gary Poynter assigned to AZL Padres from San Diego Padres.
2009-06-21,SS Chris Ahearn assigned to AZL Padres from San Diego Padres.
2009-06-21,Cody Decker assigned to AZL Padres from San Diego Padres.
2009-06-21,Ryan Skube assigned to AZL Padres from San Diego Padres.
2009-06-21,CF Cameron Monger assigned to AZL Padres from San Diego Padres.
2009-06-21,Wande Olabisi assigned to AZL Padres from San Diego Padres.
2009-06-21,Brett Basham assigned to AZL Padres from San Diego Padres.
2009-06-21,C Dylan Tonneson assigned to AZL Padres from San Diego Padres.
2009-06-21,Claudio Bavera assigned to AZL Royals from Kansas City Royals.
2009-06-21,Eric Diaz assigned to AZL Royals from Kansas City Royals.
2009-06-21,Richard Folmer assigned to AZL Royals from Kansas City Royals.
2009-06-21,Tyler Sample assigned to AZL Royals from Kansas City Royals.
2009-06-21,RHP Jacob Theis assigned to AZL Royals from Kansas City Royals.
2009-06-21,Josh Worrell assigned to AZL Royals from Kansas City Royals.
2009-06-21,Geoffrey Baldwin assigned to AZL Royals from Kansas City Royals.
2009-06-21,Ryan Stovall assigned to AZL Royals from Kansas City Royals.
2009-06-21,Max Peterson assigned to AZL Athletics from Oakland Athletics.
2009-06-21,Ryan Quigley assigned to AZL Athletics from Oakland Athletics.
2009-06-21,Murphy Smith assigned to AZL Athletics from Oakland Athletics.
2009-06-21,Daniel Tenholder assigned to AZL Athletics from Oakland Athletics.
2009-06-21,Michael Affronti assigned to AZL Athletics from Oakland Athletics.
2009-06-21,Mike Gilmartin assigned to AZL Athletics from Oakland Athletics.
2009-06-21,Stephen Parker assigned to AZL Athletics from Oakland Athletics.
2009-06-21,Jeremy Wells assigned to AZL Athletics from Oakland Athletics.
2009-06-21,Mike Spina assigned to AZL Athletics from Oakland Athletics.
2009-06-21,Myrio Richard assigned to AZL Athletics from Oakland Athletics.
2009-06-21,LF Anthione Shaw assigned to AZL Athletics from Oakland Athletics.
2009-06-21,C Jeremy Gillan assigned to AZL Angels from Los Angeles Angels.
2009-06-21,Eric Oliver assigned to AZL Angels from Los Angeles Angels.
2009-06-21,2B Phil Bando assigned to AZL Angels from Los Angeles Angels.
2009-06-21,DH Alibay Barkley assigned to AZL Angels from Los Angeles Angels.
2009-06-21,Michael Demperio assigned to AZL Angels from Los Angeles Angels.
2009-06-21,Richard Cates assigned to AZL Angels from Los Angeles Angels.
2009-06-21,Randal Grichuk assigned to AZL Angels from Los Angeles Angels.
2009-06-21,Matt Long assigned to AZL Angels from Los Angeles Angels.
2009-06-21,Jake Rife assigned to AZL Angels from Los Angeles Angels.
2009-06-21,Los Angeles Angels sent RHP Dustin Moseley on a rehab assignment to AZL Angels.
2009-06-21,Heath Nichols assigned to AZL Angels from Los Angeles Angels.
2009-06-21,Matt Oye assigned to AZL Angels from Los Angeles Angels.
2009-06-21,Dan Reynolds assigned to AZL Angels from Los Angeles Angels.
2009-06-21,Atlanta Braves sent LF Greg Norton on a rehab assignment to Gwinnett Braves.
2009-06-21,Milwaukee Brewers signed RHP Hiram Burgos.
2009-06-21,Minnesota Twins signed Billy Bullock.
2009-06-21,Minnesota Twins signed Tony Davis.
2009-06-21,Minnesota Twins signed Kane Holbrooks.
2009-06-21,Minnesota Twins signed C Tobias Streich.
2009-06-21,Minnesota Twins signed Paul-Michael Klingsberg.
2009-06-21,Minnesota Twins signed Derek McCallum.
2009-06-21,Minnesota Twins signed Chris Herrmann.
2009-06-21,St. Louis Cardinals signed Travis Tartamella.
2009-06-21,St. Louis Cardinals signed C.J. Beatty.
2009-06-21,St. Louis Cardinals signed Ross Smith.
2009-06-21,St. Louis Cardinals signed C Matt Adams.
2009-06-21,St. Louis Cardinals signed John Durham.
2009-06-21,St. Louis Cardinals signed Kyle Heim.
2009-06-21,St. Louis Cardinals purchased David Kington.
2009-06-21,St. Louis Cardinals signed David Kington.
2009-06-21,St. Louis Cardinals signed Travis Lawler.
2009-06-21,St. Louis Cardinals signed Andrew Moss.
2009-06-21,St. Louis Cardinals signed Jason Novak.
2009-06-21,St. Louis Cardinals signed Jesse Simpson.
2009-06-21,St. Louis Cardinals signed Justin Smith.
2009-06-21,St. Louis Cardinals signed RHP Aaron Terry.
2009-06-21,St. Louis Cardinals signed Michael Thompson.
2009-06-21,Baltimore Orioles signed Justin Anderson.
2009-06-21,Baltimore Orioles signed Josh Dowdy.
2009-06-21,Baltimore Orioles signed Blake Mechaw.
2009-06-21,Baltimore Orioles signed Michael Flacco.
2009-06-21,Baltimore Orioles signed Mike Planeta.
2009-06-21,Baltimore Orioles signed Kipp Schutz.
2009-06-21,Cleveland Indians signed RF Greg Folgia.
2009-06-21,Cleveland Indians signed Jeremy Johnson.
2009-06-21,Cincinnati Reds signed Blair Carson.
2009-06-21,Cincinnati Reds signed Chase Ware.
2009-06-21,Cincinnati Reds signed Jacob Wiley.
2009-06-21,Cincinnati Reds signed Billy Hamilton.
2009-06-21,Cincinnati Reds signed Carter Morrison.
2009-06-21,Seattle Mariners signed Brandon Josselyn.
2009-06-21,Seattle Mariners signed Eric Thomas.
2009-06-21,Chicago White Sox signed Harold Baines.
2009-06-21,Seattle Mariners signed Anthony Vasquez.
2009-06-21,Chicago White Sox signed Anthony Casario.
2009-06-21,Chicago White Sox signed Ryan Lee.
2009-06-21,Seattle Mariners signed Eric Valdez.
2009-06-21,Chicago White Sox signed Brady Shoemaker.
2009-06-21,Seattle Mariners signed Brandon Bantz.
2009-06-21,Chicago White Sox signed Dan Black.
2009-06-21,Chicago White Sox signed Kyle Davis.
2009-06-21,Seattle Mariners signed Vinnie Catricala.
2009-06-21,Seattle Mariners signed Tim Morris.
2009-06-21,Chicago White Sox signed Daniel Wagner.
2009-06-21,Seattle Mariners signed Julio Morban.
2009-06-21,Seattle Mariners signed Brandon Haveman.
2009-06-21,Seattle Mariners signed Greg Waddell.
2009-06-21,Chicago White Sox signed Robert Vaughn.
2009-06-21,Chicago White Sox signed Kyle Bellamy.
2009-06-21,Chicago White Sox signed Joseph Serafin.
2009-06-21,Chicago White Sox signed Goldy Simmons.
2009-06-21,Chicago White Sox signed Daniel Wiltz.
2009-06-21,Chicago White Sox signed Christopher Zagyi.
2009-06-21,Pittsburgh Pirates signed Mitchell Fienemann.
2009-06-21,New York Yankees signed RHP Julian Arballo.
2009-06-21,New York Yankees signed RHP Shane Greene.
2009-06-21,New York Yankees signed RHP Paul Heidler.
2009-06-21,New York Yankees signed RHP Dan Miller.
2009-06-21,New York Yankees signed C Buck Afenir.
2009-06-21,New York Yankees signed C Jeff Farnham.
2009-06-21,New York Yankees signed 2B Issac Harrow.
2009-06-21,New York Yankees signed IF Kevin Mahoney.
2009-06-21,New York Yankees signed OF Isaiah Brown.
2009-06-21,New York Yankees signed OF Justin Milo.
2009-06-21,Tampa Bay Rays signed Alexander Diaz.
2009-06-21,Tampa Bay Rays signed OF Hunter Pace.
2009-06-21,Toronto Blue Jays signed IF Garis Pena.
2009-06-21,Toronto Blue Jays signed IF Nicholas Bidois.
2009-06-21,Florida Marlins signed Harold Brantley.
2009-06-21,Florida Marlins signed Marquise Cooper.
2009-06-21,Florida Marlins signed Brent Keys.
2009-06-21,Florida Marlins signed 2B Nate Simon.
2009-06-21,Brent Weaver assigned to Florida Marlins.
2009-06-21,Toronto Blue Jays signed LHP Tyler Ybarra.
2009-06-21,Florida Marlins signed Dallas Hord.
2009-06-21,Florida Marlins signed Jobduan Morales.
2009-06-21,Florida Marlins signed Erick Carrillo.
2009-06-21,St. Louis Cardinals signed Patrick Daugherty.
2009-06-21,Florida Marlins signed Jared Eskew.
2009-06-21,St. Louis Cardinals signed Manuel De La Cruz.
2009-06-21,Florida Marlins signed Casey Fry.
2009-06-21,Florida Marlins signed Josh Hodges.
2009-06-21,St. Louis Cardinals signed Hector Hernandez.
2009-06-21,Florida Marlins signed Isaac Morales.
2009-06-21,St. Louis Cardinals signed Cale Johnson.
2009-06-21,St. Louis Cardinals signed Anthony Garcia.
2009-06-21,St. Louis Cardinals signed Tyler Bighames.
2009-06-21,Florida Marlins signed Holden Sprague.
2009-06-21,Florida Marlins signed Sean Teague.
2009-06-21,Florida Marlins signed Tyler Topp.
2009-06-21,St. Louis Cardinals signed Virgil Hill.
2009-06-21,St. Louis Cardinals signed David Washington.
2009-06-21,St. Louis Cardinals signed Jonathan Rodriguez.
2009-06-21,Toronto Blue Jays signed RHP David Slovak.
2009-06-21,Houston Astros signed RHP Enmanuel Cedano.
2009-06-21,Houston Astros signed LHP Spencer Hylander.
2009-06-21,Houston Astros signed RHP Juan Minaya.
2009-06-21,Houston Astros signed RHP Euris Quezada.
2009-06-21,Houston Astros signed RHP Michael Schurz.
2009-06-21,Atlanta Braves signed Jamie Hayes.
2009-06-21,Atlanta Braves signed Lucas La Point.
2009-06-21,Houston Astros signed IF Brandon Wilkerson.
2009-06-21,Atlanta Braves signed Aaron Northcraft.
2009-06-21,Atlanta Braves signed Andrew Wilson.
2009-06-21,OF Geber Suniaga assigned to Houston Astros.
2009-06-21,Houston Astros signed OF Garen Wright.
2009-06-21,Atlanta Braves signed Jakob Dalfonso.
2009-06-21,Atlanta Braves signed Chris Lovett.
2009-06-21,Atlanta Braves signed Matt Weaver.
2009-06-21,Houston Astros signed 3B Erik Castro.
2009-06-21,Baltimore Orioles signed Dustin Carder.
2009-06-21,Baltimore Orioles signed David Walters.
2009-06-21,San Francisco Giants signed 2B Nick Liles.
2009-06-21,Washington Nationals signed LHP Chad Jenkins.
2009-06-21,Washington Nationals signed Shane McCatty.
2009-06-21,Washington Nationals signed Danny Rosenbaum.
2009-06-21,Washington Nationals signed John Santiago.
2009-06-21,Washington Nationals signed Matt Swynenberg.
2009-06-21,Washington Nationals signed Kyle Breault.
2009-06-22,Detroit Tigers optioned Ryan Perry to Toledo Mud Hens.
2009-06-22,Patrick Keating assigned to Idaho Falls Chukars from Kansas City Royals.
2009-06-22,Brendan Lafferty assigned to Idaho Falls Chukars from Kansas City Royals.
2009-06-22,Cole White assigned to Idaho Falls Chukars from Kansas City Royals.
2009-06-22,Nick Wooley assigned to Idaho Falls Chukars from Kansas City Royals.
2009-06-22,C Ben Theriot assigned to Idaho Falls Chukars from Kansas City Royals.
2009-06-22,Chanse Cooper assigned to Idaho Falls Chukars from Kansas City Royals.
2009-06-22,Jordan Henry assigned to Mahoning Valley Scrappers from Cleveland Indians.
2009-06-22,Dwight Childs assigned to Mahoning Valley Scrappers from Cleveland Indians.
2009-06-22,Austin Adams assigned to Mahoning Valley Scrappers from Cleveland Indians.
2009-06-22,Atlanta Braves signed RHP Thomas Berryhill.
2009-06-22,Atlanta Braves signed LHP Matt Crim.
2009-06-22,Atlanta Braves signed RHP Ty'Relle Harris.
2009-06-22,LHP Jeffrey Lorick assigned to Atlanta Braves.
2009-06-22,Atlanta Braves signed LHP Chris Masters.
2009-06-22,Atlanta Braves signed C Jace Whitmer.
2009-06-22,Atlanta Braves signed SS Mycal Jones.
2009-06-22,Atlanta Braves signed 3B Jordan Kreke.
2009-06-22,Atlanta Braves signed 1B Riaan Spanjer-Furstenburg.
2009-06-22,Atlanta Braves signed OF Cory Harrilchak.
2009-06-22,Atlanta Braves signed OF Robby Hefflinger.
2009-06-22,Atlanta Braves signed OF Adam Milligan.
2009-06-22,LHP Buddy Baumann assigned to Burlington Royals from Kansas City Royals.
2009-06-22,Scott Krieger assigned to Helena Brewers from Milwaukee Brewers.
2009-06-22,Ryan Dennick assigned to Burlington Royals from Kansas City Royals.
2009-06-22,Scott Kelley assigned to Burlington Royals from Kansas City Royals.
2009-06-22,LF Chris Ellington assigned to Helena Brewers from Milwaukee Brewers.
2009-06-22,Dusty Odenbach assigned to Burlington Royals from Kansas City Royals.
2009-06-22,Peter Fatse assigned to Helena Brewers from Milwaukee Brewers.
2009-06-22,Kyle Dhanani assigned to Helena Brewers from Milwaukee Brewers.
2009-06-22,Ryan Wood assigned to Burlington Royals from Kansas City Royals.
2009-06-22,Gabe MacDougall assigned to Burlington Royals from Kansas City Royals.
2009-06-22,Hiram Burgos assigned to Helena Brewers from Milwaukee Brewers.
2009-06-22,Jonathan Pokorny assigned to Helena Brewers from Milwaukee Brewers.
2009-06-22,Chris Corrigan assigned to Batavia Muckdogs from St. Louis Cardinals.
2009-06-22,Detroit Tigers sent C Dane Sardinha outright to Toledo Mud Hens.
2009-06-22,RHP Trevor Gibson assigned to Casper Ghosts from Colorado Rockies.
2009-06-22,Matthew Stabelfeld assigned to Princeton Rays from Tampa Bay Rays.
2009-06-22,Jake Sullivan assigned to Princeton Rays from Tampa Bay Rays.
2009-06-22,David Wendt assigned to Princeton Rays from Tampa Bay Rays.
2009-06-22,Geno Glynn assigned to Princeton Rays from Tampa Bay Rays.
2009-06-22,DH Jason Patton assigned to Princeton Rays from Tampa Bay Rays.
2009-06-22,CF Cody Rogers assigned to Princeton Rays from Tampa Bay Rays.
2009-06-22,SS Daniel Rhault assigned to Princeton Rays from Tampa Bay Rays.
2009-06-22,Kyle Spraker assigned to Princeton Rays from Tampa Bay Rays.
2009-06-22,Ryan Wiegand assigned to Princeton Rays from Tampa Bay Rays.
2009-06-22,New York Mets sent RHP John Maine on a rehab assignment to St. Lucie Mets.
2009-06-22,New York Mets sent LHP Oliver Perez on a rehab assignment to St. Lucie Mets.
2009-06-22,Minnesota Twins sent CF Denard Span on a rehab assignment to Rochester Red Wings.
2009-06-22,Chris Balcom-Miller assigned to Casper Ghosts from Colorado Rockies.
2009-06-22,Paul Bargas assigned to Casper Ghosts from Colorado Rockies.
2009-06-22,Dustin Garneau assigned to Casper Ghosts from Colorado Rockies.
2009-06-22,Bryce Massanari assigned to Casper Ghosts from Colorado Rockies.
2009-06-22,C Brandon Whitby assigned to Casper Ghosts from Colorado Rockies.
2009-06-22,Dominic Altobelli assigned to Casper Ghosts from Colorado Rockies.
2009-06-22,Jose Rivera assigned to Casper Ghosts from Colorado Rockies.
2009-06-22,Jeffrey Squier assigned to Casper Ghosts from Colorado Rockies.
2009-06-22,Avery Barnes assigned to Casper Ghosts from Colorado Rockies.
2009-06-22,LHP David Born assigned to Casper Ghosts from Colorado Rockies.
2009-06-22,DH David Dinatale assigned to Casper Ghosts from Colorado Rockies.
2009-06-22,Nathan Hines assigned to Casper Ghosts from Colorado Rockies.
2009-06-22,Chandler Laurent assigned to Casper Ghosts from Colorado Rockies.
2009-06-22,Josh Hungerman assigned to Casper Ghosts from Colorado Rockies.
2009-06-22,LHP Steve Junker assigned to Casper Ghosts from Colorado Rockies.
2009-06-22,Coty Woods assigned to Casper Ghosts from Colorado Rockies.
2009-06-22,RHP Clinton McKinney assigned to Casper Ghosts from Colorado Rockies.
2009-06-22,Clint Tilford assigned to Casper Ghosts from Colorado Rockies.
2009-06-22,CF Carlos Beltran assigned to New York Mets.
2009-06-22,Pat Misch assigned to New York Mets from Buffalo Bisons.
2009-06-22,RHP Elmer Dessens assigned to New York Mets from Buffalo Bisons.
2009-06-22,LF Fernando Martinez assigned to New York Mets from Buffalo Bisons.
2009-06-22,New York Mets designated SS Wilson Valdez for assignment.
2009-06-22,New York Mets designated RHP Connor Robertson for assignment.
2009-06-22,New York Mets optioned Ken Takahashi to Buffalo Bisons.
2009-06-22,Keon Broxton assigned to Missoula Osprey from Arizona Diamondbacks.
2009-06-22,Arizona Diamondbacks signed 2B David Nick.
2009-06-22,David Nick assigned to Missoula Osprey from Arizona Diamondbacks.
2009-06-22,David Narodowski assigned to Missoula Osprey from Arizona Diamondbacks.
2009-06-22,Paul Goldschmidt assigned to Missoula Osprey from Arizona Diamondbacks.
2009-06-22,Roidany Aguila assigned to Missoula Osprey from Arizona Diamondbacks.
2009-06-22,Keith Cantwell assigned to Missoula Osprey from Arizona Diamondbacks.
2009-06-22,Chase Anderson assigned to Missoula Osprey from Arizona Diamondbacks.
2009-06-22,Mike Belfiore assigned to Missoula Osprey from Arizona Diamondbacks.
2009-06-22,Scottie Allen assigned to Missoula Osprey from Arizona Diamondbacks.
2009-06-22,Charles Brewer assigned to Missoula Osprey from Arizona Diamondbacks.
2009-06-22,Bradin Hagens assigned to Missoula Osprey from Arizona Diamondbacks.
2009-06-22,Miguel Pena assigned to Missoula Osprey from Arizona Diamondbacks.
2009-06-22,Ryan Robowski assigned to Missoula Osprey from Arizona Diamondbacks.
2009-06-22,Adam Worthington assigned to Missoula Osprey from Arizona Diamondbacks.
2009-06-22,"Los Angeles Angels placed RHP Ervin Santana on the 15-day disabled list retroactive to June 12, 2009. Pain in his right triceps."
2009-06-22,Cleveland Indians sent RHP Greg Aquino outright to Columbus Clippers.
2009-06-22,Chicago Cubs signed OF Brett Jackson.
2009-06-22,Oakland Athletics signed C Ryan Ortiz.
2009-06-22,Oakland Athletics signed RHP Robert Gilliam.
2009-06-22,Oakland Athletics signed 1B Anthony Aliotti.
2009-06-22,Seattle Mariners signed Andrew Carraway.
2009-06-22,Kansas City Royals signed Scott Lyons.
2009-06-22,Kansas City Royals signed Ben Tschepikow.
2009-06-22,Kansas City Royals signed LHP Jon Keck.
2009-06-22,Boston Red Sox signed Jeremy Hazelbaker.
2009-06-22,Seattle Mariners signed RHP Tyler Brundridge.
2009-06-22,Minnesota Twins signed LHP Jan Rehacek.
2009-06-23,Billy Bullock assigned to Elizabethton Twins from Minnesota Twins.
2009-06-23,Tony Davis assigned to Elizabethton Twins from Minnesota Twins.
2009-06-23,Kane Holbrooks assigned to Elizabethton Twins from Minnesota Twins.
2009-06-23,Tobias Streich assigned to Elizabethton Twins from Minnesota Twins.
2009-06-23,Chris Herrmann assigned to Elizabethton Twins from Minnesota Twins.
2009-06-23,1B Paul-Michael Klingsberg assigned to Elizabethton Twins from Minnesota Twins.
2009-06-23,Derek McCallum assigned to Elizabethton Twins from Minnesota Twins.
2009-06-23,Los Angeles Angels recalled Sean O'Sullivan from Salt Lake Bees.
2009-06-23,Detroit Tigers recalled Freddy Dolsi from Toledo Mud Hens.
2009-06-23,Baltimore Orioles recalled RHP Chris Ray from Norfolk Tides.
2009-06-23,Minnesota Twins selected the contract of RHP Bob Keppel from Rochester Red Wings.
2009-06-23,Minnesota Twins designated Luis Ayala for assignment.
2009-06-23,Minnesota Twins signed RHP B.J. Hermsen.
2009-06-23,Minnesota Twins signed RHP Dakota Watts.
2009-06-23,Minnesota Twins signed RHP Zach See.
2009-06-23,Minnesota Twins signed C Trayvone Johnson.
2009-06-23,Minnesota Twins signed C Nicholas Tindall.
2009-06-23,Minnesota Twins signed SS Brian Bistagne.
2009-06-23,Minnesota Twins signed SS Brian Dozier.
2009-06-23,Minnesota Twins signed 3B In Kyun Kang.
2009-06-23,Minnesota Twins signed SS Nick Lockwood.
2009-06-23,Minnesota Twins signed 3B Rory Rhodes.
2009-06-23,Minnesota Twins signed 3B Kennys Vargas.
2009-06-23,Minnesota Twins signed OF Matej Hejma.
2009-06-23,Chicago White Sox signed RHP Cameron Bayne.
2009-06-23,Chicago White Sox signed RHP Ryan Buch.
2009-06-23,Chicago White Sox signed RHP Paul Burnside.
2009-06-23,Chicago White Sox signed Justin Collop.
2009-06-23,RHP Justin Collop assigned to Chicago White Sox.
2009-06-23,Travis Tartamella assigned to Johnson City Cardinals from St. Louis Cardinals.
2009-06-23,Robert Stock assigned to Johnson City Cardinals from St. Louis Cardinals.
2009-06-23,C.J. Beatty assigned to Johnson City Cardinals from St. Louis Cardinals.
2009-06-23,Ross Smith assigned to Johnson City Cardinals from St. Louis Cardinals.
2009-06-23,Matt Adams assigned to Johnson City Cardinals from St. Louis Cardinals.
2009-06-23,LHP John Durham assigned to Johnson City Cardinals from St. Louis Cardinals.
2009-06-23,LHP Kyle Heim assigned to Johnson City Cardinals from St. Louis Cardinals.
2009-06-23,David Kington assigned to Johnson City Cardinals from St. Louis Cardinals.
2009-06-23,Travis Lawler assigned to Johnson City Cardinals from St. Louis Cardinals.
2009-06-23,Andrew Moss assigned to Johnson City Cardinals from St. Louis Cardinals.
2009-06-23,Chris Notti assigned to Johnson City Cardinals from St. Louis Cardinals.
2009-06-23,Jason Novak assigned to Johnson City Cardinals from St. Louis Cardinals.
2009-06-23,Jesse Simpson assigned to Johnson City Cardinals from St. Louis Cardinals.
2009-06-23,Justin Smith assigned to Johnson City Cardinals from St. Louis Cardinals.
2009-06-23,RHP Michael Thompson assigned to Johnson City Cardinals from St. Louis Cardinals.
2009-06-23,Justin Anderson assigned to Bluefield Orioles from Baltimore Orioles.
2009-06-23,Bobby Bundy assigned to Bluefield Orioles from Baltimore Orioles.
2009-06-23,Josh Dowdy assigned to Bluefield Orioles from Baltimore Orioles.
2009-06-23,Blake Mechaw assigned to Bluefield Orioles from Baltimore Orioles.
2009-06-23,Justin Moore assigned to Bluefield Orioles from Baltimore Orioles.
2009-06-23,Michael Flacco assigned to Bluefield Orioles from Baltimore Orioles.
2009-06-23,Mike Planeta assigned to Bluefield Orioles from Baltimore Orioles.
2009-06-23,Kipp Schutz assigned to Bluefield Orioles from Baltimore Orioles.
2009-06-23,Greg Folgia assigned to Mahoning Valley Scrappers from Cleveland Indians.
2009-06-23,Jeremy Johnson assigned to Mahoning Valley Scrappers from Cleveland Indians.
2009-06-23,Blair Carson assigned to GCL Reds from Cincinnati Reds.
2009-06-23,Chase Ware assigned to GCL Reds from Cincinnati Reds.
2009-06-23,Jacob Wiley assigned to GCL Reds from Cincinnati Reds.
2009-06-23,SS Billy Hamilton assigned to GCL Reds from Cincinnati Reds.
2009-06-23,RF Carter Morrison assigned to GCL Reds from Cincinnati Reds.
2009-06-23,David Iden assigned to Ogden Raptors from Los Angeles Dodgers.
