date,transaction
2009-01-01,"Texas Rangers Signed RHPs Derrick Turnbow, Casey Daigle, and Elizardo Ramirez to Minor League contracts with invitations to Major League Spring Training."
2009-01-02,Arizona D-backs Re-signed free agent 1B Tony Clark to a one-year contract.
2009-01-02,Boston Red Sox Signed C Josh Bard to a one-year contract with a club option for 2010.
2009-01-05,"Boston Red Sox Signed free agent INF Nick Green, who had been with the Yankees, to a Minor League contract and invited him to Spring Training."
2009-01-05,"Chicago Cubs Signed LHP Bill White, who had been with the Rangers, to a Minor League contract and invited him to Spring Training."
2009-01-05,"Houston Astros Invited INF Mark Saccomanno to Spring Training. Signed INF Jason Smith, who had been with the Royals, to a Minor League contract and invited him to Spring Training. Signed OF John Gall, who had been with the Marlins, to a Minor League contract and invited him to Spring Training. Signed RHP Clay Hensley, who had been with the Padres, to a Minor League contract and invited him to Spring Training."
2009-01-05,Kansas City Royals Re-signed RHP Roman Colon to a Minor League contract and invited him to Spring Training.
2009-01-05,Los Angeles Dodgers Signed RHP Claudio Vargas to a one-year contract.
2009-01-05,"St. Louis Cardinals Signed LHP Royce Ring, who had been with the Braves, to a one-year contract."
2009-01-05,"Tampa Bay Rays Signed OF Pat Burrell to a two-year contract, and released 1B Dan Johnson."
2009-01-06,Atlanta Braves Signed free agent RHP Rafael Cruz to a Minor League contract and invited him to Spring Training.
2009-01-06,Baltimore Orioles Re-signed free agent C Guillermo Quiroz to a Minor League contract and invited him to Spring Training.
2009-01-06,Chicago Cubs Traded RHP Jason Marquis to the Rockies for RHP Luis Vizcaino.
2009-01-06,"Cleveland Indians Signed RHP Carl Pavano, who had been with the Yankees, to a one-year contract. Designated 1B Michael Aubrey for assignment."
2009-01-06,Colorado Rockies Acquired RHP Jason Marquis and cash from the Cubs for RHP Luis Vizcaino.
2009-01-06,Florida Marlins Signed RHP Scott Proctor to a one-year contract.
2009-01-06,Houston Astros Invited 1B Chris Johnson to Spring Training. Invited C Jason Castro to Spring Training. Invited C Lou Santangelo to Spring Training. Invited RHP Bud Norris to Spring Training.
2009-01-06,Milwaukee Brewers Invited C Carlos Corporan to Spring Training. Invited C Jonathan Lucroy to Spring Training. Invited C Martin Maldonado to Spring Training.
2009-01-06,New York Yankees Signed 1B Mark Teixeira to an eight-year contract. Designated 1B Shelley Duncan for assignment.
2009-01-06,Philadelphia Phillies Signed RHP Chan Ho Park to a one-year contract.
2009-01-06,"Pittsburgh Pirates Signed INF Anderson Machado, who had been with the Mets, to a Minor League contract and invited him to Spring Training. Signed INF Pedro Lopez, who had been with the Blue Jays, to a Minor League contract and invited him to Spring Training."
2009-01-06,"Seattle Mariners Signed RHP Tyler Walker, who had been with the Giants, to a one-year contract."
2009-01-06,"Tampa Bay Rays Signed free agents LHP Randy Choate, RHP Julio DePaula, C Michel Hernandez, SS Ray Olmedo, OF Ray Sadler, OF Jon Weber to Minor League contracts and invited them to Spring Training."
2009-01-07,"Baltimore Orioles Signed free agent INF Jolbert Cabrera, who had been with the Reds, to a Minor League contract and invited him to Spring Training."
2009-01-07,"Cincinnati Reds Re-signed INF Jerry Hairston, Jr. to a one-year contract. Re-signed LHP Adam Pettyjohn to a Minor League contract and invited him to Spring Training. Signed RHP Jeff Kennard, who had been with the Angels, to a Minor League contract and invited him to Spring Training. Invited C Chris Kroski to Spring Training. Invited INF Luis Bolivar to Spring Training."
2009-01-07,"Colorado Rockies Signed 2B Luis Gonzalez to a Minor League contract and invited him to Spring Training. Signed C Paul Phillips, who had been with the White Sox, to a Minor League contract and invited him to Spring Training."
2009-01-07,Florida Marlins Signed RHP Logan Kensing to a one-year contract.
2009-01-07,Oakland Athletics Designated INF Joe Dillon for assignment.
2009-01-07,"Signed 1B Jason Giambi, who had been with the Yankees, to a one-year contract with a club option for 2010."
2009-01-07,Philadelphia Phillies Re-signed LHP Jamie Moyer to a two-year contract.
2009-01-07,"Invited C Tuffy Gosewisch to Spring Training. Invited LHP Antonio Bastardo to Spring Training. Invited OF Jeremy Slayden to Spring Training. Invited SS Jason Donald to Spring Training. Signed 2B Marcus Giles to a Minor League contract and invited him to Spring Training. Signed C Paul Hoover, who had been with the Marlins, to a Minor League contract and invited him to Spring Training. Signed OF Jason Ellison, who had been with the Rangers, to a Minor League contract and invited him to Spring Training. Signed RHP Gary Majewski, who had been with the Reds, to a Minor League contract and invited him to Spring Training. Signed RHP Yorman Bazardo, who had been with the Tigers, to a Minor League contract and invited him to Spring Training."
2009-01-08,"Boston Red Sox Signed free agent OF Rocco Baldelli, who had been with the Rays, to a one-year contract. Designated RHP Charlie Zink for assignment."
2009-01-08,Signed OF Rocco Baldelli to a one-year contract. Designated RHP Charlie Zink for assignment.
2009-01-08,"Chicago Cubs Signed OF Milton Bradley, who had been with the Rangers, to a three-year contract."
2009-01-08,"Los Angeles Dodgers Invited LHP Jacobo Meque to Spring Training. Re-signed RHP Yhency Brazoban to a Minor League contract and invited him to Spring Training. Signed LHP Stephen Randolph, who had been with the Phillies, to a Minor League contract and invited him to Spring Training. Signed OF Valentino Pascucci, who had been with the Mets, to a Minor League contract and invited him to Spring Training. Signed RHP Edgar Martinez, who had been with the Red Sox, to a Minor League contract and invited him to Spring Training. Signed SS Juan Castro, who had been with the Orioles, to a Minor League contract and invited him to Spring Training."
2009-01-09,"Baltimore Orioles Signed free agent INF Chris Gomez, who had been with the Pirates, to a Minor League contract and invited him to Spring Training."
2009-01-09,Boston Red Sox Signed RHP Brad Penny to a one-year contract. Sent RHP Charlie Zink outright to Triple-A Pawtucket. He had been designated for assignment on January 8.
2009-01-09,"Kansas City Royals Signed INF Willie Bloomquist, who had been with the Mariners, to a two-year contract."
2009-01-09,"Los Angeles Dodgers Signed LHP Shawn Estes, who had been with the Padres, to a Minor League contract and invited him to Spring Training."
2009-01-09,"San Francisco Giants Invited C Buster Posey to Spring Training. Invited C Jackson Williams to Spring Training. Invited C Todd Jennings to Spring Training. Invited INF Matt Downs to Spring Training. Invited RHP Kevin Pucetas to Spring Training. Sent INF Ivan Ochoa outright to Triple-A Fresno. He had been designated for assignment on December 30. He refused the assignment and is a . Signed OF Andres Torres, who had been with the Cubs, to a Minor League contract and invited him to Spring Training. Signed RHP Brandon Medders, who had been with the Diamondbacks, to a Minor League contract and invited him to Spring Training. Signed RHP Francis Beltran, who had been with the Tigers, to a Minor League contract and invited him to Spring Training."
2009-01-09,Tampa Bay Rays Claimed RHP Dewon Day and RHP Virgil Vasquez off waivers from the Red Sox.
2009-01-10,Boston Red Sox Signed RHP Takashi Saito to a one-year contract with a club option for 2010.
2009-01-11,"Arizona D-backs Signed free agent C Luke Carlin, who had been with the Padres, to a Minor League contract and invited him to Spring Training."
2009-01-12,"Chicago White Sox Invited 3B Javier Castillo, C Donny Lucy, C Tyler Flowers, LHP Aaron Poreda, RHP Mike MacDougal and SS Gordon Beckham to Spring Training. Re-signed RHP Franklyn German to a Minor League contract and invited him to Spring Training. Signed INF Sergio Santos, OF Josh Kroeger, OF Michael Restovich, RHP Brad Salmon and RHP Ryan Braun and invited them to Spring Training."
2009-01-12,Cleveland Indians Sent 1B Michael Aubrey outright to Triple-A Columbus and invited him to Spring Training.
2009-01-12,Signed C Kelly Shoppach to a one-year contract.
2009-01-12,"Detroit Tigers Invited 2B Scott Sizemore to Spring Training. Invited 2B Will Rhymes to Spring Training. Invited C Alex Avila to Spring Training. Invited C Jeff Kunkel to Spring Training. Invited LHP Jon Kibler to Spring Training. Invited RHP Casey Fien to Spring Training. Invited RHP Rudy Darrow to Spring Training. Invited RHP Ryan Perry to Spring Training. Invited SS Cale Iorg to Spring Training. Re-signed C Max St. Pierre to a Minor League contract and invited him to Spring Training. Signed INF Don Kelly, who had been with the Diamondbacks, to a Minor League contract and invited him to Spring Training. Signed OF Alexis Gomez, who had been with the Marlins, to a Minor League contract and invited him to Spring Training."
2009-01-12,Kansas City Royals Invited C Cody Clark to Spring Training. Invited C Jeff Howell to Spring Training. Invited C John Suomi to Spring Training. Invited OF Derrick Robinson to Spring Training. Invited OF Jose Duarte to Spring Training.
2009-01-12,New York Mets Signed RHP Tim Redding to a one-year contract. Signed LHP Tom Martin to a Minor League contract and invited him to Spring Training.
2009-01-12,Tampa Bay Rays Signed OF Gabe Kapler to a one-year contract.
2009-01-13,"Atlanta Braves Signed RHP Kenshin Kawakami, who had been with the Chunichi Dragons, to a three-year contract."
2009-01-13,"Baltimore Orioles Invited 1B Brandon Snyder, 2B Justin Turner, C Matt Wieters, LHP Alber Castillo, RHP Andy Mitchell, RHP Chris Tillman, RHP Fredy Deza, RHP Ryan Keefer and SS Blake Davis to Spring Training. Signed free agent 1B Craig Brazell, who had been with the Royals, to a Minor League contract and invited him to Spring Training."
2009-01-13,"Signed RHP Koji Uehara, who had been with the Yomiuri Giants, to a two-year contract."
2009-01-13,Signed RHP Koji Uehara to a two-year contract.
2009-01-13,Boston Red Sox Signed RHP John Smoltz to a one-year contract. Designated RHP David Pauley for assignment.
2009-01-13,Cincinnati Reds Invited C Devin Mesoraco to Spring Training. Invited LHP Ben Jukich to Spring Training. Invited LHP Pedro Viola to Spring Training. Invited OF Drew Stubbs to Spring Training. Invited RHP James Avery to Spring Training. Invited RHP Jordan Smith to Spring Training. Invited SS Chris Valaika to Spring Training. Invited SS Todd Frazier to Spring Training.
2009-01-13,Detroit Tigers Signed Taiwanese LHP Fu-Te Ni to a Minor League contract and invited him to Spring Training.
2009-01-13,"Florida Marlins Invited 1B Logan Morrison, 2B Chris Coghlan, 3B Matt Dominguez, C Brad Davis, C Kyle Skipworth, C Miguel Fermin, LHP Aaron Thompson, LHP Sean West, OF Alejandro De Aza, OF John Raynor, OF Michael Stanton, OF Scott Cousins, RHP Brett Sinkbeil, RHP Henry Owens, RHP Jose Ceda and SS Manuel Mayorson to Spring Training. Re-signed OF Michael Ryan to a Minor League contract and invited him to Spring Training. Signed 1B John Lindsey, LHP John Koronka, LHP Willie Collazo, OF Jay Gibbons and RHP Mike Wood to Minor League contracts and invited them to Spring Training."
2009-01-13,Houston Astros Signed RHP Russ Ortiz to a Minor League contract and invited him to Spring Training.
2009-01-13,"Los Angeles Angels Signed free agent RHP Matt Palmer, who had been with the Giants, to a Minor League contract and invited him to Spring Training."
2009-01-13,"Milwaukee Brewers Signed RHP Trevor Hoffman, who had been with the Padres, to a one-year contract."
2009-01-13,"Pittsburgh Pirates Re-signed C Miguel Perez to a Minor League contract and invited him to Spring Training. Signed OF Craig Monroe, who had been with the Twins, to a Minor League contract and invited him to Spring Training."
2009-01-13,"San Diego Padres Re-signed RHP Mark Prior to a Minor League contract and invited him to Spring Training. Signed INF Chris Burke, who had been with the Diamondbacks, to a Minor League contract and invited him to Spring Training."
2009-01-13,Tampa Bay Rays Designated RHP Jae Kuk Ryu for assignment.
2009-01-13,Texas Rangers Invited 1B Justin Smoak to Spring Training. Invited C Kevin Richardson to Spring Training. Invited C Manuel Pina to Spring Training. Invited LHP Derek Holland to Spring Training. Invited RHP Neftali Feliz to Spring Training. Invited SS Elvis Andrus to Spring Training.
2009-01-14,"Chicago Cubs Signed LHP Matt Smith, who had been with the Phillies, to a Minor League contract and invited him to Spring Training. Signed OF So Taguchi, who had been with the Phillies, to a Minor League contract and invited him to Spring Training."
2009-01-14,"Cleveland Indians Signed RHP Kirk Saarloos, who had been with the Athletics, to a Minor League contract and invited him to Spring Training."
2009-01-14,"Colorado Rockies Invited C Edwin Bellorin to Spring Training. Re-signed LHP Cedrick Bowers to a Minor League contract and invited him to Spring Training. Re-signed OF Scott Podsednik to a Minor League contract and invited him to Spring Training. Signed OF Daniel Ortmeier, who had been with the Giants, to a Minor League contract and invited him to Spring Training. Signed RHP Matt Belisle, who had been with the Reds, to a Minor League contract and invited him to Spring Training."
2009-01-14,"Houston Astros Invited RHP Sergio Perez to Spring Training. Re-signed RHP Chad Paronto to a Minor League contract and invited him to Spring Training. Signed C Toby Hall, who had been with the White Sox, to a Minor League contract and invited him to Spring Training. Signed RHP Danny Graves, who had been with the Twins, to a Minor League contract and invited him to Spring Training. Signed RHP Jose Capellan, who had been with the Royals, to a Minor League contract and invited him to Spring Training."
2009-01-14,"Los Angeles Dodgers Signed RHP Guillermo Mota, who had been with the Brewers, to a one-year contract."
2009-01-14,Minnesota Twins Invited 1B Brock Peterson to Spring Training. Invited 3B Danny Valencia to Spring Training. Invited C Danny Lehmann to Spring Training. Invited C Jeff Christy to Spring Training. Invited OF David Winfree to Spring Training. Invited OF Dustin Martin to Spring Training. Invited RHP Kevin Mulvey to Spring Training. Invited RHP Rob Delaney to Spring Training. Re-signed INF Alejandro Machado to a Minor League contract and invited him to Spring Training. Re-signed LHP Ben Julianel to a Minor League contract and invited him to Spring Training.
2009-01-14,"New York Yankees Invited C Kyle Anson, INF Doug Bernier, INF Angel Berroa, C Kevin Cash, OF Colin Curtis, INF/OF Shelley Duncan, LHP Kei Igawa, OF Austin Jackson, RHP Jason Johnson, INF Justin Leone, OF Todd Linden, RHP Mark Melancon, RHP Sergio Mitre, C Jesus Montero, INF Eduardo Nunez, INF Ramiro Pena, C P.J. Pilittere, OF John Rodriguez, C Austin Romine and INF Kevin Russo to 2009 Spring Training."
2009-01-14,Seattle Mariners Invited C Adam Moore to Spring Training. Invited RHP Chris Jakubauskas to Spring Training. Invited RHP Luis Munoz to Spring Training. Invited RHP Sean White to Spring Training. Invited RHP Shawn Kelley to Spring Training. Invited RHP Tracy Thorpe to Spring Training.
2009-01-14,"Washington Nationals Signed RHP Josh Towers, who had been with the Rockies, to a Minor League contract and invited him to Spring Training."
2009-01-15,"Atlanta Braves Signed free agent RHP Derek Lowe, who had been with the Dodgers, to a four-year contract. Sent LHP Francisley Bueno outright to Triple-A Gwinnett."
2009-01-15,"Baltimore Orioles Invited LHP Alberto Castillo, RHP Scott Chiasson, RHP Fredy Deza, RHP Brad Hennessey, RHP Ryan Keefer, RHP Andy Mitchell, RHP Chris Tillman, RHP Ross Wolf, C Adam Donachie, C Robby Hammock, C Chad Moeller, C Guillermo Quiroz, C Jose Reyes, C Guillermo Rodriguez, C Matt Wieters, INF Craig Brazell, INF Jolbert Cabrera, INF Blake Davis, INF Chris Gomez, INF Donnie Murphy, INF Brandon Snyder, INF Justin Turner and OF Justin Christian to 2009 Spring Training."
2009-01-15,Boston Red Sox Re-signed OF Mark Kotsay to a one-year contract. Designated RHP David Aardsma for assignment.
2009-01-15,"Chicago White Sox Signed RHP Bartolo Colon, who had been with the Red Sox, to a one-year contract."
2009-01-15,Cleveland Indians Acquired nonroster OF Mickey Hall from the Red Sox to complete the August 12 trade. Invited 1B Beau Mills to Spring Training. Invited 1B Jordan Brown to Spring Training. Invited 1B Stephen Head to Spring Training. Invited 3B Wes Hodges to Spring Training. Invited LHP David Huff to Spring Training. Invited LHP Ryan Edell to Spring Training. Invited OF Matt LaPorta to Spring Training. Invited OF Michael Brantley to Spring Training.
2009-01-15,Los Angeles Dodgers Released OF Andruw Jones.
2009-01-15,New York Mets Re-signed 2B Argenis Reyes to a Minor League contract and invited him to Spring Training.
2009-01-15,Oakland Athletics Sent 2B Joe Dillon outright to Triple-A Sacramento. He had been designated for assignment on January 7.
2009-01-15,"Philadelphia Phillies Invited 3B Anthony Hewitt to Spring Training. Signed INF Jorge Velandia, who had been with the Rays, to a Minor League contract and invited him to Spring Training. Signed INF Pablo Ozuna, who had been with the Dodgers, to a Minor League contract and invited him to Spring Training. Signed LHP Jake Woods, who had been with the Mariners, to a Minor League contract and invited him to Spring Training."
2009-01-15,San Diego Padres Agreed to terms on a one-year contract with IF David Eckstein; claimed RHP Jae Kuk Ryu off waivers from the Tampa Bay Rays.
2009-01-15,"Texas Rangers Signed C Adam Melhuse, who had been with the Rockies, to a Minor League contract and invited him to Spring Training."
2009-01-15,"Washington Nationals Invited 1B Dmitri Young to Spring Training. Invited OF Destin Hood to Spring Training. Invited RHP Jordan Zimmermann to Spring Training. Re-signed C Javi Herrera to a Minor League contract and invited him to Spring Training. Re-signed RHP Jesus Colome to a Minor League contract and invited him to Spring Training. Signed LHP Wilfredo Ledezma, who had been with the Diamondbacks, to a Minor League contract and invited him to Spring Training."
2009-01-16,Boston Red Sox Signed INF Kevin Youkilis to a four-year contract with a club option for a fifth year.
2009-01-16,"Cleveland Indians Signed RHP Jack Cassel, who had been with the Astros, to a Minor League contract and invited him to Spring Training. Signed RHP Matt Herges, who had been with the Rockies, to a Minor League contract and invited him to Spring Training."
2009-01-16,Philadelphia Phillies Signed IF Greg Dobbs to a two-year contract.
2009-01-16,Tampa Bay Rays Signed free agent RHP Lance Cormier to a one-year contract; designated RHP Dewon Day for assignment.
2009-01-18,Baltimore Orioles Acquired OF Feliz Pie from the Chicago Cubs in exchange for LHP Garrett Olson and RHP Henry Williamson.
2009-01-18,Chicago Cubs Acquired LHP Garrett Olson and RHP Henry Williamson from the Baltimore Orioles for OF Felix Pie.
2009-01-18,"New York Mets Invited 1B Michel Abreu to Spring Training. Invited C Josh Thole to Spring Training. Invited LHP Michael Antonini to Spring Training. Invited OF Fernando Martinez to Spring Training. Invited RHP Dillon Gee to Spring Training. Invited RHP Esmailin Caridad to Spring Training. Invited SS Jose Coronado to Spring Training. Signed C Omir Santos, who had been with the Orioles, to a Minor League contract and invited him to Spring Training."
2009-01-18,"Signed LHP Casey Fossum, who had been with the Tigers, to a Minor League contract and invited him to Spring Training."
2009-01-18,Philadelphia Phillies Signed LHP Cole Hamels to a three-year contract.
2009-01-19,"Atlanta Braves Signed OF Matt Diaz to a one-year contract, avoiding arbitration."
2009-01-19,"Signed RHP Mike Gonzalez to a one-year contract, avoiding arbitration."
2009-01-19,Baltimore Orioles Acquired RHP David Pauley from the Boston Red Sox in exchange for RHP Randor Bierd.
2009-01-19,Boston Red Sox Acquired RHP Randor Bierd from the Baltimore Orioles in exchange for RHP David Pauley.
2009-01-19,"Chicago White Sox Signed RHP Bobby Jenks to a one-year contract, avoiding arbitration."
2009-01-19,"Cincinnati Reds Signed OF Jonny Gomes, who had been with the Rays, to a Minor League contract and invited him to Spring Training."
2009-01-19,"Toronto Blue Jays Invited 1B David Cooper to Spring Training. Invited 2B Bradley Emaus to Spring Training. Invited 2B Scott Campbell to Spring Training. Invited C Brian Jeroloman to Spring Training. Invited C J.P. Arencibia to Spring Training. Invited C Kyle Phillips to Spring Training. Invited LHP Brad Mills to Spring Training. Invited LHP Brett Cecil to Spring Training. Invited OF Adam Loewen to Spring Training. Re-signed 1B Brian Dopirak to a Minor League contract and invited him to Spring Training. Signed OF Jason Lane, who had been with the Red Sox, to a Minor League contract and invited him to Spring Training. Re-signed RHP Brandon League to a one-year contract."
2009-01-20,"Arizona D-backs Signed RHP Chad Qualls to a one-year contract, avoiding arbitration."
2009-01-20,"Chicago Cubs Invited C Steve Clevenger to Spring Training. Invited C Welington Castillo to Spring Training. Invited LHP Edward Campusano to Spring Training. Invited LHP J.R. Mathes to Spring Training. Invited OF Doug Deeds to Spring Training. Invited RHP Andrew Cashner to Spring Training. Invited RHP Esmailin Caridad to Spring Training. Invited RHP Rocky Roquet to Spring Training. Invited SS Darwin Barney to Spring Training. Re-signed INF Bobby Scales to a Minor League contract and invited him to Spring Training. Re-signed OF Jason Dubois to a Minor League contract and invited him to Spring Training. Signed INF Luis Rivas, who had been with the Pirates, to a Minor League contract and invited him to Spring Training. Signed LHP Mike Stanton to a Minor League contract and invited him to Spring Training. Signed RHP Ken Kadokura to a Minor League contract and invited him to Spring Training."
2009-01-20,"Colorado Rockies Signed RHP Taylor Buchholz to a one-year contract, avoiding arbitration."
2009-01-20,"Detroit Tigers Signed RHP Juan Rincon, who had been with the Indians, to a Minor League contract and invited him to Spring Training."
2009-01-20,Kansas City Royals Invited OF Chris Lubanski to Spring Training. Invited RHP Dan Cortes to Spring Training. Invited RHP Yasuhiko Yabuta to Spring Training. Signed RHP Victor Marte to a Minor League contract and invited him to Spring Training.
2009-01-20,"Los Angeles Dodgers Signed RHP Jonathan Broxton and C Russell Martin to one-year contracts, avoiding arbitration."
2009-01-20,Philadelphia Phillies Signed RHP Ryan Madson to a three-year contract. Signed OF Shane Victorino and RHP Joe Blanton to one-year deals.
2009-01-20,Pittsburgh Pirates Invited 2B Shelby Ford to Spring Training.
2009-01-20,"San Diego Padres Signed RHP Heath Bell to a one-year contract, avoiding arbitration."
2009-01-20,"San Francisco Giants Signed LHP Jack Taschner to a one-year contract, avoiding arbitration."
2009-01-20,Seattle Mariners Acquired RHP David Aardsma from the Red Sox for nonroster LHP Fabian Williamson. Aardsma had been designated for assignment on January 15.
2009-01-21,Baltimore Orioles Signed RF Nick Markakis to a six-year contract.
2009-01-21,"Los Angeles Angels Invited RHP David Austen, OF Peter Bourjos, RHP Ryan Brasier, LHP Barret Browning, C Hank Conger, OF Bradley Coon, LHP Daniel Davidson, C Anel De Los Santos, RHP David Herndon, C Ben Johnson, 2B Ryan Mount, RHP Sean O'Sullivan, INF Adam Pavkovich, OF Chris Pettit, RHP Fernando Rodriguez, RHP Francisco Rodriguez, SS Andrew Romine, C Alberto Rosario, SS Hainley Statia, LHP Alexander Torres, RHP Jordan Walden, RHP Matt Wilhite and C Flint Wipke to Spring Training."
2009-01-21,Philadelphia Phillies Signed RHP Chad Durbin to a one-year contract.
2009-01-21,"Pittsburgh Pirates Re-signed RHP Jason Davis to a Minor League contract and invited him to Spring Training. Signed C Erik Kratz, who had been with the Blue Jays, to a Minor League contract and invited him to Spring Training."
2009-01-21,San Diego Padres Agreed to terms on a one-year contract with C Henry Blanco. Designated RHP Virgil Vasquez for assignment.
2009-01-21,Tampa Bay Rays Sent RHP Dewon Day outright to Triple-A Durham and invited him to Spring Training.
2009-01-21,"Texas Rangers Signed SS Omar Vizquel, who had been with the Giants, to a Minor League contract and invited him to Spring Training."
2009-01-22,"Atlanta Braves Invited 1B Frederick Freeman, C Mathew Kennelly, C Phillip Britton, LHP Francisley Bueno, OF Jason Heyward, OF Jordan Schafer, RHP Kris Medlen, RHP Tommy Hanson and SS Brandon Hicks to Spring Training. Re-signed C J,C, Boscan to a Minor League contract and invited him to Spring Training. Signed free agent C Alvin Colina, who had been with the Reds, and free agent LHP Juan Perez, who had been with the Pirates, to Minor League contracts and invited them to Spring Training."
2009-01-22,Baltimore Orioles Signed C Gregg Zaun to a one-year contract. Designated INF Oscar Salazar for assignment.
2009-01-22,Boston Red Sox Acquired LHP Fabian Williamson from the Seattle Mariners in exchange for RHP David Aardsma. Signed RHP Jonathan Papelbon to a one-year contract. Signed LHP Javier Lopez to a one-year contract.
