date,transaction
2004-01-04,Detroit Tigers Agreed to terms on a one-year contact with INF Ramon Martinez.
2004-01-05,"Cleveland Indians Signed RHP Jeff D''Amico, RHP Luther Hackman, RHP Matt Miller, INF Kevin Orie and LHP Carl Sadler to minor league contracts with invitations him to Spring Training."
2004-01-05,Acquired LHP Scott Stewart from the Expos for OF Ryan Church and nonroster INF Maicer Izturis.
2004-01-05,"Colorado Rockies Rockies agreed to minor league contracts with SS Royce Clayton, 2B-OF Damian Jackson and OF-1B Mark Sweeney. All will be invited to Major League Spring Training."
2004-01-05,Detroit Tigers Outrighted left-handed pitcher Adrian Burnside to Triple-A Toledo.
2004-01-05,Montreal Expos Traded LHP Scott Stewart to the Indians for OF Ryan Church and IF Maicer Izturis.
2004-01-05,New York Yankees Signed RHP Javier Vazquez to a four-year contract.
2004-01-05,Texas Rangers Signed Eric Young to a one year deal; Designated Reynaldo Garcia for assignment
2004-01-06,Arizona Diamondbacks Roberto Alomar: Signed free agent 2B Roberto Alomar to a one-year contract.
2004-01-06,Kansas City Royals Re-signed RHP Jimmy Serrano and LHP Les Walrond to minor league contracts with invitations to Spring Training; invited nonroster INFs Ruben Gotay and Donald Murphy to Spring Training.
2004-01-06,"Signed RHP Erik Hiljus, INF Wilton Guerrero, INF Rick Short and OF Adrian Brown to minor league contracts with invitations to Spring Training."
2004-01-06,Signed OF Juan Gonzalez to a one-year contract with a mutual option.
2004-01-06,Los Angeles Dodgers Signed OF Bubba Trammell to one-year contract. Signed LHP Troy Brohawn and RHP Bill Simas to minor league contracts and invited each to Spring Training.
2004-01-06,Montreal Expos Agreed to terms on one-year deal with SS Orlando Cabrera.
2004-01-06,New York Mets Signed RHP Braden Looper to a two-year contract with a club option for a third year.
2004-01-06,"Oakland Athletics Invited nonroster C Mike Rose, RHP Joe Blanton, OF Brian Sellier and OF Nick Swisher to Spring Training."
2004-01-06,Signed RHP Wayne Gomes and INF Ramon Castro to minor league contracts with invitations to Spring Training.
2004-01-06,Outrighted INF Jose Flores to Triple-A Sacramento and invited him to Spring Training.
2004-01-06,Re-signed IF Frank Menechino to a one-year contract and designated for assignment IF Jose Flores.
2004-01-06,"San Diego Padres Acquired 3B Jeff Cirillo, RHP Brian Sweeney and cash considerations from the Seattle Mariners in exchange for RHP Kevin Jarvis, CA Wiki Gonzalez, IF Dave Hansen and minor league OF Vince Faison."
2004-01-06,"Seattle Mariners Acquired RHP Kevin Jarvis, CA Wiki Gonzalez, IF Dave Hansen and minor league OF Vince Faison from the San Diego Padres in exchange for 3B Jeff Cirillo, RHP Brian Sweeney and cash considerations."
2004-01-06,St. Louis Cardinals Signed free agent RHP Mike Lincoln to a one-year contract.
2004-01-06,"Tampa Bay Devil Rays Signed 1B Ivan Cruz, RHP Rich Loiselle and RHP Rob Stanifer to minor league contracts."
2004-01-06,Signed free-agent LHP Trever Miller to a one-year contract.
2004-01-06,Signed free-agent RHP Danys Baez to a two-year contract with a club option for 2006.
2004-01-07,Arizona Diamondbacks Designated C Brad Cresse for assignment.
2004-01-07,Chicago Cubs Signed free agent RHP Cliff Politte to a one-year contract with a club option for 2005.
2004-01-07,Chicago White Sox Agreed to terms with RHP Cliff Politte on a one-year contract that includes a club option for 2005.
2004-01-07,Cincinnati Reds Aaron Myette: Signed RHP Aaron Myette to a minor league contract and invited him to Spring Training.
2004-01-07,Florida Marlins Signed INF Damion Easley to a minor league contract.
2004-01-07,"Houston Astros Invited nine minor leaguers to Major League Spring Training: INFs Jason Alfaro and Mike Coolbaugh; Cs Dax Norris and Chris Tremie; RHPs Kirk Bullinger, Jared Fernandez, Miguel Saladin and Rodrigo Rosario and LHP Nate Bland."
2004-01-07,Philadelphia Phillies Re-signed RHP Brian Powell to a minor league contract; signed C A.J. Hinch to a minor league contract.
2004-01-07,San Diego Padres Claimed C Tom Wilson off waivers from Toronto. Designated RHP Brandon Villafuerte for assignment.
2004-01-07,Tampa Bay Devil Rays Signed SS Deivi Cruz to a minor league contract with an invitation to Spring Training.
2004-01-07,"Toronto Blue Jays Agreed to terms with RHP Terry Adams and SS Chris Gomez on one-year contracts. RHP Pete Walker was designated for assignment, and C Tom Wilson was claimed on waivers by the Padres."
2004-01-08,"Baltimore Orioles Invited nonroster RHP Darwin Cubillan, C Raul Casanova, C Carlos Mendez, INF Napoleon Calzado, INF Eddy Garabito, INF Luis Lopez and OF Pedro Swann to Spring Training."
2004-01-08,Re-signed OF B.J. Surhoff to a minor league contract and invited him to Spring Training; signed C Bill Haselman to a minor league contract and invited him to Spring Training.
2004-01-08,Boston Red Sox Claimed C Michel Hernandez off waivers from the Yankees.
2004-01-08,Cleveland Indians Signed free-agent RHP Jose Jimenez
2004-01-08,Detroit Tigers Sent RHP John Ennis outright to Triple-A Toledo.
2004-01-08,Acquired shortstop Carlos Guillen from Seattle in exchange for shortstop Ramon Santiago and minor league shortstop Juan Gonzalez.
2004-01-08,Houston Astros Signed INF John Valentin to a minor league contract and invited him to Major League Spring Training.
2004-01-08,Oakland Athletics Signed RHP Lou Pote to a minor league contract and invited him to Spring Training; invited nonroster RHP Brad Sullivan to Spring Training.
2004-01-08,"Pittsburgh Pirates Signed 3B Chris Truby, SS Donaldo Mendez, OF Andy Abad, RHP Elio Serrano and RHP Blake Stein to minor league contracts and invited them to Spring Training."
2004-01-08,Seattle Mariners Signed shortstop Rich Aurilia to a one-year contract. Traded shortstop Carlos Guillen to the Tigers for infielders Ramon Santiago and Juan Gonzalez.
2004-01-09,Atlanta Braves Re-signed 1B Julio Franco to a minor league contract and invited him to Spring Training.
2004-01-09,Chicago Cubs Re-signed RHP Scott Chiasson and OF Trenidad Hubbard to minor league contracts with invitations to Spring Training.
2004-01-09,"Invited nonroster INF Nate Frese, RHP Michael Wuertz, C Casey Kopitzke to Spring Training."
2004-01-09,"Signed LHP Jimmy Anderson, RHP Bryan Corey, LHP Juan Pena, C Fernando Lunar and INF Scott McClain to minor league contracts with invitations to Spring Training."
2004-01-09,"Cincinnati Reds Re-signed RHP Seth Etherton, C Dane Sardinha C Mike Stefanski and INF Jacob Cruz to a minor league contracts with invitations to Spring Training."
2004-01-09,"Signed LHP Rigo Beltran, RHP Brian Mallette, RHP Corey Thurman, C Javier Valentin, INF Aaron Holbert, OF McKay Christensen and OF Jermaine Clark to minor league contracts with invitations to Spring Training."
2004-01-09,Luke Prokopec: Signed RHP Luke Prokopec to a minor league contract.
2004-01-09,Colorado Rockies Signed IF Denny Hocking to a minor league contract with an invitation to Spring Training.
2004-01-09,Los Angeles Dodgers Signed OF Dave Roberts to a one-year contract.
2004-01-09,New York Yankees Outrighted IF Erick Almonte to Triple-A Columbus.
2004-01-09,San Francisco Giants Signed RHP Brett Tomko to a one-year contract with a club option for 2005.
2004-01-09,Seattle Mariners Designated LHP Ryan Anderson for assignment.
2004-01-09,St. Louis Cardinals Signed OF Chris Prieto and 1B Luis Ortiz to minor league contracts.
2004-01-09,"Signed OFs Ray Lankford, Mark Quinn and Emil Brown to minor league contracts that include non-roster invitations to Spring Training."
2004-01-09,Signed free agent RHP Julian Tavarez to a two-year contract.
2004-01-09,Signed free agent INF Marlon Anderson to a one-year contract.
2004-01-09,Tampa Bay Devil Rays Designated RHP Matt White for assignment.
2004-01-10,Baltimore Orioles Signed 1B/DH Rafael Palmeiro to a one-year contract.
2004-01-10,Los Angeles Dodgers Re-signed RHP Masao Kida to a minor league contract and invited him to Spring Training. Invited nonroster INF Ricky Bell and RHP Agustin Montero to Spring Training.
2004-01-10,Pittsburgh Pirates Invited nonroster LHP Paul Maholm to Spring Training.
2004-01-11,Boston Red Sox Signed LHP Bobby M. Jones to a minor league contract.
2004-01-11,Cincinnati Reds Signed RHP Scott Sobkowiak to a minor league contract.
2004-01-11,"Minnesota Twins Signed LHP Aaron Fultz, LHP Kevin Tolar and 1B Juan Diaz to minor league contracts with invitations to Spring Training."
2004-01-11,New York Mets Re-signed OF Esix Snead to a minor league contract.
2004-01-12,Anaheim Angels Vladimir Guerrero: Signed free agent OF Vladimir Guerrero to a five-year contract with a club option for 2009.
2004-01-12,"Chicago White Sox Agreed to terms with LHP Scott Schoeneweis on a one-year contract, avoiding salary arbitration."
2004-01-12,Cincinnati Reds John Vander Wal: Signed free agent OF John Vander Wal to a one-year contract.
2004-01-12,Cleveland Indians Lou Merloni: Signed INF Lou Merloni to a minor league contract and invited him to Spring Training.
2004-01-12,"Colorado Rockies Signed RHP Jeff Fassero, RHP Vladimir Nunez and C Hector Ortiz to minor league contracts with invitations to Spring Training."
2004-01-12,Houston Astros Roger Clemens: Signed RHP Roger Clemens to a one-year contract.
2004-01-12,New York Yankees Signed free agent 1B Tony Clark to a one-year contract; designated INF Fernando Seguignol for assignment.
2004-01-12,Oakland Athletics Signed RHP Britt Reames to a minor league contract with an invitation to Spring Training.
2004-01-12,Philadelphia Phillies Doug Glanville: Signed free agent OF Doug Glanville to a one-year contract.
2004-01-12,"San Francisco Giants Signed free-agent P Lee Gardner and INF David Doster to minor league contracts and invited them to Spring Training along with P''s David Aardsma, Luke Anderson, Matt Cain, Brad Hennessey, Erick Threets and Jeff Urban; C''s Todd Jennings and Craig Kuzmic; INFs Brian Buscher, Timothy Hutting and Jacob Wald; and OFs Doug Clark, Frederick Lewis, Daniel Ortmeier and Adam Shabala."
2004-01-12,"Tampa Bay Devil Rays Agreed to terms with LHP Mike Holtz, RHP Todd Jones, C Mitch Meluskey, RHP Al Reyes, RHP Carlos Reyes, 3B Jared Sandberg and 3B Fernando Tatis on minor league contracts with invitations to Major League Spring Training."
2004-01-12,Texas Rangers Jeff Nelson: Signed RHP Jeff Nelson to a one-year contract.
2004-01-13,Minnesota Twins Rick Helling: Signed P Rick Helling to a minor league contract and will be invited to Spring Training.
2004-01-13,Montreal Expos Agreed to terms with catcher Gregg Zaun to a minor league contract with an invitation to Spring Training.
2004-01-13,San Diego Padres Agreed to terms with free agent OF Jay Payton on a two-year contract and designated for assignment LHP Mike Bynum.
2004-01-13,Seattle Mariners Sent LHP Ryan Anderson outright to Triple-A Tacoma.
2004-01-13,Tampa Bay Devil Rays Agreed to terms with free agent RHP Mike Williams on a minor league contract and invited him to Spring Training.
2004-01-13,Texas Rangers Kenny Rogers: Signed free agent LHP Kenny Rogers to a two-year contract.
2004-01-13,"Toronto Blue Jays RHPs Josue Matos and Juan Campos, and OF Noah Hall were signed to minor league contracts and invited to Spring Training."
2004-01-13,Dave Maurer: Signed P David Maurer to a minor league contract and will be invited to Spring Training.
2004-01-14,Anaheim Angels Shane Halter: Agreed to terms with free agent IF Shane Halter on a one-year contract for 2004.
2004-01-14,Atlanta Braves Signed IF Mark DeRosa to a one-year contract.
2004-01-14,"Baltimore Orioles Agreed to terms with free-agent RHP Sidney Ponson, who had been with the Giants, on a three-year deal."
2004-01-14,"Cincinnati Reds Invited nonroster RHP Chris Booker, RHP Dustin Moseley and LHP Brian Shackelford to Spring Training."
2004-01-14,Colorado Rockies Signed RHP Turk Wendell to a minor league contract with an invitation to Spring Training.
2004-01-14,Detroit Tigers Re-signed OF Ben Petrick to a minor league contract and invited him to Spring Training.
2004-01-14,Signed RHP Jason Karnuth to a minor league contract.
2004-01-14,"Signed INF Greg Norton, INF Pablo Ozuna, C Bobby Estalella and RHP Craig Dingman to minor league contracts and invited them to Spring Training."
2004-01-14,Toronto Blue Jays Ted Lilly: Agreed to terms on a new two-year contract with LHP Ted Lilly worth a total of $5 million.
2004-01-15,"Anaheim Angels Invited nonroster C Jared Abruzzo, INF Erick Aybar, LHP Dusty Bergman, C Ryan Budde, INF Alberto Callaspo, LHP Eric Cyr, OF Nick Gorneault, RHP Matt Hensley, INF Casey Kotchman, C Jeff Mathis, INF Tommy Murphy, RHP Ervin Santana and INF Brian Specht to Spring Training."
2004-01-15,"Signed C Josh Paul, RHP Scott Dunn, OF Brian Gordon and LHP Pete Zamora to minor league contracts and invited them to Spring Training; Re-signed INF Adam Riggs to a minor league contract and invited him to Spring Training."
2004-01-15,Gary Johnson: Designated OF Gary Johnson for assignment.
2004-01-15,Atlanta Braves C.J. Nitkowski: Agreed to terms with LHP C. J. Nitkowski on a minor-league contract and invited him to Spring Training as a non-roster player.
2004-01-15,"Invited 12 players to the major league Spring Training camp, the team announced. The non-roster players invited to Spring Training are: right-handed pitchers Tim Drew, Ryan Glynn and Chuck Smith; left-handed pitcher Sam McConnell; catchers Jean Boscan, Joe DePastino, Lee Evans, Brayan Pena and Bryce Terveen; infielder Jorge Velandia and outfielders Damon Hollins and DeWayne Wise."
2004-01-15,"Philadelphia Phillies Invited nonroster RHP Gavin Floyd, LHP Cole Hamels, INF Brian Hitchcox, C Russ Jacobson, C Trent Pratt, C Jeremy Salazar and LHP Matt Squires to spring training."
2004-01-15,Jimmy Rollins: Signed SS Jimmy Rollins to a one-year contract.
2004-01-15,Texas Rangers Signed C Rod Barajas to a minor league contract with an invitation to Major Legaue Spring Training.
2004-01-16,Anaheim Angels Sent OF Gary Johnson outright to Triple-A Salt Lake and invited him to Spring Training.
2004-01-16,"Baltimore Orioles Signed C Keith Osik to a minor league contract and invited him to Spring Training, and also invited RHP John Maine and 2B Mike Fontenot to Spring Training."
2004-01-16,Boston Red Sox Announced the signing of LHP Nick Bierbrodt to a one-year contract.
2004-01-16,Cincinnati Reds Signed OF Reggie Taylor and LHP Mike Matthews to minor league contracts and invited both players to Spring Training.
2004-01-16,"Houston Astros Signed free agent OF Orlando Palmeiro to a one-year contract. To make room for Palmeiro on the 40-man roster, the Astros designated for assignment OF Colin Porter."
2004-01-16,San Diego Padres Rey Ordonez: Agreed to terms with free agent IF Rey Ordonez on a minor league contract and invited him to Spring Training.
2004-01-16,"Seattle Mariners Invited nonroster LHP Craig Anderson, LHP Travis Blackley, OF Shin-Soo Choo, LHP Randy Williams, C Luis Oliveros and C Rene Rivera to Spring Training. Invited nonroster infielder Adam Jones to spring training. Invited nonroster infielder Jose Lopez to spring training. Invited nonroster infielder Mickey Lopez to spring training. Invited nonroster infielder A.J. Zapp to spring training."
2004-01-16,"Signed LHP Mike Myers, LHP Jose Nunez, LHP George Sherrill, OF Hiram Bocachica and 1B Bucky Jacobsen to minor league contracts and invited them to Spring Training; Re-signed C Pat Borders to a minor league contract and invited him to Spring Training."
2004-01-16,Tampa Bay Devil Rays Sent RHP Matt White outright to Triple-A Durham. White had been designated for assignment on Jan. 9.
2004-01-16,"Texas Rangers Signed RHP Francisco Cordero to a one-year and released RHP Reynaldo Garcia, who had been designated for assignment on Jan. 5. RHP Travis Hughes and 1B/OF Jason Jones cleared waivers and were assigned outright to the Rangers'' Triple-A team in Oklahoma."
2004-01-16,"Released RHP Reynaldo Garcia, who had been designated for assignment on Jan. 5."
2004-01-16,Sent RHP Travis Hughes and 1B/OF Jason Jones outright to AAA Oklahoma. These roster moves were made to clear spots on the Texas 40-man roster for Kenny Rogers and Jeff Nelson.
2004-01-17,Los Angeles Dodgers Rick White joins the Dodgers as a non-roster invitee.
2004-01-17,"Montreal Expos Agreed to a one-year deal with RHP Rocky Biddle, thus avoiding arbitration."
2004-01-17,San Diego Padres Relased RHP Brandon Villafuerte.
2004-01-17,Tampa Bay Devil Rays Re-signed P Gerardo Garcia to a minor league contract with a Spring Training invite.
2004-01-18,Los Angeles Dodgers Signed Jeremy Giambi to a minor league contract with a Spring Training invite.
2004-01-19,"Boston Red Sox Signed IF/OF Terry Shumpert to a minor league contract with an invitation to Spring Training and agreed to a one-year deal with RHP Scott Williamson, avoiding arbitration."
2004-01-19,Cincinnati Reds Signed RHP John Riedling to a one-year contract; Invited nonroster C Miguel Perez to Spring Training.
2004-01-19,Los Angeles Dodgers Signed 3B Adrian Beltre to a one-year contract.
2004-01-19,"Milwaukee Brewers Signed RHP Dan Kolb, avoiding arbitration."
2004-01-19,"Montreal Expos Agreed to terms with RHPs Tomo Ohka and Tony Armas Jr. on one-year deals, thus avoiding arbitration."
2004-01-19,"San Francisco Giants Signed RHP Jim Brower to a two-year deal and INF Pedro Feliz to a one-year deal, avoiding arbitration for both players."
2004-01-20,"Atlanta Braves Avoided arbitration by signing OF J.D. Drew, SS Rafael Furcal and RHP Will Cunnane to one-year deals."
2004-01-20,Baltimore Orioles Avoided arbitration by signing 2B Jerry Hairston Jr. and OF Luis Matos to one-year contracts.
2004-01-20,Boston Red Sox Avoided arbitration by signing OF Trot Nixon to a one-year deal and RHP Byung-Hyun Kim to a two-year deal.
2004-01-20,Detroit Tigers Signed RHP Esteban Yan to a minor league contract and invited him to Spring Training.
2004-01-20,"Invited nonroster RHP Jorge Cordova, C Mike Rabelo, C Max St. Pierre, INF Rayner Bautista and OF Jeff Inglin to Spring Training."
2004-01-20,Florida Marlins Avoided arbitration by signing RHP Carl Pavano and RHP Brad Penny to one-year contracts.
2004-01-20,Kansas City Royals Avoided arbitration by signing OF Carlos Beltran to a one-year contract for an estimated $9 million.
2004-01-20,Los Angeles Dodgers Signed LHP Odalis Perez to a one-year contract.
2004-01-20,Milwaukee Brewers Signed RHP Matt Wise to a minor league contract with an invitation to Spring Training.
2004-01-20,"Signed RHP Ben Sheets to a one-year deal, avoiding arbitration."
2004-01-20,New York Mets Signed OF Karim Garcia to a one-year contract.
2004-01-20,New York Yankees Avoided arbitration by signed 2B Alfonso Soriano to a one-year contract.
2004-01-20,"Tampa Bay Devil Rays Re-signed RHP Jeremi Gonzalez to a one-year contract, avoiding arbitration; agreed to one-year contracts with OF Jonny Gomes and P Bartolome Fortunato; and re-signed P Gerardo Garcia and invited him to Spring Training."
2004-01-20,Toronto Blue Jays Avoided arbitration by signing RHP Justin Speier to a one-year contract.
2004-01-21,"Arizona Diamondbacks Signed RHP Brandon Villafuerte, OF Julio Ramirez and C Juan Brito to minor league contracts and invited them to Spring Training."
2004-01-21,"Invited nonroster RHP Dustin Nippert, RHP Brady Raggio, RHP Adriano Rosario, C Craig Ansman and C Chris Snyder to minor league contracts and invited them to Spring Training."
2004-01-21,Atlanta Braves Signed IF Russell Branyan to a minor league contract with an invitation to Spring Training.
2004-01-21,Chicago Cubs Ryan Dempster: Signed free agent RHP Ryan Dempster to a one-year contract with a club option for 2005.
2004-01-21,"Chicago White Sox Invited minor league pitchers Carlos Castillo, Ryan Kohlmeier and Josh Stewart, C Jonathan Aceves, C Carlos Maldonado, OF Mario Valenzuela and OF Jeremy Reed to Spring Training."
2004-01-21,"Signed RHP Robert Person, RHP Mike Jackson, RHP Jose Santiago, LHP Vic Darensbourg, OF Marvin Benard, INF Bobby Smith and INF Mike Bell to minor league contracts and invited them to Spring Training."
2004-01-22,Arizona Diamondbacks Signed LHP Jim Parque to a minor league contract and invited him to Spring Training.
2004-01-22,"Chicago White Sox Signed RHP Shingo Takatsu to a one-year contract, with a club option for 2005."
2004-01-22,"Cleveland Indians Invited nonroster RHP Kyle Denney, RHP Kazuhito Tadano, C Brian Luderer, C Victor Valencia, C Dave Wallace, INF Michael Aubrey, INF Zach Sorensen, OF Brad Snyder and C Dusty Wathan to Spring Training."
2004-01-22,"Florida Marlins Invited nonroster RHP Trevor Hutchinson, RHP Mike Nannini, C Ryan Jorgensen, C Dennis Anderson, INF Derek Wathan and OF Eric Reed to Spring Training."
2004-01-22,Signed 1B Larry Sutton to a minor league contract and invited him to Spring Training.
2004-01-22,"Montreal Expos Acquired nonroster C Brad Cresse from the Diamondbacks for a player to be named, and invited him to Spring Training."
2004-01-22,"Signed RHP Jeff Farnsworth, RHP Christian Parker, RHP Mike Judd, INF Julius Matos, INF Luis Lopez and C Paul Hoover to minor league contracts and invited them to Spring Training; Re-signed C Randy Knorr to a minor league contract and invited him to Spring Training."
2004-01-22,San Diego Padres Sent LHP Mike Bynum outright to Triple-A Portland and invited him to Spring Training.
2004-01-22,Tampa Bay Devil Rays Designated RHP Rob Bell for assignment.
2004-01-22,"Damian Rolls: Agreed to terms with infielder/outfielder Damian Rolls on a one-year contract, avoiding arbitration."
2004-01-22,Signed LHP Damian Moss to a one-year contract. Agreed to terms with RHP Todd Ritchie on a minor league contract with an invitation to Spring Training.
2004-01-22,"Toronto Blue Jays Roy Halladay: Signed RHP Roy Halladay to a four-year, $42 million contract."
2004-01-23,Cincinnati Reds Signed LHP Jesus Sanchez to a minor league contract and invited him to Spring Training; Re-signed RHP Scott Randall to a minor league contract.
2004-01-23,Purchased the contract of RHP Todd Van Poppel from Triple-A Louisville.
2004-01-23,Colorado Rockies Signed LHP Shawn Estes to a minor league contract with an invitation to Major League Spring Training.
2004-01-23,"Kansas City Royals Darrell May: Agreed to terms with LHP Darrell May on a two-year contract through the 2005 season, avoiding salary arbitration."
2004-01-23,St. Louis Cardinals Claimed OF Colin Porter off waivers from the Astros.
2004-01-24,Boston Red Sox Agreed with free-agent IF Tony Womack on a minor league contract and invited him to Spring Training.
2004-01-24,Pittsburgh Pirates Signed free agent RHP Rick Reed to a minor league contract and invited him to Spring Training.
2004-01-26,Boston Red Sox Claimed RHP Reynaldo Garcia off waivers from the Rangers.
2004-01-26,Colorado Rockies Agreed to terms with RHP Shawn Chacon on a one-year contract extending through the 2004 season.
2004-01-26,Houston Astros Signed free agent RHP Dave Veres to a minor league contract with an invitation to Spring Training.
2004-01-26,Kansas City Royals Acquired LHP Jaime Cerda from the Mets for RHP Shawn Sedlacek.
2004-01-26,New York Mets Traded LHP Jaime Cerda to Kansas City in exchange for RHP Shawn Sedlacek.
2004-01-26,New York Yankees Signed 2B Homer Bush to a minor league contract.
2004-01-27,Cincinnati Reds Signed C Steve Lomasney to a minor league contract and invited to Spring Training; C Mike Stefanski retired as a player to accept a position as the Reds'' bullpen catcher.
2004-01-27,Los Angeles Dodgers Signed INF Jose Hernandez and RHP Jose Lima to minor league contracts and invited them to Spring Training.
2004-01-27,"Pittsburgh Pirates Agreed to minor-league contracts with the following players and invited them to Spring Training: RHP Hector Almonte, C Sandy Martinez, OF Daryle Ward and Luke Allen."
2004-01-27,Seattle Mariners Released RHP Kazuhiro Sasaki.
2004-01-27,Tampa Bay Devil Rays Outrighted RHP Rob Bell to Triple-A Durham and invited him to Spring Training.
2004-01-28,Baltimore Orioles Signed INF Clay Bellinger and LHP Rob Ramsay to minor league contracts with an invitation to Spring Training.
2004-01-28,"Melvin Mora: Signed 3B Melvin Mora to a three-year contract, avoiding salary arbitration."
2004-01-28,Detroit Tigers Announced the retirement of INF Dean Palmer.
2004-01-28,New York Mets Signed free agent INF Todd Zeile to a one-year contract.
2004-01-28,New York Yankees Signed INF Tyler Houston and OF Darren Bragg to minor league contracts and invited them to Spring Training.
2004-01-29,Florida Marlins Signed free agent LHP Darren Oliver to a one-year contract.
2004-01-29,New York Mets Signed OF Shane Spencer to a one-year contract with an invitation to Spring Training.
2004-01-29,Pittsburgh Pirates Agreed to terms with RHP Jose Mesa on a minor league contract with an invitation to Spring Training.
2004-01-29,Texas Rangers Purchased the contract of RHP Carlos Almanzar from Triple-A Oklahoma; designated INF Mike Lamb for assignment.
2004-01-30,Pittsburgh Pirates Signed OF Chris Singleton to a minor league contract and invited him to Spring Training.
2004-02-02,Detroit Tigers Designated RHP Chris Mears for assignment.
2004-02-02,Ivan Rodriguez: Signed free agent C Ivan Rodriguez to a four-year contract with a club option for 2008.
2004-02-02,Florida Marlins Wil Cordero: Signed 1B Wil Cordero to a one-year contract.
2004-02-02,"Minnesota Twins Avoided arbitration with LHP J.C. Romero by signing him to a one-year contract worth a guaranteed $820,000 plus an additional $5,000 should Romero make 70 appearances."
