date,transaction
2004-03-30,Los Angeles Dodgers Acquired outfielder Jayson Werth from Toronto for pitcher Jason Frasor.
2004-03-30,Acquired outfielder Jason Grabowski from Oakland for cash considerations; Tanyon Sturtze released.
2004-03-30,"Milwaukee Brewers Assigned RHP Victor Santos, RHP Matt Wise, LHP Chris Michalak, C Alex Delgado, C Mark Johnson, INF Matt Erickson, INF Jeff Liefer, OF Chris Magruder and OF Jon Nunnally to minor league camp."
2004-03-30,Minnesota Twins Optioned OF Lew Ford to Triple-A Rochester. Re-assigned C Chris Heintz and IF Alex Prieto to the minor league camp.
2004-03-30,"Pittsburgh Pirates Optioned RHP Mark Corey to Triple-A Nashville; reassigned RHP Willis Roberts, RHP Juan Acevedo, INF Chris Truby, C Keith McDonald and OF Andy Abad to Triple-A; released OF Orlando Merced and LHP Mark Guthrie."
2004-03-30,"San Francisco Giants Signed RHP Dave Veres, RHP Mike Crudale and IF Deivi Cruz to minor league contracts and invited them to Spring Training."
2004-03-30,"Placed RHP Robb Nen on the 15-day disabled list, retroactive to March 26, with right rotator cuff tendinitis; placed LHP Scott Eyre on the 15-day disabled list, retroactive to March 27, with a lower back strain."
2004-03-30,Tampa Bay Devil Rays Optioned RHP Doug Waechter to Triple-A Durham and purchased the contract of OF Charles Gipson from Triple-A Durham.
2004-03-30,Texas Rangers Released nonroster RHP Erik Sabel.
2004-03-30,Purchased the contract of C Rod Barajas from Triple-A Oklahoma.
2004-03-30,Toronto Blue Jays Acquired RHP Jason Frasor from the Dodgers for OF Jayson Werth.
2004-03-31,Anaheim Angels Outrighted RHP Richard Fischer to Double-A Arkansas. Outrighted Tom Gregoria to Triple-A Salt Lake.
2004-03-31,Atlanta Braves Released OF Gary Matthews Jr.
2004-03-31,"Baltimore Orioles Cut three players from their major league spring training camp. Optioned CA Geronimo Gil to Triple-A Ottawa, reassigned IF Eddy Garabito and LHP Rob Ramsay to the minor league camp in Sarasota, Fla."
2004-03-31,"Boston Red Sox Placed SS Nomar Garciaparra, OF Trot Nixon, RHP Byung-Hyun Kim and RHP Reynaldo Garcia on the 15-day disabled list retroactive to March 26."
2004-03-31,Returned Rule 5 LHP Frank Brooks to the Pirates; released nonroster INF Terry Shumpert.
2004-03-31,"Cincinnati Reds Optioned LHP Jung Keun Bong and IF Tim Hummel to Class AAA Louisville; reasigned LHP Mike Matthews, IF Jacob Cruz, OF McKay Christensen and OF Jermaine Clark to minor league camp."
2004-03-31,Cleveland Indians Acquired LHP Jeriome Robertson from Houston in exchange for minor league OF Luke Scott and the rights to Rule 5 OF Willy Taveras.
2004-03-31,Detroit Tigers Acquired nonroster OF Rich Gomez from San Diego for nonroster INF Rob Watson; optioned LHP Eric Eckenstahler to Triple-A Toledo; reassigned INF Jason Smith and OF Andres Torres.
2004-03-31,Acquired nonroster OF Rich Gomez from San Diego for nonroster INF Rob Watson; optioned LHP Eric Eckenstahler to Triple-A Toledo; reassigned INF Jason Smith and OF Andres Torres.
2004-03-31,Florida Marlins Released OF/INF Brian Banks and offered him a minor league contract.
2004-03-31,Houston Astros Acquired minor league OF Luke Scott and the rights to Rule 5 OF Willy Taveras from Cleveland in exchange for LHP Jeriome Robertson.
2004-03-31,"Kansas City Royals Purchased the contracts of LHP Dennys Reyes, RHP Shawn Camp and INF Mendy Lopez."
2004-03-31,"RHPs Mike MacDougal, Miguel Asencio, Kevin Appier, Runelvys Hernandez and Kyle Snyder all placed on 15-day disabled list."
2004-03-31,"Optioned to Triple-A Omaha pitchers Chris George, Ryan Bukvich, Jaime Cerda and Joe Dawley. Non-roster pitchers Kris Wilson, Greg Swindell, Rudy Seanez and Zack Greinke and OF David DeJesus."
2004-03-31,Los Angeles Dodgers Released OF Bubba Trammell.
2004-03-31,Minnesota Twins Placed RHP Sean Douglass on waivers.
2004-03-31,Philadelphia Phillies Released LHP Victor Alvarez.
2004-03-31,Pittsburgh Pirates Released LHP Joe Beimel.
2004-03-31,San Francisco Giants Placed RHP Jesse Foppert on the 60-day disabled list (rehab from elbow ligament transplant surgery); designated RHP Ryan Jensen for assignment; claimed LHP Kevin Walker off waivers from San Diego.
2004-03-31,Acquired LHP Wayne Franklin and RHP Leo Estrella from the Brewers for nonroster RHP Carlos Villanueva and nonroster RHP Glenn Woolard.
2004-03-31,"Seattle Mariners Reassigned C Pat Borders, INFs Jose Lopez and Mickey Lopez and OF Hiram Bocachica."
2004-03-31,St. Louis Cardinals Optioned RHP Kiko Calero to Triple-A Memphis.
2004-03-31,Texas Rangers Nonroster LHP Glendon Rusch opted for free agency; reassigned RHP Todd Williams.
2004-03-31,Toronto Blue Jays Claimed RHP Sean Douglass off waivers from the Twins.
2004-04-01,Anaheim Angels Placed Brendan Donnelly (RHP) and Greg Jones (RHP) on the 15-day disabled list (retroactive to March 26. Re-assigned Yoshitaka Mizuo (LHP) to minor-league camp.
2004-04-01,Chicago Cubs Glendon Rusch: Signed LHP Glendon Rusch to a minor league contract.
2004-04-01,Damian Jackson: Signed infielder Damian Jackson to a minor league contract.
2004-04-01,Gary Glover: Reassigned RHP Gary Glover to minor league camp.
2004-04-01,Chicago White Sox Optioned RHP Jason Grilli to Triple-A Charlotte.
2004-04-01,Cincinnati Reds Reassigned LHP Jesus Sanchez to minor league camp.
2004-04-01,"Colorado Rockies Optioned OF Choo Freeman, OF Brad Hawpe, RHP Allan Simpson and RHP Chin-hui Tsao to Triple-A Colorado Springs."
2004-04-01,Detroit Tigers Optioned RHP Ugueth Urbina to Single-A Lakeland.
2004-04-01,Acquired LHP Steve Colyer and a player to be named from the Dodgers for OF Cody Ross.
2004-04-01,"Florida Marlins Optioned INF Wilson Valdez to Triple-A Albuquerque. Reassigned to minor league camp OFs Gerald Williams and Ryan Christenson, C Matt Traenor, and INFs Derek Wathan and Larry Sutton."
2004-04-01,Kansas City Royals Released nonroster RHP Erik Hiljus.
2004-04-01,Los Angeles Dodgers Acquired outfielder Cody Ross from Detroit for Steve Colyer and a player to be named later or cash considerations.
2004-04-01,Minnesota Twins Optioned LHP Carlos Pulido to Triple-A Rochester; reassigned RHP Seth Greisinger and RHP Pete Munro to the minor league camp.
2004-04-01,Montreal Expos Optioned OF Matt Cepicky to Triple-A Edmonton and reassigned to the minor league camp C Paul Hoover and 1B/OF Joe Vitiello.
2004-04-01,"New York Mets Optioned infielder Danny Garcia, RHP Aaron Heilman and RHP Matt Ginter to Triple-A Norfolk. Reassigned outfielder Raul Gonzalez and RHP James Baldwin to minor league camp."
2004-04-01,Philadelphia Phillies Optioned catcher Michel Hernandez to Triple-A Scranton. Reassigned infielder Brian Hitchcox to minor league camp.
2004-04-01,RHP David Coggin cleared waivers and was optioned to Triple-A Scranton/Wilkes-Barre.
2004-04-01,Pittsburgh Pirates Purchased the contract of RHP Jose Mesa.
2004-04-01,"Placed OF Jason Bay and INF Freddy Sanchez on the 15-day disabled list, retroactive to March 26."
2004-04-01,San Diego Padres Outrighted 1B Todd Sears to Triple-A Portland.
2004-04-01,San Francisco Giants RHP Ryan Jensen cleared waivers and accepted an assignment to Triple-A Fresno. Jensen had been designated for assignment March 31.
2004-04-01,Seattle Mariners Optioned RHP Aaron Looper to Triple-A Tacoma.
2004-04-01,Placed RHP Aaron Taylor on the 60-day disabled list after September 2003 surgery on a partial right rotator-cuff tear.
2004-04-01,Toronto Blue Jays Reassigned outfielder Chad Hermansen to minor league camp.
2004-04-01,Outrighted RHP Justin Miller to Triple-A Syracuse.
2004-04-02,Baltimore Orioles Released nonroster RHP Jeff Juden.
2004-04-02,Reassigned INF Clay Bellinger to minor league camp.
2004-04-02,"Chicago Cubs Reassigned infielder Scott McClain, LHP Jimmy Anderson and RHP Bryan Corey to minor league camp. Signed infielder Benji Gil to a minor league contract."
2004-04-02,Chicago White Sox Placed LHP Kelly Wunsch on the 15-day disabled list (retroactive to March 31) with an inflamed left teres minor muscle.
2004-04-02,"Cleveland Indians Placed RHP Bob Wickman, C Josh Bard and OF Ryan Ludwick all went on the 15-day DL."
2004-04-02,Outrighted LHP Matt White to Triple-A Buffalo; placed LHP Brian Tallet on the 60-day disabled list recovering from August 2003 Tommy John surgery.
2004-04-02,Detroit Tigers Assigned INF Danny Klassen to minor league camp.
2004-04-02,Purchased the contracts of RHP Esteban Yan and INF Greg Norton from Triple-A Toledo; outrighted C Mike DiFelice to Triple-A Toledo; placed RHP Chris Spurling on the 60-day disabled list recovering from March 2004 Tommy John surgery.
2004-04-02,Returned Rule 5 LHP Mike Bumatay to the Rockies.
2004-04-02,Florida Marlins Optioned LHP Michael Tejera to Triple-A Albuquerque; released RHP Tanyon Sturtze and OF Gerald Williams
2004-04-02,Outrighted RHP Blaine Neal to Triple-A Albuquerque.
2004-04-02,Milwaukee Brewers Optioned RHP Nick Neugebauer to Single-A High Desert.
2004-04-02,"Brewers purchased the contracts of RHP Dave Burba, INF Trent Durrington, RHP Ben Ford and RHP Adrian Hernandez from Triple-A Indianapolis."
2004-04-02,Minnesota Twins Outrighted INF Augie Ojeda to Triple-A Rochester.
2004-04-02,New York Mets Reassigned catcher Danilo Reynoso and outfielder Ron Acuna to minor league camp.
2004-04-02,Philadelphia Phillies Acquired nonroster RHP Brian Sanches from the Padres for a PTBNL.
2004-04-02,Pittsburgh Pirates Optioned 1B Carlos Rivera to Triple-A Nashville.
2004-04-02,St. Louis Cardinals Released nonroster outfielder Mark Quinn and nonroster RHP Allen Levrault.
2004-04-02,"Purchased the contracts of OF Ray Lankford, C Cody McKay and INF Tony Womack from Triple-A Memphis."
2004-04-02,"Texas Rangers Released nonroster LHP Jordan Zimmerman, RHP Jovanny Cedeno and RHP Willie Banks."
2004-04-02,Placed OF Rusty Greer (rehab from left shoulder surgery) on the 60-day disabled list. Placed LHP Brian Shouse (left shoulder tendinitis) and RHP Jeff Zimmerman (right elbow rehab) on the 15-day disabled list.
2004-04-03,"Anaheim Angels Purchased the contract of catcher Josh Paul from Triple-A Salt Lake. Reassigned infielder Adam Riggs, infielder Brian Gordon, RHP Matt Hensley and RHP Scott Dunn to minor league camp."
2004-04-03,"Optioned infielder Alfredo Amezaga, infielder Robb Quinlan, LHP Tim Bittner and outfielder Barry Wesson to Triple-A Salt Lake. Optioned LHP Jake Woods to Double-A Arkansas."
2004-04-03,"Arizona Diamondbacks Optioned INF Chad Tracy and RHP Greg Aquino to Triple-A Tucson; reassigned Juan Brito, Brandon Villafuerte, Jim Parque, Julio Ramirez and Alan Zinter to minor league camp; purchased the contracts of Bobby Estalella and Donnie Sadler; placed Shane Nance, Casey Fossum and Robby Hammock on the 15-day DL; placed Brandon Lyon on the 60-day DL."
2004-04-03,"Baltimore Orioles Optioned OF Darnell McDonald to AAA Ottawa. Reassigned RHPs Aaron Rakers and Darwin Cubillan and C Carlos Mendez to minor league camp. Placed LHP Omar Daal on the 60-day disabled list; placed 2B Jerry Hairston and OF Marty Cordova on the 15-day DL, retroactive to March 26. IF/OF Mark McLemore was granted his release at his own request. RHP John Stephens, who was optioned to AAA Ottawa on March 19, was designated for assignment. Purchased the minor league contracts of non-roster invitees INF Luis Lopez, C Keith Osik and B.J. Surhoff and added them to the 40-man roster."
2004-04-03,Boston Red Sox Optioned RHP Jamie Brown to Triple-A Pawtucket.
2004-04-03,Outrighted RHP Bryan Hebson to Triple-A Pawtucket.
2004-04-03,Chicago Cubs Purchased the contract of RHP Michael Wuertz from Triple-A Iowa.
2004-04-03,Chicago White Sox Optioned C Jamie Burke to Triple-A Charlotte.
2004-04-03,Purchased the contract of RHP Mike Jackson from Triple-A Charlotte.
2004-04-03,Cincinnati Reds Purchased the contracts of C Javier Valentin and RHP Todd Jones. Placed RHP D.J. Mattox on 60-day DL.
2004-04-03,"Cleveland Indians Optioned OF Milton Bradley to Triple-A Buffalo; purchase the contracts of RHP Jeff D''Amico and INF Lou Merloni; reassigned RHPs Jason Bere, Luther Hackman and Bobby Howry to minor league camp; reassigned C Dusty Wathan and INF Chris Clapinski to minor league camp."
2004-04-03,"Colorado Rockies Placed RHP Adam Bernero on 60-day disabled list (shoulder); placed LHP Dennis Neagle on 60-day disabled list (elbow); placed OF Larry Walker on 15-day disabled list, retroactive to March 26."
2004-04-03,"Purchased the contracts of SS Royce Clayton, LHP Shawn Estes, LHP Jeff Fassero, IF-OF Denny Hocking, RHP Vladimir Nunez, OF-C Kit Pellow, OF Mark Sweeney and RHP Turk Wendell; designated RHP Justin Huisman, OF Jorge Piedra and LHP Cory Vance for assignment; placed OF Cory Sullivan on waivers for the purpose of granting him his unconditional release."
2004-04-03,Detroit Tigers Released nonroster catcher Mike DiFelice.
2004-04-03,Florida Marlins Transferred RHP Tim Spooneybarger to the 60-day DL with a right elbow injury.
2004-04-03,"Traded RHP Blaine Neal to Padres for RHP Ben Howard. Optioned Howard to Triple-A Albuquerque. To make room for Howard on 40-man roster, RHP Tim Spooneybarger was transferred from the 15-day disabled list to the 60-day DL. Selected the contracts of LHP Matt Perisho, INF Damion Easley and INF Lenny Harris."
2004-04-03,Houston Astros Purchased the contract of RHP Jared Fernandez from Triple-A New Orleans.
2004-04-03,Optioned RHP Brandon Backe and LHP Mike Gallo to Triple-A New Orleans.
2004-04-03,Kansas City Royals Reassigned RHP Jamey Wright to minor league camp.
2004-04-03,"Purchased the contracts of RHP Shawn Camp, INF Mendy Lopez and LHP Dennys Reyes from Triple-A Omaha."
2004-04-03,"Los Angeles Dodgers Acquired pitcher Aaron Looper and pitcher Ryan Ketchner from Seattle for infielder Jolbert Cabrera. Acquired shortstop Antonio Perez from Tampa Bay for outfielder Jason Romano. Optioned pitcher Edwin Jackson, catcher Koyie Hill, pitcher Aaron Looper and shortstop Antonio Perez to Triple-A Las Vegas. Reassigned pitchers Rick White and Doug Nickle to Triple-A Las Vegas."
2004-04-03,Montreal Expos Purchased the contract of RHP Jeremy Fikacand INF Luis Lopez from Triple-A Edmonton.
2004-04-03,"Placed RHP Tony Armas Jr., LHP Joey Eischen, 3B Scott Hodges and 1B Nick Johnson on the 15-day disabled list. Placed RHP Dan Smith on the 60-day DL."
2004-04-03,"Acquired C Einar Diaz, RHP Justin Echols and cash from the Rangers for C/IF Josh McKinley and RHP Chris Young."
2004-04-03,New York Mets Traded OF Roger Cedeno and cash to St. Louis for C Chris Widger and non-roster IF Wilson Delgado.
2004-04-03,"Philadelphia Phillies RHP Geoff Geary and INF Chase Utley were optioned to Triple-A Scranton/Wilkes-Barre. C A.J. Hinch, LHP Jim Crowell and INF Lou Collier were re-assigned to Scranton."
2004-04-03,Pittsburgh Pirates Optioned LHP Sean Burnett to Triple-A Nashville and reassigned RHP Rick Reed to minor league camp.
2004-04-03,"San Diego Padres Purchased the contract of LHP Eddie Oropesa; placed IF Jeff Cirillo on the 15-day disabled list with a broken right index finger; optioned LHP Sterling Hitchcock to Single-A Lake Elsinore; reassigned RHPs Joey Hamilton and Brandon Puffer, outfielder Gene Kingsale and catcher Yamid Haad to Triple-A Portland. Acquired RHP Blaine Neal from Florida for RHP Ben Howard."
2004-04-03,"San Francisco Giants Purchased the contract of RHP David Aardsma; placed OF Jeffrey Hammonds (fractured right thumb), 1B Lance Niekro (right ankle sprain) and RHP Jason Schmidt (right shoulder strain) on the 15-day disabled list, all retroactive to March 26; designated LHP Chad Zerbe for assignment; optioned OFs Jason Ellison and Todd Linden, LHP Noah Lowry and C Trey Lunsford to Triple-A Fresno; reassigned RHP Dave Veres, IF Deivi Cruz and IF/OF Francisco Santos to the minors."
2004-04-03,Seattle Mariners Acquired infielder Jolbert Cabrera from the Dodgers for RHP Aaron Looper and nonroster LHP Ryan Ketchner. Optioned infielder Ramon Santiago to Triple-A Tacoma. Purchased the contract of LHP Mike Myers from Triple-A Tacoma. Reassigned LHP Terry Mulholland to minor league camp.
2004-04-03,"St. Louis Cardinals Reassigned LHP Doug Creek, outfielder Emil Brown and RHP Alan Benes to minor league camp."
2004-04-03,Optioned infielder Bo Hart to Triple-A Memphis.
2004-04-03,Acquired OF Roger Cedeno and cash from the Mets for C Chris Widger and nonroster INF Wilson Delgado.
2004-04-03,"Texas Rangers Acquired C Josh McKinley and RHP Chris Young from the Montreal Expos for C Einar Diaz, RHP Justin Echols and cash considerations."
2004-04-03,"Recalled OF Ramon Nivar from Triple-A Oklahoma. Placed OF Brian Jordan (sore knee) on the 15-day disabled list retroactive to March 27. Optioned RHP Ryan Drese and RHP Ricardo Rodriguez to Triple-A Oklahoma. Reassigned IF Manny Alexander, RHP Doug Brocail, OF Jason Conti, C Ken Huckaby and OF Chad Allen to minor league camp."
2004-04-04,"Atlanta Braves Purchased the contracts of LHP C.J. Nitkowski, 1B Julio Franco, OF DeWayne Wise. Placed LHP Armando Almanza, utility man Eli Marrero and Paul Byrd on the disabled list. Optioned RHP Trey Hodges and IF Wilson Betemit to Triple-A Richmond. Reassigned RHP Tim Drew, RHP Ryan Glynn, C Joe DePastino, C Lee Evans, IF Jorge Velandia and OF Damon Hollins to Richmond."
2004-04-04,"Boston Red Sox Optioned LHP Tim Hamulack to Triple-A Pawtucket; reassigned OF Adam Hyzdu to minor league camp; placed RHP Jason Shiell on the 15-day disabled list retroactive to March 26 as he recovers from an arthrogram MRI; and purchased the contracts of INF/OF Cesar Crespo, INF Brian Daubach and INF/OF David McCarty; purchased the contract of LHP Bobby M. Jones from Triple-A Pawtucket."
2004-04-04,"Chicago Cubs Placed LHP Mike Remlinger on the 15-day disabled list, recovering from October 2003 rotator cuff surgery."
2004-04-04,Cleveland Indians Acquired minor league outfielder Franklin Gutierrez and a player to be named from Los Angeles in exchange for outfielder Milton Bradley.
2004-04-04,"Colorado Rockies Reassigned C Willie Morales, C Hector Ortiz, IF Andy Tracy and Tim Harikkala to minor league camp; optioned OF Matt Holliday to Triple-A Colorado Springs."
2004-04-04,Los Angeles Dodgers Acquired OF Milton Bradley from the Indians for nonroster OF Franklin Gutierrez and a PTBN.
2004-04-04,Minnesota Twins Placed RHP Grant Balfour on the 15-day disabled list with right shoulder tenderness; recalled LHP Carlos Pulido from Triple-A Rochester.
2004-04-04,"Purchased the contracts of LHP Aaron Fultz, C Joe Mauer, INF Jose Offerman and RHP Joe Roa from Triple-A Rochester; placed RHP Joe Mays on the 60-day disabled list, recovering from September 2003 Tommy John surgery."
2004-04-04,Montreal Expos Reassigned catcher Gregg Zaun to minor league camp.
2004-04-04,"New York Mets Mets placed INF Mo Vaughn on the 60-day disabled list with severe osteo-arthritis of the left knee; placed RHP Scott Strickland on the 60-day disabled list, recovering from June 2003 Tommy John surgery; purchased the contracts of RHP Scott Erickson, OF Eric Valent and OF Shane Spencer from Triple-A Norfolk; designated RHP Jason Anderson and C Chris Widger for assignment. Reassigned RHP Ricky Bottalico to minor league camp."
2004-04-04,"Oakland Athletics Placed infielder Mark Ellis on the 15-day disabled list, retroactive to March 26, with a dislocated right shoulder. Placed infielder Frank Menechino on the 15-day disabled list, retroactive to March 26, with a strained right calf."
2004-04-04,"Optioned RHP Rich Harden to Triple-A Sacaramento. Reassigned catcher Mike Rose, RHP Britt Reames and RHP Steve Woodard to minor league camp. Signed free agent infielder Mark McLemore to a one-year contract."
2004-04-04,"Mark McLemore: Signed INF Mark McLemore to a one-year contract and placed him on the 15-day disabled list, retroactive to March 26, recovering from right knee surgery."
2004-04-04,San Diego Padres Placed RHP Rod Beck on the restricted list.
2004-04-04,Tampa Bay Devil Rays The Devil Rays acquired INF/OF Jason Romano from the Dodgers in exchange for INF Antonio Perez.
2004-04-05,"Chicago Cubs Ryan Dempster: Placed on the 60-day disabled list, recovering from August 2003 Tommy John surgery."
2004-04-05,Colorado Rockies Signed infielder Erick Almonte to a minor league contract.
2004-04-05,"Los Angeles Dodgers Designated P Aaron Looper and OF Wilkin Ruan for assignment; purchased the contract of INF Jose Hernandez, RHP Jose Lima and INF Olmedo Saenz from Triple-A Las Vegas. Optioned infielder Joe Thurston to Triple-A Las Vegas. Reassigned infielder Jeremy Giambi to minor league camp."
2004-04-05,Pittsburgh Pirates Signed INF Terry Shumpert to a minor league contract.
2004-04-05,"St. Louis Cardinals Placed LHP Rick Ankiel on the 15-day disabled list, recovering from July 2003 Tommy John surgery."
2004-04-06,Arizona Diamondbacks Recalled RHP Andrew Good from Triple-A Tucson.
2004-04-06,Placed RHP Shane Reynolds on the 15-day disabled list with an inflamed rotator cuff.
2004-04-06,Florida Marlins Re-signed outfielder Brian Banks to a minor league contract.
2004-04-06,Kansas City Royals Placed second baseman Desi Relaford on the 15-day DL with a strained left hamstring.
2004-04-06,Tampa Bay Devil Rays Designated OF Charles Gipson for assignment.
2004-04-07,Cleveland Indians Acquired nonroster catcher Sandy Martinez from the Pirates for a player to be named. Signed outfielder Todd Dunwoody to a minor league contract.
2004-04-07,Colorado Rockies Signed OF Cory Sullivan to a minor-league contract.
2004-04-07,Detroit Tigers Placed Dmitri Young on the 15-day disabled list; purchased the contract of OF Andres Torres from Triple-A Toledo.
2004-04-07,Kansas City Royals Recalled LHP Jaime Cerda from Triple-A Omaha.
2004-04-07,Minnesota Twins Placed C Joe Mauer on the 15-day disabled list with a torn meniscus in his left knee; purchased the contract of RHP Seth Greisinger from Triple-A Rochester; desginated RHP Micheal Nakamura for assignment.
2004-04-07,New York Mets Released nonroster outfielder Kenny Kelly.
2004-04-07,Texas Rangers Released nonroster outfielder Jason Tyner. Signed outfielder Gary Matthews to a minor league contract.
2004-04-08,"Boston Red Sox Claimed RHP John Stephens off waivers from the Orioles and assigned him to Triple-A Pawtucket; transferred RHP Reynaldo Garcia to the 60-day disabled list, recovering from March 2004 right elbow surgery."
2004-04-08,Cleveland Indians Claimed RHP Jason Anderson off waivers from the Mets and assigned him to Triple-A Buffalo.
2004-04-08,Colorado Rockies Outrighted outfielder Jorge Piedra to Triple-A Colorado Springs. Piedra had been designated for assignment on April 3.
2004-04-08,Kansas City Royals Acquired RHP Justin Huisman from the Rockies for RHP Zach McClellan and INF Chris Fallon and cash.
2004-04-08,Minnesota Twins Placed C Matthew LeCroy on the 15-day disabled list with a pulled oblique muscle in his ribcage; recalled C Rob Bowen from Double-A New Britain.
2004-04-08,New York Mets Placed RHP Scott Erickson on the 15-day disabled list with a strained left hamstring. Recalled RHP Jae Weong Seo from Triple-A Norfolk.
2004-04-09,Boston Red Sox Placed RHP Ramiro Mendoza on 15-day disabled list with tendinitis in his right shoulder; recalled LHP Mark Malaska from Triple-A Pawtucket.
2004-04-09,Kansas City Royals Transferred RHP Runelvys Hernandez from 15-day to the 60-day disabled list. Added RHP Justin Huisman to the 40-man roster.
2004-04-09,Minnesota Twins Placed OF Torii Hunter on the 15-day disabled list with a strained right hamstring; recalled OF Lew Ford from Triple-A Rochester.
2004-04-09,Texas Rangers Claimed LHP Cory Vance off waivers from the Rockies and optioned him to Triple-A Oklahoma.
2004-04-09,Toronto Blue Jays Signed catcher Gregg Zaun to a minor league contract and assigned him to Triple-A Syracuse.
2004-04-09,Claimed RHP Micheal Nakamura off waivers from the Twins and optioned him to Triple-A Syracuse.
2004-04-10,Baltimore Orioles Recalled LHP Erik Bedard from Triple-A Ottawa.
2004-04-10,Designated Jack Cust for assignment.
2004-04-10,Boston Red Sox Purchased the contract of RHP Frank Castillo from Triple-A Pawtucket; designated INF Brian Daubach for assignment.
2004-04-10,"Houston Astros Placed LHP Andy Pettitte on the 15-day disabled list, retroactive to April 7, with a strained left elbow. Recalled RHP Brandon Backe from Triple-A New Orleans."
2004-04-10,Minnesota Twins Signed LHP Joe Beimel to a minor league contract and assigned him to Triple-A Rochester.
2004-04-10,San Francisco Giants Placed RHP Jason Schmidt on rehab assignment with Single-A San Jose.
2004-04-10,Activated OF Jeffrey Hammonds from the 15-day disabled list; designated RHP Leo Estrella for assignment. Activated IF Lance Niekro from the 15-day DL and optioned him to Triple-A Fresno.
2004-04-10,Tampa Bay Devil Rays Signed outfielder Bubba Trammell to a minor league contract and assigned him to Triple-A Durham.
2004-04-11,"St. Louis Cardinals Placed Roger Cedeno on 15-day disabled list, recalled Bo Hart from Triple-A Memphis."
2004-04-12,New York Mets Placed OF Cliff Floyd on the 15-day disabled list with a strained right quad; recalled OF Jeff Duncan from Triple-A Norfolk.
2004-04-12,Seattle Mariners Re-acquired RHP Aaron Looper from the Dodgers and optioned him to Triple-A Tacoma; requested an unconditional waiver release for C Ryan Christianson.
2004-04-13,Anaheim Angels Agreed to terms on four-year contract with club option for 2009 with Garret Anderson (OF).
2004-04-13,Chicago Cubs Placed 2B Mark Grudzielanek on the 15-day disabled list retroactive to April 10 (partial tear right Achilles) and activated OF/IF Jose Macias from the 15-day DL.
2004-04-13,Detroit Tigers Signed C Mike DiFelice to a minor league contract.
2004-04-13,Houston Astros Optioned RHP Jared Fernandez to Triple-A New Orleans. Recalled LHP Mike Gallo from Triple-A New Orleans.
