date,transaction
2004-06-01,Placed OF Kenny Lofton on 15-day DL (retroactive to May 27) with strained left hamstring; RHP Bret Prinz recalled from Triple-A Columbus
2004-06-01,Toronto Blue Jays Purchased the contract of RHP Josh Towers from Triple-A Syracuse; designated RHP Jesse Harper for assignment; placed RHP Justin Miller on the 15-day disabled list with a right hamstring strain.
2004-06-02,Anaheim Angels INF Adam Riggs cleared waivers and accepted an assignment to Triple-A Salt Lake. He had been designated for assignment on May 29.
2004-06-02,"Baltimore Orioles Placed OF Jay Gibbons on the 15-day disabled list, retroactive to May 26, with back spasms; recalled OF Tim Raines Jr. from Triple-A Ottawa."
2004-06-02,Chicago Cubs Optioned RHP Sergio Mitre to Triple-A Iowa.
2004-06-02,Florida Marlins Transferred RHP A.J. Burnett from the 15-day DL to the 60-day disabled list.
2004-06-02,Placed C Ramon Castro on the 15-day DL with inflammation in his right big toe. Selected the contract of C Matt Treanor from Triple-A Albuquerque.
2004-06-02,Los Angeles Dodgers Recalled RHP Edwin Jackson from Triple-A Las Vegas; signed RHP Giovanni Carrara to a minor league contract and assigned him to Triple-A Las Vegas.
2004-06-02,Minnesota Twins Activated C Joe Mauer from the 15-day disabled list; optioned 1B/DH Justin Morneau to Triple-A Rochester.
2004-06-02,Oakland Athletics Placed 3B Eric Chavez on the 15-day disabled list with a broken bone in his right hand; recalled INF Esteban German from Triple-A Sacramento.
2004-06-02,Pittsburgh Pirates Recalled LHP Mike Gonzalez from Nashville (AAA) and placed RHP Brian Boehringer on the 15-day disabled list (right shoulder tendinitis).
2004-06-02,San Diego Padres Placed OF Brian Buchanan on the 15-day disabled list retroactive to May 29 with a strained left oblique and recalled OF Xavier Nady from Triple-A Portland.
2004-06-02,Seattle Mariners Sent RHP Gil Meche to the Triple-A Tacoma Rainiers and promoted OF/IF Hiram Bocachica.
2004-06-02,Tampa Bay Devil Rays Released RHP Al Reyes from Triple-A Durham.
2004-06-03,Cleveland Indians RHP Chad Durbin cleared waivers and was outrighted to Triple-A Buffalo. He had been designated for assignment on May 29.
2004-06-03,Colorado Rockies Optioned RHP Vladimir Nunez and OF Rene Reyes to Triple-A Colorado Springs; recalled RHP Scott Dohmann and OF Choo Freeman from Triple-A Colorado Springs.
2004-06-03,Florida Marlins Activated RHP A.J. Burnett from the 60-day disabled list. Outrighted 1B Larry Sutton to Triple-A Albuquerque
2004-06-03,Houston Astros Optioned RHP Brandon Backe to Triple-A New Orleans.
2004-06-03,Signed RHP Pete Munro as a free agent and placed him on the 25-man roster.
2004-06-03,Los Angeles Dodgers Designated RHP Rodney Myers for assignment.
2004-06-03,Milwaukee Brewers Claimed RHP Jesse Harper off waivers from the Blue Jays; designated RHP Tim Bausher for assignment.
2004-06-03,San Francisco Giants Placed OF Jeffrey Hammonds on waivers for the purpose of giving him his unconditional release; recalled OF Todd Linden from Triple-A Fresno.
2004-06-03,Seattle Mariners Purchased the contract of OF Hiram Bocachica from Triple-A Tacoma.
2004-06-03,St. Louis Cardinals Mike Matheny: Placed C Mike Matheny on 15-day disabled list; purchased the contract of C Yadier Molina from Triple-A Memphis
2004-06-03,Tampa Bay Devil Rays Claimed INF/OF Jose Bautista off waivers from the Baltimore Orioles.
2004-06-03,"Released RHP Paul Abbott, designated RHP Jason Standridge for assignment and recalled RHP Dewon Brazelton and RHP Jesus Colome from Triple-A."
2004-06-04,Baltimore Orioles Recalled RHP Rick Bauer from AAA Ottawa and designated RHP Darwin Cubillan for assignment.
2004-06-04,Chicago Cubs Activated LHP Kent Mercker and RHP Mark Prior from the disabled list; RHP Michael Wuertz was optioned to Triple-A Iowa and SS Alex Gonzalez was transferred from the 15-day to the 60-day disabled list.
2004-06-04,Chicago White Sox Recalled catcher Jamie Burke from Class AAA Charlotte.
2004-06-04,Placed OF Magglio Ordonez on the 15-day disabled list (retroactive to May 26) with inflammation and soreness in his left knee.
2004-06-04,Cincinnati Reds Brandon Larson: Recalled third baseman Brandon Larson from Triple-A Louisiville.
2004-06-04,Aaron Harang: The Reds placed Aaron Harang on the 15-day DL with a strained ligament in his right elbow.
2004-06-04,Kansas City Royals INF Mendy Lopez cleared waivers and accepted an assignment to Triple-A Omaha. He had been designated for assignment on May 28.
2004-06-04,Los Angeles Dodgers Optioned RHP Edwin Jackson to Triple-A Las Vegas; activated OF Jayson Werth from the 15-day disabled list.
2004-06-04,Milwaukee Brewers Purchased the contract of INF Jeff Liefer from Triple-A Indianapolis; designated C Kade Johnson for assignment; optioned RHP Ben Hendrickson to Triple-A Indianapolis.
2004-06-04,Montreal Expos Rigo Beltran: Expos activated LHP Rigo Beltran from the 15-day disabled list and sent him outright to Triple-A Edmonton.
2004-06-04,Philadelphia Phillies Acquired nonroster RHP Robert Ellis from the Indians for a player to be named.
2004-06-04,San Francisco Giants Optioned IF Brian Dallimore to Triple-A Fresno; purchased the contract of IF Cody Ransom from Fresno.
2004-06-04,"Seattle Mariners Placed OF Raul Ibanez on the 15-day disabled list, retro to June 3, with a strained right hamstring and recalled INF Ramon Santiago from Triple-A Tacoma."
2004-06-04,Tampa Bay Devil Rays Designated OF Charles Gipson for assignment; sold nonroster RHP Dicky Gonzalez to the Yakult Swallows of the Japanese Central League.
2004-06-04,Toronto Blue Jays Placed RHP Roy Halladay on the 15-day disabled list (retroactive to May 28) with shoulder soreness; recalled RHP Bob File from AAA Syracuse.
2004-06-05,Anaheim Angels Optioned RHP Ben Weber to Single-A Rancho Cucamonga; recalled RHP Matt Hensley from Triple-A Salt Lake.
2004-06-05,Arizona Diamondbacks Purchased the contract of P Brandon Villafuerte from Triple-A Tucson; designated INF Donnie Sadler for assignment; recalled RHP Edgar Gonzalez from Triple-A Tucson; optioned LHP Shane Nance to Triple-A Tucson.
2004-06-05,Chicago White Sox Sent LHP Kelly Wunsch outright to Triple-A Charlotte.
2004-06-05,Kansas City Royals Acquired nonroster LHP Matt White from the Indians for a player to be named.
2004-06-05,Los Angeles Dodgers Sent LHP Hong-Chih Kuo outright to Single-A Columbus.
2004-06-05,Toronto Blue Jays Signed OF Anton French to a minor league contract and assigned him to Double-A New Hampshire.
2004-06-06,Anaheim Angels Placed RHP Troy Percival on the 15-day disabled list (inflamed right elbow) retroactive to June 2.
2004-06-06,Baltimore Orioles Signed RHP Matt DeWitt to a minor league contract and assigned him to Triple-A Ottawa.
2004-06-06,Chicago Cubs Placed RHP Joe Borowski on the 15-day disabled list and called up RHP Jon Leicester from Triple-A Iowa.
2004-06-06,New York Yankees Activated 1B Jason Giambi from disabled list; optioned OF Bubba Crosby to Triple-A Columbus.
2004-06-06,Philadelphia Phillies Activated INF Placido Polanco from the 15-day disabled list; optioned RHP Josh Hancock to Triple-A Scranton/Wilkes-Barre.
2004-06-06,San Diego Padres Activated LHP David Wells from the 15-day disabled list; optioned RHP Justin Germano to Triple-A Portland; signed LHP Donovan Osborne to a minor league contract and assigned him to Triple-A Portland.
2004-06-06,St. Louis Cardinals Signed RHP Al Reyes to a minor league contract and assigned him to Triple-A Memphis.
2004-06-06,Toronto Blue Jays Signed RHP Ryan Glynn to a minor league contract and assigned him to Triple-A Syracuse.
2004-06-07,"Baltimore Orioles Selected RHP Wade Townsend, of Rice University, with their first-round selection in the 2004 First Year Player Draft. Townsend was the eighth pick overall in the draft."
2004-06-07,Colorado Rockies Transferred OF Larry Walker to the 60-day DL.
2004-06-07,Placed LHP Brian Fuentes on the 15-day disabled list with a strained muscle in his left side; purchased the contract of RHP Marc Kroon from Triple-A Colorado Springs.
2004-06-07,Milwaukee Brewers Acquired OF Peter Bergeron and a player to be named from the Expos for OF Jason Belcher and RHP Jason Childers.
2004-06-07,Minnesota Twins Signed RHP Gary Glover to a minor league contract and assigned him to Triple-A Rochester.
2004-06-07,Montreal Expos Selected 18 players on the first day of 2004 First-Year Player Draft. Selected William & Mary left-handed pitcher Bill Bray with their first selection (13th overall).
2004-06-07,Acquired OF Jason Belcher and RHP Jason Childers from the Milwaukee Brewers in exchange for OF Peter Bergeron and a player to be named.
2004-06-07,San Diego Padres Released RHP Joey Hamilton from Triple-A Portland.
2004-06-07,San Francisco Giants Placed 2B Ray Durham on a rehab assignment with Triple-A Fresno.
2004-06-07,"Texas Rangers Activated RHP Doug Brocail from the 15-day disabled list; Placed RHP Jay Powell on the 15-day disabled list, retroactive to June 5, with right elbow soreness."
2004-06-08,Anaheim Angels Purchased the contract of LHP Dusty Bergman from Triple-A Salt Lake; transferred RHP Brendan Donnelly from the 15-day to the 60-day disabled list.
2004-06-08,Arizona Diamondbacks Optioned RHP Edgar Gonzalez to Triple-A Tucson.
2004-06-08,Purchased the contract of C/1B Alan Zinter from Triple-A Tucson.
2004-06-08,Baltimore Orioles RHP Darwin Cubillan cleared waivers and accepted an assignment to Triple-A Ottawa; he had been designated for assignment on June 4; signed infielder Edwards Guzman to a minor league contract and assigned him to Triple-A Ottawa.
2004-06-08,RHP Darwin Cubillan cleared waivers and accepted an assignment to Triple-A Ottawa; he had been designated for assignment on June 4; signed infielder Edwards Guzman to a minor league contract and assigned him to Triple-A Ottawa.
2004-06-08,"Cincinnati Reds Placed RF Austin Kearns on the 15-day disabled list (sore right thumb), retroactive to 6/2, and recalled LHP Jung Keun Bong from Louisville."
2004-06-08,Cleveland Indians Placed RHP Joe Dawley on the 15-day disabled list with a right elbow strain (retroactive to June 7); recalled RHP Kazuhito Tadano from Triple-A Buffalo.
2004-06-08,Los Angeles Dodgers Activated RHP Hideo Nomo off the 15-day disabled list. Optioned RHP Brian Falkenborg to Triple-A Las Vegas.
2004-06-08,Minnesota Twins Activated 2B Luis Rivas from disabled list. Optioned IF Alex Prieto to Triple-A Rochester.
2004-06-08,"Philadelphia Phillies Activated LHP Billy Wagner from the 15-day disabled list; placed LHP Randy Wolf on the 15-day disabled list, retroactive to June 3, with tendinitis in his left elbow."
2004-06-08,Texas Rangers Signed RHP Rick Helling to a minor league contract and assigned him to Triple-A Oklahoma.
2004-06-08,"Toronto Blue Jays Activated SS Chris Woodward (right hamstring), OF Frank Catalanotto (right groin) and RHP Justin Speier (right elbow) from the 15-day disabled list; optioned INF/OF Simon Pond to Triple-A Syracuse of the International League; placed 1B Carlos Delgado (rib cage) on the 15-day disabled list, retroactive to May 30; placed LHP Valerio De Los Santos (left shoulder) on the 15-day disabled list, retroactive to June 6."
2004-06-09,Anaheim Angels Placed OF Raul Mondesi on the 15-day disabled with with a torn right quad.
2004-06-09,Activated designated hitter Tim Salmon from the 15-day disabled list and optioned IF/OF Robb Quinlan to Triple-A Salt Lake.
2004-06-09,"Arizona Diamondbacks Purchased the contract of C Juan Brito from AAA Tucson, placed C Brent Mayne on the 15-day DL, and transferred IF Matt Kata from the 15-day DL to the 60-day DL."
2004-06-09,Boston Red Sox Activated SS Nomar Garciaparra from the 15-day disabled list and recalled LHP Mark Malaska from Triple-A Pawtucket; outrighted INF/OF Brian Daubach and optioned RHP Jamie Brown to Triple-A.
2004-06-09,Colorado Rockies Claimed RHP Tim Bausher off waivers from the Brewers and optioned him to Double-A Tulsa.
2004-06-09,Houston Astros Purchased the contract of RHP Kirk Bullinger from Triple-A New Orleans; optioned RHP Brandon Duckworth to Triple-A New Orleans.
2004-06-09,New York Mets RHP Orber Moreno placed on the 15-day disabled list on June 9. Tyler Yates recalled from Triple-A Norfolk.
2004-06-09,Transferred INF Jose Reyes from the 15-day to the 60-day disabled list.
2004-06-09,Purchased the contract of OF Gerald Williams from Triple-A Norfolk.
2004-06-09,Philadelphia Phillies Signed RHP Paul Abbott to a minor league contract and assigned him to Triple-A Scranton.
2004-06-09,Tampa Bay Devil Rays Sent RHP Jason Standridge outright to Triple-A Durham. He had been designated for assignment on June 3.
2004-06-10,Anaheim Angels Activated OF Garret Anderson from the 15-day disabled list.
2004-06-10,Arizona Diamondbacks Transferred RHP Matt Mantei from the 15-day to the 60-day disabled list; purchased the contract of INF Andy Green from Triple-A Tucson; placed INF Carlos Baerga on the 15-day disabled list with a strained left calf.
2004-06-10,Florida Marlins Placed RHP Justin Wayne on the 15-day disabled list with right shoulder tendinitis. Recalled RHP Mike Neu from Triple-A Albuquerque.
2004-06-10,Montreal Expos Reacquired nonroster C Josh McKinley from the Rangers for nonroster INF Seth Taylor and nonroster C Ben Margalski.
2004-06-10,New York Mets OF Gerald Williams recalled from Norfolk. IF Danny Garcia optioned to Norfolk.
2004-06-10,St. Louis Cardinals Optioned OF So Taguchi to Triple-A Memphis; recalled RHP Danny Haren from Triple-A Memphis.
2004-06-10,Tampa Bay Devil Rays Placed RHP Doug Waechter on the 15-day disabled list with a strained tendon in his right middle finger; recalled RHP Chad Gaudin from Triple-A Durham.
2004-06-10,Toronto Blue Jays Activated C Kevin Cash from the DL and optioned RHP Aquilino Lopez to Triple-A Syracuse.
2004-06-11,Anaheim Angels Placed RHP Aaron Sele on the 15-day disabled list with right shoulder fatigue; recalled OF Robb Quinlan from Triple-A Salt Lake.
2004-06-11,Boston Red Sox Signed LHP Matt Beech to a minor league contract; optioned C Andy Dominique to Triple-A Pawtucket; activated RHP Scott Williamson from the 15-day disabled list.
2004-06-11,Chicago Cubs Activated OF Tom Goodwin from the 15-day disabled list; optioned OF David Kelton to Triple-A Iowa.
2004-06-11,Cleveland Indians Purchased the contract of C Sandy Martinez from Triple-A Buffalo; designated RHP Lou Pote for assignment.
2004-06-11,Montreal Expos Purchased the contract of LHP Joe Horgan from Triple-A Edmonton; placed RHP Tomo Ohka on the 15-day disabled list with a broken right arm.
2004-06-11,San Diego Padres Purchased the contract of RHP Blaine Neal from Triple-A Portland; optioned RHP Brandon Puffer to Triple-A Portland.
2004-06-11,San Francisco Giants Placed RHP Brett Tomko on the 15-day disabled list with right elbow inflammation; recalled LHP Noah Lowry from Triple-A Fresno.
2004-06-11,St. Louis Cardinals Optioned RHP Danny Haren to Triple-A Memphis; recalled RHP Jason Simontacchi from Triple-A Memphis.
2004-06-12,Arizona Diamondbacks Signed OF Quinton McCracken to a minor league contract and assigned him to Triple-A Tucson.
2004-06-12,Cleveland Indians Purchased the contract of RHP Scott Elarton from Triple-A Buffalo; optioned OF Alex Escobar to Triple-A Buffalo.
2004-06-12,Milwaukee Brewers Activated LHP Chris Capuano from the 15-day disabled list; optioned INF Trent Durrington to Triple-A Indianapolis.
2004-06-12,Minnesota Twins Optioned LHP J.C. Romero and RHP Seth Greisinger to Triple-A Rochester; recalled RHP Matt Guerrier and OF Michael Restovich from Triple-A Rochester.
2004-06-12,New York Yankees Activated OF Kenny Lofton from DL; designated INF Homer Bush for assignment.
2004-06-12,Texas Rangers Activated OF Kevin Mench from the 15-day DL. Designated OF Chad Allen for assignment.
2004-06-12,Toronto Blue Jays Activated RHP Roy Halladay from 15-day DL; placed RHP Kerry Ligtenberg on 15-day DL (left hip).
2004-06-13,Anaheim Angels Activated 1B Darin Erstad from the 15-day disabled list. Optioned 1B Casey Kotchman to Triple-A Salt Lake.
2004-06-13,Houston Astros Recalled INF Eric Bruntlett from Triple-A New Orleans and optioned RHP Ricky Stone to New Orleans.
2004-06-13,Philadelphia Phillies Placed Amaury Telemaco on 15-day DL to make room for Paul Abbott.
2004-06-13,Purchased the contract of P Paul Abbott from Scranton/Wilkes-Barre and designated P Jim Crowell for assignment.
2004-06-14,"Anaheim Angels Placed C Bengie Molina on the 15-day disabled list, retroactive to June 4, with a strained left calf."
2004-06-14,Baltimore Orioles Activated OF Jay Gibbons from the 15-day disabled list; optioned OF Tim Raines Jr. to Triple-A Ottawa.
2004-06-14,Chicago Cubs Signed INF Ricky Gutierrez to a minor league contract and assigned him to Triple-A Iowa.
2004-06-14,Cincinnati Reds Purchased the contract of OF Jermaine Clark from Triple-A Louisville; optioned RHP Joe Valentine to Triple-A Louisville.
2004-06-14,Kansas City Royals Designated OF Brandon Berger and INF Wilton Guerrero for assignment. Purchased the contracts of OF Dee Brown from Double-A Wichita and INF Damian Jackson from Triple-A Omaha.
2004-06-14,Philadelphia Phillies Activated RHP Brian Powell from the 15-day disabled list; optioned INF Chase Utley to Triple-A Scranton/Wilkes-Barre.
2004-06-14,Texas Rangers Placed OF Laynce Nix on the 15-day DL with a sprained right shoulder; released RHP Todd Williams from Triple-A Oklahoma.
2004-06-15,Anaheim Angels Recalled RHP Derrick Turnbow from Triple-A Salt Lake.
2004-06-15,Cleveland Indians Purchased the contract of OF Raul Gonzalez from Triple-A Buffalo; designated C Sandy Martinez for assignment; RHP Lou Pote declined his assignment to Triple-A Buffalo and is a free agent. He had been designated for assignment on June 11.
2004-06-15,Minnesota Twins Placed OF Michael Ryan on the 15-day disabled list; recalled IF Alex Prieto from Triple-A Rochester.
2004-06-15,"New York Yankees Placed RHP Kevin Brown on the 15-day disabled list, retroactive to June 10, with a lower back strain; recalled OF Bubba Crosby from Triple-A Columbus."
2004-06-15,San Francisco Giants Activated 2B Ray Durham from the 15-day disabled list; optioned OF Todd Linden to Triple-A Fresno.
2004-06-15,Texas Rangers Purchased the contract of OF Jason Conti from Triple-A Oklahoma.
2004-06-16,Anaheim Angels Optioned LHP Dusty Bergman to Triple-A Salt Lake.
2004-06-16,Baltimore Orioles Optioned RHP Rick Bauer to Triple-A Ottawa; recalled LHP Matt Riley from Triple-A Ottawa.
2004-06-16,Boston Red Sox Activated OF Trot Nixon from the 15-day disabled list; optioned RHP Anastacio Martinez to Triple-A Pawtucket.
2004-06-16,Colorado Rockies Optioned RHP Allan Simpson to Triple-A Colorado Springs.
2004-06-16,Florida Marlins Josh Beckett: Optioned RHP Nate Bump to Triple-A Albuquerque and activated RHP Josh Beckett off the 15-day disabled list.
2004-06-16,"Selected the contract of RHP Josias Manzanillo from Triple-A Albuquerque, optioned LHP Tommy Phelps to Triple-A Albuquerque and transfered INF Wil Cordero from the 15-day disabled list to the 60-day DL."
2004-06-16,Kansas City Royals Released RHP Curtis Leskanic and purchased the contract of RHP Rudy Seanez from Triple-A Omaha.
2004-06-16,Montreal Expos Activated OF Carl Everett from the 15-day disabled list; optioned OF Matt Cepicky to Triple-A Edmonton.
2004-06-16,New York Mets Placed C Vance Wilson on the 15-day disabled list and recalled Tom Wilson from Triple-A Norfolk; designated OF Esix Snead for assignment.
2004-06-16,"San Diego Padres Activated OF Ryan Klesko from the 15-day disabled list; optioned OF Xavier Nady to Triple-A Portland; recalled RHP Brian Sweeney from Triple-A Portland; placed RHP Antonio Osuna on the 15-day disabled list, retroactive to June 11, with a strained right elbow."
2004-06-16,St. Louis Cardinals Signed RHP Nerio Rodriguez to a minor league contract and assigned him to Triple-A Memphis.
2004-06-16,Texas Rangers Placed RHP Juan Dominguez on the 15-day DL with a strained right rhomboid. Purchased the contract of LHP Nick Bierbrodt from Oklahoma; transferred RHP Jeff Nelson to the 60-day disabled list.
2004-06-16,Toronto Blue Jays Placed OF Vernon Wells on the 15-day disabled list with a mild-to-severe right calf strain; activated INF Orlando Hudson from the 15-day disabled list; acquired nonroster INF Julius Matos from the Expos for a player to be named.
2004-06-17,Anaheim Angels Activated RHP Brendan Donnelly from the 60-day disabled list; designated LHP Dusty Bergman for assignment.
2004-06-17,Chicago White Sox Traded RHP Billy Koch and cash considerations to the Florida Marlins for minor league SS Wilson Valdez.
2004-06-17,Colorado Rockies Purchased the contract of RHP Kevin Jarvis from Triple-A Colorado Springs; transferred RHP Jason Young from the 15-day to the 60-day disabled list.
2004-06-17,Florida Marlins Acquired RHP Billy Koch from the White Sox for Triple-A INF Wilson Valdez and cash. Optioned RHP Mike Neu to Triple-A Albuquerque.
2004-06-17,Houston Astros Traded OF Richard Hidalgo to the New York Mets for RHP David Weathers and RHP Jeremy Griffiths.
2004-06-17,"Kansas City Royals OF Brandon Berger and INF Wilton Guerrero, who were both designated for assignment on June 13, cleared waivers and will report to the minor leagues. Berger will report to Double-A Wichita, while Guerrero will report to Triple-A Omaha."
2004-06-17,New York Mets Recalled LHP Pedro Feliciano from Triple-A Norfolk.
2004-06-17,Acquired OF Richard Hidalgo from the Houston Astros for RHP David Weathers and RHP Jeremy Griffiths.
2004-06-17,Oakland Athletics Placed OF Billy McMillon on the 15-day disabled list with inflammation in his lower back; recalled RHP Justin Lehr from Triple-A Sacramento.
2004-06-17,Pittsburgh Pirates Signed RHP Jim Mann to a minor league contract and assigned him to Triple-A Nashville.
2004-06-17,Texas Rangers OF Chad Allen cleared waivers and will report to Triple-A Oklahoma; he had been designated for assignment on June 12.
2004-06-18,Arizona Diamondbacks Placed RHP Jose Valverde on the 15-day disabled list with tendinitis in his right rotator cuff.
2004-06-18,Baltimore Orioles Placed RHP Rick Bauer on the DL (right elbow nerve irritation); signed IF/OF David Newhan and placed him on the 25-man roster; optioned IF Jose Leon to Triple-A Ottawa.
2004-06-18,Chicago Cubs Activated RF Sammy Sosa from the disabled list and optioned OF Jason Dubois to Triple-A Iowa.
2004-06-18,Chicago White Sox Recalled LHP Arnie Munoz from Double-A Birmingham.
2004-06-18,Colorado Rockies Activated OF Preston Wilson from the 15-day disabled list; optioned OF Choo Freeman to Triple-A Colorado Springs.
2004-06-18,Houston Astros Designated RHP Ricky Stone for assignment.
2004-06-18,New York Mets Optioned RHP Tyler Yates to Triple-A Norfolk and added OF Richard Hidalgo to the 40-man roster.
2004-06-18,Pittsburgh Pirates Optioned RHP Mark Corey to Triple-A Nashville.
2004-06-18,St. Louis Cardinals Activated C Mike Matheny from the 15-day disabled list; optioned RHP Jason Simontacchi to Triple-A Memphis.
2004-06-18,Texas Rangers Purchased the contract of RHP John Wasdin from Oklahoma. Optioned LHP Erasmo Ramirez to Oklahoma. Designated LHP Cory Vance for assignment.
2004-06-18,Toronto Blue Jays Placed C Bobby Estalella on the 15-day disabled list; recalled RHP Mike Nakamura from AAA-Syracuse.
2004-06-19,"Anaheim Angels Activated C Bengie Molina from the 15-day disabled list; placed INF Shane Halter on the 15-day disabled list, retroactive to June 14, with a dislocated second joint of his left ring finger."
2004-06-19,Arizona Diamondbacks Purchased the contract of P Lance Cormier from Triple-A Tucson; transferred P Oscar Villarreal to the 60 day disabled list.
2004-06-19,Atlanta Braves Activated RHP Paul Byrd from the 60-day disabled list; designated LHP C.J. Nitkowski for assignment.
2004-06-19,Baltimore Orioles Placed OF B.J. Surhoff on the 15-day disabled list with a left calf strain and recalled IF Jose Leon to AAA Ottawa.
2004-06-19,Chicago Cubs Activated IF Mark Grudzielanek from the 60 day disabled list; designated P Jimmy Anderson for assignment.
2004-06-19,Chicago White Sox Optioned LHP Arnie Munoz to Triple-A Charlotte.
2004-06-19,"Cincinnati Reds Traded LHP Charlie Manning to the New York Yankees for LHP Gabe White, a player to be named and cash; designated RHP Brian Reith for assignment."
2004-06-19,Detroit Tigers Recalled RHP Franklyn German from Triple-A Toledo; optioned LHP Steve Colyer to Triple-A Toledo.
2004-06-19,Florida Marlins Activated RHP Justin Wayne off the 15-day DL and optioned him to Triple-A Albuquerque.
2004-06-19,Kansas City Royals Placed C Benito Santiago on the 15-day disabled list with a broken left hand. Recalled C Mike Tonis from Double-A Wichita.
2004-06-19,"New York Mets Activated 2B Jose Reyes from the 60-day DL and recalled RHP Jose Parra from Triple-A Norfolk. Designated C Tom Wilson for assignment, optioned LHP Pedro Feliciano to Norfolk."
2004-06-19,"New York Yankees Purchased the contract of LHP Brad Halsey from Triple-A Columbus; traded LHP Gabe White, a player to be named and cash to the Cincinnati Reds for LHP Charlie Manning."
2004-06-19,Pittsburgh Pirates Recalled LHP Sean Burnett from Triple-A Nashville.
2004-06-19,San Diego Padres Claimed RHP Ricky Stone off waivers from the Houston Astros; signed RHP Lou Pote to a minor league contract and assigned him to Triple-A Portland; released RHP Matt Bruback from Triple-A Portland; optioned OF Jon Knott to Triple-A Portland.
2004-06-20,Arizona Diamondbacks Optioned RHP Lance Cormier to Triple-A Tucson; recalled RHP Greg Aquino from Triple-A Tucson; placed INF Alan Zinter on the 15-day disabled list with plantar fasciitis in his left foot; activated INF Greg Colbrunn from the 15-day disabled list.
2004-06-20,Chicago White Sox Recalled RHP Jon Rauch from Triple-A Charlotte.
