date,transaction
2004-08-18,Arizona Diamondbacks Placed C Koyie Hill on the 15-day disabled list with a fractured ankle; activated 1B Alan Zinter from the 60-day disabled list and purchased the contract of C Chris Snyder from Double-A El Paso; optioned INF Tim Olson to Triple-A Tucson.
2004-08-18,Baltimore Orioles Larry Bigbie: Placed on the 15-day disabled list with a sore groin.
2004-08-18,Placed OF Jerry Hairston Jr. on the 15-day disabled list with a broken left ankle; placed OF Larry Bigbie on the 15-day disabled list with a sore groin; recalled OF Darnell McDonald to Triple-A Ottawa.
2004-08-18,Jerry Hairston Jr.: Placed on the 15-day disabled list with a broken left ankle.
2004-08-18,Cleveland Indians Recalled RHP Fernando Cabrera from Triple-A Buffalo; optioned LHP Cliff Bartosh to Triple-A Buffalo.
2004-08-18,Houston Astros Placed LHP Andy Pettitte on the 15-day disabled list to repair the torn flexor tendon in his left elbow and recalled RHP Brandon Backe from Triple-A New Orleans.
2004-08-18,Kansas City Royals C Mike Tonis cleared waivers and was outrighted to Double-A Wichita. He will be placed on the Temporary Inactive List as he is currently playing in the Olympics in Greece.
2004-08-18,Los Angeles Dodgers Aquired nonroster LHP Scott Stewart from the Indians for cash or a PTBN.
2004-08-18,New York Yankees Activated RHP Mike Mussina from disabled list and optioned INF Andy Phillips to Columbus.
2004-08-18,Oakland Athletics Activated LHP Arthur Rhodes from the 15-day disabled list and optioned RHP Jairo Garcia to Triple-A Sacramento.
2004-08-18,Philadelphia Phillies Placed RHP Brian Powell on the 15-day disabled list with a strained right bicep muscle. Recalled RHP Geoff Geary from AAA Scranton/Wilkes-Barre.
2004-08-18,Pittsburgh Pirates Recalled RHP John Van Benschoten from Triple-A Nashville and designated RHP Willis Roberts for assignment.
2004-08-18,San Diego Padres Placed Jay Witasick on the 15-day disabled list and purchased the contract of RHP Steve Watkins from Triple-A Portland.
2004-08-18,San Francisco Giants Optioned RHP Brad Hennessey to Triple-A Fresno; activated LHP Wayne Franklin from the 15-day disabled list.
2004-08-18,Seattle Mariners Placed INF Justin Leone on the 15-day disabled list; recalled INF Ramon Santiago from Triple-A Tacoma.
2004-08-19,Arizona Diamondbacks Traded RHP Elmer Dessens to the Dodgers in exchange for minor league OF Jereme Milons.
2004-08-19,Atlanta Braves Placed RHP Tim Drew on the 15-day disabled list and RHP Roman Colon was recalled from Triple-A Richmond.
2004-08-19,Baltimore Orioles Purchased the contract of OF Val Majewski from Double-A Bowie.
2004-08-19,Chicago Cubs Signed INF Neifi Perez to a minor league contract and assigned him to Triple-A Iowa.
2004-08-19,Chicago White Sox Transfered DH Frank Thomas from the 15-day DL to the 60-day DL.
2004-08-19,Purchased the contract of LHP Josh Stewart from Triple-A Charlotte.
2004-08-19,Optioned RHP Felix Diaz to Triple-A Charlotte.
2004-08-19,Cincinnati Reds Sent 3B Brandon Larson to Louisville on a rehabilitation assignment.
2004-08-19,Colorado Rockies Purchased the contract of RHP Chris Gissell from Triple-A Colorado Springs; optioned RHP Allan Simpson to Colorado Springs.
2004-08-19,Houston Astros Signed RHP Reggie Harris to a minor league contract and assigned him to Triple-A New Orleans.
2004-08-19,Los Angeles Dodgers Acquired RHP Elmer Dessens and cash considerations from the Diamondbacks in exchange for minor league OF Jereme Milons.
2004-08-19,New York Mets Placed RHP Victor Zambrano on the 15-day disabled list and recalled RHP Bartolome Fortunato from Triple-A Norfolk.
2004-08-19,Pittsburgh Pirates Recalled RHP Ian Snell from Double-A Altoona and optioned RHP John Van Benschoten to Triple-A Nashville.
2004-08-19,San Francisco Giants Activated RHP Jesse Foppert from the disabled list and optioned him to Triple-A Fresno.
2004-08-19,Tampa Bay Devil Rays Signed 1B Randall Simon.
2004-08-20,Arizona Diamondbacks Recalled RHP Brian Bruney from Triple-A Tucson; Optioned INF Tim Olson to Triple-A Tucson; Recalled INF Alan Zinter from injury rehab assignment and activated him from 60-day DL; Placed OF Luis Gonzalez on 60-day DL.
2004-08-20,Boston Red Sox Activated 2B Mark Bellhorn from the 15-day disabled list; optioned 3B Earl Snyder to Triple-A Pawtucket.
2004-08-20,Cincinnati Reds Placed RHP Danny Graves on the 15-day disabled list with lower back spasms; recalled pitcher Matt Belisle from Triple-A Louisville; signed RHP Jake Meyer to a minor league contract and assigned him to Double-A Chattanooga.
2004-08-20,Colorado Rockies Designated RHP Vladimir Nunez for assignment.
2004-08-20,Milwaukee Brewers Outrighted LHP Matt Ford to Double-A Huntsville.
2004-08-20,New York Mets Placed INF Joe McEwing on the 60-day disabled list with a broken left fibula; recalled INF Jeff Keppinger from Triple-A Norfolk.
2004-08-20,Pittsburgh Pirates Recalled RHP Nelson Figueroa from Triple-A Nashville and optioned RHP Ian Snell to Double-A Altoona.
2004-08-20,Seattle Mariners Signed RHP Bill Simas to a minor league contract and assigned him to Triple-A Tacoma.
2004-08-20,St. Louis Cardinals Recalled RHP Al Reyes from Triple-A Memphis and optioned RHP Danny Haren to Triple-A Memphis.
2004-08-20,Tampa Bay Devil Rays Optioned OF Joey Gathright to Triple-A Durham.
2004-08-21,Arizona Diamondbacks Recalled INF Jerry Gil from Triple-A Tucson; optioned OF Doug Devore to Triple-A Tucson.
2004-08-21,Kansas City Royals Activated LHP Jeremy Affeldt from the disabled list and optioned RHP Jorge Vasquez to Double-A Wichita.
2004-08-21,Montreal Expos Placed 1B Nick Johnson on the 15-day disabled list with a broken right cheekbone and recalled OF Ryan Church from Triple-A Edmonton.
2004-08-22,Detroit Tigers Recalled RHP Craig Dingman from Triple-A Toledo; optioned RHP Roberto Novoa to Double-A Erie.
2004-08-22,Kansas City Royals Placed 1B/DH Ken Harvey on the 15-day DL with a strained rib cage; Recalled 1B Calvin Pickering from Triple-A Omaha; Activated OF/1B Matt Stairs from the disabled list; Designated OF Ruben Mateo for assignment.
2004-08-22,New York Mets Optioned INF Craig Brazell to Triple-A Norfolk; recalled RHP Matt Ginter from Triple-A Norfolk.
2004-08-22,San Diego Padres Purchased the contract of RHP Marty McLeary from Triple-A Portland; outrighted OF Brian Buchanan to Portland.
2004-08-22,Toronto Blue Jays Placed OF Frank Catalanotto on the 15-day disabled list with a strained groin; purchased the contract of LHP Dave Maurer from Triple-A Syracuse.
2004-08-23,"Colorado Rockies Placed OF Preston Wilson on the 15-day disabled list, retroactive to Aug. 21, with a sore left knee; recalled OF Choo Freeman from Triple-A Colorado Springs."
2004-08-23,New York Mets Optioned RHP Matt Ginter to Triple-A Norfolk; recalled RHP Aaron Heilman from Triple-A Norfolk.
2004-08-23,Oakland Athletics Activated RHP Chad Bradford from the 15-day disabled list and optioned RHP Justin Lehr to Triple-A Sacramento.
2004-08-23,"Pittsburgh Pirates Kip Wells: Placed on the 15-day disabled list, retroactive to August 14, with right elbow inflammation."
2004-08-23,Sean Burnett: Placed on the 15-day disabled list with left elbow inflammation.
2004-08-23,"Pirates purchased the contract of LHP Frank Brooks from Triple-A Nashville; recalled RHP John Van Benschoten from Triple-A Nashville; placed RHP Kip Wells on the 15-day disabled list, retroactive to August 14, with right elbow inflammation; placed LHP Sean Burnett on the 15-day disabled list with left elbow inflammation."
2004-08-23,Tampa Bay Devil Rays Purchased the contract of LHP Scott Kazmir from Double-A Montgomery; optioned RHP Franklin Nunez to Triple-A Durham.
2004-08-23,Texas Rangers Activated RHP R.A. Dickey from the 15-day disabled list and placed LHP Erasmo Ramirez on the 15-day disabled list with left shoulder tendinitis. The Ramirez move is retroactive to August 17.
2004-08-23,Toronto Blue Jays Purchased the contract of LHP Dave Maurer from Triple-A Syracuse.
2004-08-24,Cincinnati Reds Activated OF Austin Kearns from the 60-day disabled list; optioned RHP Matt Belisle to Triple-A Louisville.
2004-08-24,Kansas City Royals Placed 1B Mike Sweeney on the 15-day disabled list; recalled OF Alexis Gomez from Triple-A Omaha.
2004-08-24,Recalled SS Angel Berroa from Double-A Wichita; optioned SS Andres Blanco to Wichita.
2004-08-24,Los Angeles Dodgers Optioned LHP Mike Venafro to Triple-A Las Vegas and purchased the contract of RHP Masao Kida.
2004-08-24,New York Mets Transferred RHP Orber Moreno to the 60-day disabled list.
2004-08-24,Optioned RHP Aaron Heilman to Triple-A Norfolk; recalled RHP Heath Bell from Triple-A Norfolk.
2004-08-24,San Diego Padres Placed LHP Sterling Hitchcock on the 15-day disabled list with a left elbow strain and recalled RHP Dennis Tankersley from Triple-A Portland. OF Brian Buchanan elected to become a free agent instead of accepting an outright assignment to Triple-A Portland.
2004-08-24,St. Louis Cardinals Recalled OF So Taguchi from Triple-A Memphis; optioned RHP Jason Simontacchi to Triple-A Memphis; released OF Armando Rios from Triple-A Memphis.
2004-08-25,Colorado Rockies Purchased the contract of LHP Jeff Francis from Triple-A Colorado Springs; designated OF Kit Pellow for assignment; outrighted RHP Adam Bernero and RHP Vladimir Nunez to Colorado Springs; placed RHP Aaron Cook on the 60-day disabled list with blood clots in both lungs; recalled LHP Javier Lopez from Triple-A Colorado Springs.
2004-08-25,Milwaukee Brewers Placed LHP Chris Capuano on the 15-day disabled list with left elbow soreness and recalled RHP Pedro Liriano from Triple-A Indianapolis.
2004-08-25,New York Mets Designated OF Prentice Redman for assignment.
2004-08-25,Signed OF Brian Buchanan and optioned RHP Heath Bell to Triple-A Norfolk.
2004-08-25,Oakland Athletics Extended their player development contract with Kane County of the Midwest League (Class A) through the 2006 season.
2004-08-25,Extended their player development contract with Kane County of the Midwest League (Class A) through the 2006 season.
2004-08-25,"San Francisco Giants Optioned RHP Kevin Correia to Triple-A Fresno, recalled RHP David Aardsma."
2004-08-25,Texas Rangers Purchased the contract of RHP Chris Young from Triple-A Oklahoma. Placed RHP Joaquin Benoit on the 15-day disabled list with rotator cuff iritation in his right arm.
2004-08-26,Baltimore Orioles Purchased the contract of LHP Bruce Chen from Triple-A Ottawa; transferred OF Luis Matos from the 15-day to the 60-day disabled list; released OF Karim Garcia.
2004-08-26,"Houston Astros Placed RHP Dan Miceli on the 15-day disabled list with conjunctivitis, retroactive to Aug. 21. Purchased the contract of RHP Russ Springer from Triple-A New Orleans."
2004-08-26,"Montreal Expos Placed 2B Jose Vidro (patella tendinitis in right knee, retroactive to Aug. 22) and RHP Francis Beltran (right shoulder tendinitis, retroactive to Aug. 25) on the 15-day disabled list; recalled LHP Scott Downs and RHP Gary Majewski from Triple-A Edmonton."
2004-08-26,Texas Rangers Juan Dominguez: Transferred from the 15-day to the 60-day disabled list.
2004-08-26,Activated RHP Chan Ho Park from the 60-day disabled list; placed RHP Mickey Callaway on the 15-day disabled list with right shoulder inflammation; transfered INF Brad Fullmer from the 15-day to the 60-day disabled list.
2004-08-27,Atlanta Braves Outrighted LHP Armando Almanza and LHP Sam McConnell to Triple-A Richmond; RHP Brett Evert was claimed off waivers by the Mariners.
2004-08-27,Chicago White Sox Purchased the contract of RHP Jason Grilli from Triple-A Charlotte.
2004-08-27,Optioned LHP Josh Stewart to Triple-A Charlotte.
2004-08-27,Cleveland Indians Recalled RHP Kazuhito Tadano from Triple-A Buffalo and RHP Jeremy Guthrie from Double-A Akron; optioned RHP Fernando Cabrera to Buffalo and designated RHP Chad Durbin for assignment.
2004-08-27,Colorado Rockies Recalled SS Clint Barmes from Triple-A Colorado Springs; optioned RHP Chris Gissell to Colorado Springs.
2004-08-27,Houston Astros Acquired RHP Dan Wheeler from the New York Mets in exchange for minor league OF Adam Seuss. Transferred RHP Wade Miller from the 15-day to the 60-day disabled list. Designated RHP David Weathers for assignment.
2004-08-27,Kansas City Royals OF Ruben Mateo cleared waivers and was outrighted to Triple-A Omaha.
2004-08-27,Los Angeles Dodgers Optioned RHP Masao Kida to Triple-A Las Vegas and purchased the contract of LHP Scott Stewart.
2004-08-27,Montreal Expos Purchased the contract of IF Maicer Izturis from Triple-A Edmonton and optioned OF Ron Calloway to Edmonton; transferred 2B Jose Vidro to the 60-day disabled list.
2004-08-27,"New York Mets Traded RHP Dan Wheeler to Houston for minor league OF Adam Seuss, who was assigned to Class-A St. Lucie; Recalled RHP Jae Seo from Triple-A Norfolk."
2004-08-27,Seattle Mariners Claimed RHP Brett Evert off waivers from the Atlanta Braves and optioned to Triple-A Tacoma.
2004-08-27,Texas Rangers Purchased the contract of RHP John Wasdin from Triple-A Oklahoma. RHP Scott Erickson designated for assignment.
2004-08-28,Chicago Cubs Recalled RHP Todd Wellemeyer from Triple-A Iowa.
2004-08-28,Milwaukee Brewers Reinstated IF Keith Ginter from the 15-day disabled list and optioned IF Trent Durrington to Triple-A Indianapolis.
2004-08-28,New York Mets Signed RHP Alay Soler to a three-year contract.
2004-08-28,San Francisco Giants Recalled RHP Brad Hennessey from Triple-A Fresno; optioned RHP David Aardsma to Triple-A Fresno.
2004-08-28,Seattle Mariners Placed RHP Clint Nageotte (back) on the 15-day disabled list; promoted RHP Cha Seung Baek from Triple-A Tacoma.
2004-08-28,St. Louis Cardinals Placed LHP Steve Kline on 15-day disabled list with strained left groin. Purchased the contract of LHP Randy Flores from Triple-A Memphis.
2004-08-29,"Anaheim Angels Tim Salmon: Placed on the 15-day disabled list, retroactive to August 24, with left shoulder inflammation."
2004-08-29,"Activated DH Troy Glaus from the 60-day disabled list; purchased the contract of INF Adam Riggs from Triple-A Salt Lake; placed OF Tim Salmon on the 15-day disabled list, retroactive to August 24, with left shoulder inflammation; optioned RHP Matt Hensley to Triple-A Salt Lake."
2004-08-29,Kansas City Royals Placed RHP Scott Sullivan on the 15-day disabled list with back strain; recalled LHP Jimmy Gobble from Triple-A Omaha
2004-08-29,Minnesota Twins Optioned RHP Jesse Crain to Elizabethton of the Appalachian League; recalled OF Jason Kubel from Triple-A Rochester.
2004-08-29,New York Yankees Recalled OF Bubba Crosby from Triple-A Columbus. Optioned RHP Scott Proctor to the minors.
2004-08-29,Toronto Blue Jays Recalled RHP Bob File from Triple-A Syracuse and optioned LHP Dave Maurer to Syracuse.
2004-08-30,Chicago White Sox Requested waivers on RHP Mike Jackson for the purpose of granting his unconditional release.
2004-08-30,Cleveland Indians Optioned OF Grady Sizemore to Triple-A Buffalo.
2004-08-30,New York Mets Activated C Mike Piazza from the 15-day disabled list and placed RHP Mike DeJean on the 15-day disabled list; designated OF Brian Buchanan for assignment and recalled RHP Heath Bell from Triple-A Norfolk.
2004-08-31,Arizona Diamondbacks Claimed RHP Chad Durbin off waivers from the Indians
2004-08-31,Atlanta Braves Optioned RHP Roman Colon to Double-A Greenville; recalled OF Dewayne Wise from Triple-A Richmond.
2004-08-31,Chicago Cubs Acquired OF Ben Grieve from the Milwaukee Brewers in exchange for a player to be named later.
2004-08-31,Acquired C Mike DiFelice from the Detroit Tigers in exchange for a player to be named later.
2004-08-31,Chicago White Sox Recalled RHP Felix Diaz from Triple-A Charlotte.
2004-08-31,Cleveland Indians Traded C Sandy Martinez to the Boston Red Sox for cash considerations.
2004-08-31,Milwaukee Brewers Sent OF Ben Grieve to the Chicago Cubs in exchange for a player to be named later and cash; recalled OF Dave Krynzel from Triple-A Indianapolis.
2004-08-31,Minnesota Twins Acquired C Pat Borders from the Mariners in exchange for OF B.J. Garbe.
2004-08-31,"Philadelphia Phillies Placed LHP Randy Wolf on the 15-day disabled list with tendinitis in left elbow; recalled INF Shawn Wooten, 1B Ryan Howard and C A.J. Hinch from Triple-A Scranton/Wilkes-Barre."
2004-08-31,San Diego Padres Purchased the contract of OF Robert Fick and recalled INF Ramon Vazquez from Triple-A Portland; optioned C Humberto Quintero and RHP Marty McLeary to Portland club.
2004-08-31,Seattle Mariners Traded C Pat Borders to the Minnesota Twins in exchange for minor league OF B.J. Garbe.
2004-08-31,St. Louis Cardinals Recalled RHP Danny Haren from Triple-A Memphis. Outrighted RHP Al Reyes to Class A Palm Beach.
2004-09-01,Anaheim Angels Purchased the contracts of 1B Andres Galarraga and INF Shane Halter from Triple-A Salt Lake; recalled 1B Casey Kotchman from Triple-A Salt Lake; designated RHP Ben Weber for assignment; outrighted RHP Steve Green to Triple-A Salt Lake.
2004-09-01,Arizona Diamondbacks Purchased the contract of RHP Chad Durbin from Triple-A Tucson.
2004-09-01,Atlanta Braves Recalled RHP Travis Smith and INF Wilson Betemit from Triple-A Richmond; purchased the contract of OF Carlos Guzman from Single-A Rome and placed him on the 15-day disabled list; released INF Jesse Garcia from Triple-A Richmond.
2004-09-01,Baltimore Orioles Activated OF Larry Bigbie from the 15-day disabled list; activated DH David Segui from the 60-day disabled list; recalled C Geronimo Gil from Triple-A Ottawa.
2004-09-01,Boston Red Sox Purchased the contract of C Sandy Martinez from Triple-A Pawtucket; activated 3B Kevin Youkilis and 1B David McCarty from 15-day disabled list.
2004-09-01,Chicago White Sox Activated C Sandy Alomar from the 15-day disabled list.
2004-09-01,Recalled LHP Arnie Munoz from Triple-A Charlotte.
2004-09-01,Cincinnati Reds Activated RHP Paul Wilson from the 15-day disabled list; Activated INF Brandon Larson from the 15-day disabled list.
2004-09-01,"Cleveland Indians Activated INF Lou Merloni from the 15-day disabled list; recalled C Josh Bard, LHP Cliff Bartosh and RHP Jason Davis from Triple-A Buffalo."
2004-09-01,Colorado Rockies Activated C Todd Greene from the 15-day disabled list.
2004-09-01,Detroit Tigers Activated RHP Lino Urdaneta from the 60-day disabled list; recalled RHP John Ennis from Triple-A Toledo.
2004-09-01,Florida Marlins Called up C Matt Treanor and RHP Ben Howard from Triple-A Albuquerque.
2004-09-01,Los Angeles Dodgers Activated RHP Hideo Nomo of the 15-day disabled list; purchased the contract of C Tom Wilson from Triple-A Las Vegas.
2004-09-01,"Minnesota Twins Recalled INF Terry Tiffee, LHP Aaron Fultz and RHP Matt Guerrier from Triple-A Rochester; recalled RHP Jesse Crain from Rookie Elizabethton; optioned C Rob Bowen to Double-A New Britain."
2004-09-01,Montreal Expos Recalled OF Val Pascucci from Triple-A Edmonton.
2004-09-01,"New York Mets Recalled RHP Matt Ginter, RHP Tyler Yates and 1B Craig Brazell from Triple-A Norfolk; OF Prentice Redman cleared waivers and was outrighted to Triple-A Norfolk. He had been designated for assignment on August 25."
2004-09-01,New York Yankees Designated OF Mike Vento and RHP Juan Padilla for assignment.
2004-09-01,Activated RHP Steve Karsay from the 60-day disabled list; recalled LHP Felix Heredia from Double-A Trenton; purchased the contract of C Dioner Navarro from Triple-A Columbus.
2004-09-01,Oakland Athletics Recalled INF Esteban German from Triple-A Sacramento.
2004-09-01,Philadelphia Phillies Purchased the contract of C A.J. Hinch from Triple-A Scranton/Wilkes-Barre; recalled INF Ryan Howard from Triple-A Scranton/Wilkes-Barre.
2004-09-01,San Diego Padres Purchased the contract of OF Kerry Robinson from Triple-A Portland; recalled C Miguel Ojeda from Portland and reinstated him from the 15-day disabled list; recalled RHP Antonio Osuna from Single-A Lake Elsinore and reinstated him from the 15-day disabled list.
2004-09-01,"San Francisco Giants Recalled IF Brian Dallimore, IF/OF Tony Torcato and OF Jason Ellison from Triple-A Fresno."
2004-09-01,Seattle Mariners Claimed RHP Masao Kida off waivers from the Dodgers.
2004-09-01,St. Louis Cardinals Activated LHP Rick Ankiel from the 60-day disabled list; activated OF Ray Lankford from the 15-day disabled list; recalled C Cody McKay from Triple-A Memphis.
2004-09-01,Tampa Bay Devil Rays Activated OF Rocco Baldelli from the 15-day disabled list; recalled RHP Chad Gaudin from Triple-A Durham and selected OF Matt Diaz from Durham; transferred IF Eduardo Perez from the 15-day to the 60-day disabled list.
2004-09-01,"Texas Rangers Activated RHP Jeff Nelson, LHP Erasmo Ramirez and IF Herbert Perry from the 15-day disabled list; purchased the contracts of INF Andy Fox and C Ken Huckaby from Triple-A Oklahoma."
2004-09-02,Anaheim Angels Transferred DH Tim Salmon from the 15-day to the 60-day disabled list and purchased the contract of RHP Scott Dunn from Triple-A Salt Lake.
2004-09-02,Arizona Diamondbacks Recalled OF Josh Kroeger from Triple-A Tucson.
2004-09-02,Boston Red Sox Recalled RHP Brandon Puffer from Triple-A Pawtucket and designated RHP Joe Nelson for assignment.
2004-09-02,Chicago Cubs Transferred OF Todd Hollandsworth from the 15-day to the 60-day disabled list and purchased the contract of INF Neifi Perez from Triple-A Iowa.
2004-09-02,Houston Astros Recalled INF Chris Burke from Triple-A New Orleans.
2004-09-02,Milwaukee Brewers Traded RHP Dave Burba to San Francisco Giants for minor league LHP Josh Habel.
2004-09-02,San Francisco Giants Acquired RHP Dave Burba from the Milwaukee Brewers for minor league LHP Josh Habel.
2004-09-02,"Toronto Blue Jays Recalled C Guillermo Quiroz and RHP Chad Gaudin from Triple-A Durham; purchased the contracts of RHP Ryan Glynn, SS Russ Adams and 1B Eric Crozier; transferred RHP Valerio de los Santos from the 15-day to the 60-day disabled list."
2004-09-02,LHP Dave Maurer cleared waivers and was outrighted to Triple-A Syracuse.
2004-09-03,Atlanta Braves Activated RHP Tim Drew from the 15-day disabled list.
2004-09-03,Boston Red Sox Purachased the contract of OF Adam Hyzdu from Triple-A Pawtucket; Claimed INF Tim Hummel off waivers from Cincinnati; designated RHP Brandon Puffer and C/1B Andy Dominque for assignment.
2004-09-03,Chicago Cubs Announced LHP Andy Pratt is the player to be named later in the Ben Grieve trade on Aug. 31.
2004-09-03,Chicago White Sox Purchased the contract of RHP Jeff Bajenaru from Triple-A Charlotte.
2004-09-03,Cincinnati Reds Reinstated RHP Danny Graves and LHP Mike Matthews from the 15-day disabled list; Claimed RHP Juan Padilla off waivers from the New York Yankees.
2004-09-03,Kansas City Royals Activated OF Dee Brown from the 15-day disabled list.
2004-09-03,Los Angeles Dodgers Recalled LHP Mike Venafro from Triple-A Las Vegas.
2004-09-03,"Milwaukee Brewers Reinstated RHP Brooks Kieschnick from the 15-day disabled list, recalled LHP Jorge De La Rosa from Triple-A Indianapolis and claimed LHP Andy Pratt off waivers from the Chicago Cubs."
2004-09-03,Oakland Athletics Transferred INF Mark Ellis from the 15-day to the 60-day disabled list and purchased the contract of OF Nick Swisher from Triple-A Sacramento.
2004-09-03,"Philadelphia Phillies Activated OF Pat Burrell, RHP Ryan Madson and RHP Brian Powell from the 15-day disabled list; Purchased the contract of RHP Gavin Floyd from AAA Scranton/Wilkes-Barre."
2004-09-03,San Francisco Giants Designated C Trey Lunsford for assignment.
2004-09-03,St. Louis Cardinals Activated Kiko Calero off the 15-day disabled list.
2004-09-03,Purchased the contract of LHP Carmen Cali from Triple-A Memphis.
2004-09-03,Tampa Bay Devil Rays Recalled RHP Franklin Nunez from Triple-A Durham.
2004-09-04,Anaheim Angels Activated LHP Jarrod Washburn from the disabled list.
2004-09-04,Arizona Diamondbacks Recalled OF Doug DeVore from Triple-A Tucson.
2004-09-04,Cincinnati Reds Recalled C Corky Miller from Triple-A Louisville.
2004-09-04,Milwaukee Brewers Purchased the contract of RHP Gary Glover from Triple A Indianapolis.
2004-09-04,New York Mets Purchased the contract of LHP Vic Darensbourg from Triple-A Norfolk.
2004-09-04,New York Yankees Recalled RHP Bret Prinz from Triple-A Columbus.
2004-09-04,Philadelphia Phillies Activated LHP Billy Wagner from the 15-day disabled list.
2004-09-04,San Diego Padres LHP Sterling Hitchcock announced his retirement from the Padres.
2004-09-04,San Francisco Giants Recalled RHP Kevin Correia from Triple-A Fresno.
2004-09-05,Boston Red Sox Purchased the contract of RHP Pedro Astacio from Triple-A Pawtucket. Transferred LHP Lenny DiNardo from the 15-day to the 60-day disabled list.
2004-09-05,"Kansas City Royals Recalled RHP Denny Bautista and RHP Mike MacDougal from Double-A Wichita, and LHP Chris George from Triple-A Omaha. Purchased the contract of C Paul Phillips from Triple-A Omaha."
2004-09-05,Activated 1B/DH Ken Harvey from the 15-day disabled list.
2004-09-05,"Minnesota Twins Recalled INF Jason Bartlett, OF Michael Restovich and RHP J.D. Durbin from Triple-A Rochester. Purchased the contract of LHP Joe Beimel from Rochester."
2004-09-05,Pittsburgh Pirates Activated RHP Kip Wells from the 15-day disabled list.
2004-09-06,Anaheim Angels Recalled 3B Dallas McPherson and RHP Matt Hensley from Triple-A Salt Lake.
2004-09-06,Arizona Diamondbacks Activated RHP Scott Service from the 15-day disabled list.
2004-09-06,Baltimore Orioles Purchased the contract of RHP Aaron Rakers from Triple-A Ottawa; transferred OF Jerry Hairston Jr. from the 15-day to the 60-day disabled list.
2004-09-06,"Chicago Cubs Recalled OF Jason Dubois, RHP Sergio Mitre, OF Calvin Murray and RHP Michael Wuertz from Triple-A Iowa; activated C Mike DiFelice and RHP Joe Borowski was transferred to the 60-day disabled list."
2004-09-06,Cincinnati Reds Designated 3B Brandon Larson for assignment.
