date,transaction
2006-08-17,Boston Red Sox Acquired INF/OF Eric Hinske and cash from the Toronto Blue Jays in exchange for a player to be name; optioned Craig Breslow to Triple-A Pawtucket; Signed 1B Carlos Pena to a Minor League contract.
2006-08-17,New York Yankees Placed RHP Cory Lidle on the Major League bereavement list and purchased the contract of RHP Brian Bruney from Triple-A Columbus; Signed INF Frank Menechino to a Minor League contract.
2006-08-17,Seattle Mariners Activated 1B Richie Sexson from the bereavement list and optioned OF/IF Michael Morse to Triple-A Tacoma; Recalled OF Chris Snelling from Triple-A Tacoma and optioned RHP Sean Green to Tacoma.
2006-08-17,Toronto Blue Jays Traded OF Eric Hinske and cash to the Boston Red Sox for a player to be named or cash considerations; Recalled INF John Hattig from Triple-A Syracuse; Optioned RHP Francisco Rosario to Triple-A Syracuse.
2006-08-17,"Washington Nationals Placed LHP Micah Bowie on the 15-day disabled list, retroactive to August 10, with a left latissimus dorsi strain."
2006-08-18,"Arizona Diamondbacks Recalled OF Chris Young from Triple-A Tucson, and optioned OF Scott Hairston to Tucson."
2006-08-18,Boston Red Sox Activated RHP Keith Foulke from the 15-day disabled list and designated RHP Jason Johnson for assignment.
2006-08-18,Kansas City Royals Placed RHP Adam Bernero on the 15-day disabled list with right elbow inflammation; Recalled INF Andres Blanco from Triple-A Omaha.
2006-08-18,Los Angeles Dodgers Optioned 1B James Loney to Triple-A Las Vegas and activated RHP Elmer Dessens from the 15-day disabled list.
2006-08-18,New York Mets Recalled LHP Dave Williams from Triple-A Norfolk and optioned RHP Heath Bell to Norfolk.
2006-08-18,New York Yankees Placed 1B Andy Phillips on the 15-day disabled list (strained left rib muscle); Recalled RHP T.J. Beam from Triple-A Columbus.
2006-08-18,Oakland Athletics Reinstated SS Bobby Crosby from the 15-day disabled list and outrighted D'Angelo Jimenez to Triple-A Sacramento.
2006-08-18,San Francisco Giants Placed IF Jose Vizcaino on release waivers.
2006-08-18,St. Louis Cardinals Signed OF Preston Wilson for the remainder of the season; Optioned RHP Anthony Reyes to Triple-A Memphis.
2006-08-18,Toronto Blue Jays Purchased the contract of C Jason Phillips from Triple-A Syracuse.
2006-08-18,Washington Nationals Reinstated 2B Jose Vidro from the 15-day disabled list.
2006-08-19,Boston Red Sox Recalled RHP Jermaine Van Buren from Triple-A Pawtucket and designated RHP Rudy Seanez for assignment.
2006-08-19,Houston Astros Placed RHP Brandon Backe on 15-day disabled list with right elbow sprain; Recalled LHP Wandy Rodriguez from Triple-A Round Rock.
2006-08-19,"Milwaukee Brewers Placed RHP Matt Wise on the 15-day disabled list, retroactive to Aug. 14, with ulnar neuritis and recalled OF Laynce Nix from Triple-A Nashville."
2006-08-19,New York Yankees Designated RHP Sidney Ponson for assignment; Optioned RHP Brian Bruney to Triple-A Columbus; Recalled OF Aaron Guiel and RHP Jeff Karstens from Triple-A Columbus.
2006-08-19,Philadelphia Phillies Acquired LHP Jamie Moyer from the Seattle Mariners in exchange for Minor League RHPs Andrew Baldwin and Andrew Barb.
2006-08-19,Pittsburgh Pirates Activated John Van Benschoten from the 15-day disabled list and optioned him to Triple-A Indianapolis.
2006-08-19,San Diego Padres Recalled RHP Mike Thompson from Triple-A Portland and placed INF Khalil Greene on the 15-day disabled list retroactive to Aug. 18.
2006-08-19,"San Francisco Giants Placed IF Kevin Frandsen on the 15-day disabled list, retroactive to Aug. 18, with a fractured jaw, purchased the contract of IF Tomas De La Rosa from Triple-A Fresno and designated IF Chad Santos for assignment."
2006-08-19,Seattle Mariners Traded LHP Jamie Moyer to the Philadelphia Phillies for RHP Andy Baldwin and RHP Andrew Barb.
2006-08-19,Texas Rangers Recalled RHP Robinson Tejeda from Triple-A Oklahoma; Optioned OF Freddy Guzman to Oklahoma.
2006-08-20,Boston Red Sox Recalled LHP Javier Lopez from Triple-A Pawtucket and optioned RHP Jermaine Van Buren to Pawtucket.
2006-08-20,Chicago Cubs Traded IF Neifi Perez to Detroit for Minor League C Chris Robinson.
2006-08-20,Cincinnati Reds Placed LHP Eddie Guardado on the 15-day disabled list; Reinstated RHP Matt Belisle from the 15-day disabled list; Placed LHP Chris Michalak on the bereavement list; Purchased the contract of IF/OF Norris Hopper from Triple-A Louisville; Designated RHP Mike Burns for assignment.
2006-08-20,Cleveland Indians Traded RHP Guillermo Mota to the New York Mets for a player to be named or cash considerations.
2006-08-20,Detroit Tigers Acquired INF Neifi Perez from Chicago Cubs in exchange for C Chris Robinson.
2006-08-20,Houston Astros Purchased the contract of C J.R. House from Triple-A Round Rock and designated C Eric Munson for assignment.
2006-08-20,"Los Angeles Angels Placed OF Curtis Pride on the 15-day disabled list, retroactive to Aug. 15, and recalled RHP Greg Jones from Triple-A Salt Lake."
2006-08-20,New York Mets Acquired RHP Guillermo Mota and cash considerations from the Cleveland Indians in exchange for a player to be named.
2006-08-20,"Oakland Athletics Placed RHP Huston Street on the 15-day disabled list, retroactive to Aug. 19, with a strained right groin and recalled LHP Ron Flores from Triple-A Sacramento."
2006-08-20,Philadelphia Phillies Optioned RHP Scott Mathieson to Triple-A Scranton/Wilkes-Barre.
2006-08-20,San Diego Padres Purchased the contract of INF Manny Alexander and optioned RHP Mike Thompson to Triple-A Portland.
2006-08-20,Seattle Mariners Placed RHP Mark Lowe on the 15-day disabled list and recalled RHP Sean Green from Triple-A Tacoma.
2006-08-20,Texas Rangers Recalled LHP John Koronka from Triple-A Oklahoma; Optioned RHP Scott Feldman to Oklahoma.
2006-08-21,Atlanta Braves Optioned RHP Lance Cormier to Triple-A Richmond and recalled INF Martin Prado.
2006-08-21,Boston Red Sox Purchased the contract of RHP Bryan Corey from Triple-A Pawtucket and optioned RHP Craig Hansen to Pawtucket.
2006-08-21,"Chicago Cubs Activated OF Freddie Bynum and LHP Glendon Rusch from the 15-day disabled list; Placed RHP Carlos Marmol on the 15-day disabled list with right shoulder fatigue, retroactive to Aug. 19."
2006-08-21,Detroit Tigers Optioned INF Ramon Santiago to Triple-A Toledo; Placed RHP Roman Colon on the 15-day disabled list; Recalled RHP Colby Lewis from Toledo.
2006-08-21,New York Yankees Optioned RHP T.J. Beam to Triple-A Columbus; Activated RHP Cory Lidle from the bereavement list.
2006-08-21,Philadelphia Phillies Placed RHP Tom Gordon on the 15-day disabled list (retroactive to August 13) with a right shoulder strain.
2006-08-21,San Diego Padres Recalled RHP Tim Stauffer from Triple-A Portland; optioned RHP Jon Adkins to Portland.
2006-08-21,Tampa Bay Devil Rays Released RHP Chad Harville.
2006-08-21,Texas Rangers Recalled RHP Nick Masset from Triple-A Oklahoma; Optioned LHP John Koronka to Oklahoma.
2006-08-22,Arizona Diamondbacks Traded OF Shawn Green and cash to the Mets in exchange for Minor League LHP Evan MacLane; Activated INF Craig Counsell off the 15-day DL.
2006-08-22,"Boston Red Sox Placed SS Alex Gonzalez on 15-day disabled list, retroactive to Aug. 19; Purchased the contract of INF Dustin Pedroia from Triple-A Pawtucket; Optioned LHP Javier Lopez to Pawtucket; Recalled LHP Kason Gabbard from Pawtucket; Sent LHP Lenny DiNardo on rehab assignment to Double-A Portland of the Eastern League."
2006-08-22,Chicago Cubs Selected OF Buck Coats from Triple-A Iowa; Placed INF Cesar Izturis on the 15-day disabled list with a strained right hamstring.
2006-08-22,Colorado Rockies Recalled INF Kazuo Matsui from Triple-A Colorado Springs; Designated INF Jason Smith for assignment.
2006-08-22,Houston Astros Placed RHP Fernando Nieve on 15-day disabled list; recalled Chris Sampson from Triple-A Round Rock.
2006-08-22,New York Mets Designated Minor League OF Victor Diaz for assignment.
2006-08-22,Acquired OF Shawn Green and cash considerations from the Arizona Diamondbacks in exchange for Minor League LHP Evan MacLane; Optioned LHP Royce Ring to Triple-A Norfolk.
2006-08-22,Oakland Athletics Recalled LHP Brad Halsey from Triple-A Sacramento and optioned LHP Ron Flores to Sacramento.
2006-08-22,Philadelphia Phillies Placed OF Aaron Rowand on the 15-day disabled list with a fractured left ankle; Recalled OF Michael Bourn from Triple-A Scranton/Wilkes-Barre; Purchased the contract of 2B Joe Thurston from Scranton/Wilkes-Barre; Acquired INF/OF Jose Hernandez from the Pittsburgh Pirates in exchange for cash.
2006-08-22,"San Diego Padres Placed RHP Chan Ho Park on the 15-day disabled list, retroactive to Aug. 21, with intestinal bleeding; recalled RHP Mike Thompson from Triple-A Portland."
2006-08-22,Seattle Mariners Selected the contract of RHP Cha Seung Baek from Triple-A Tacoma; Recalled OF T.J. Bohn from Triple-A Tacoma; Optioned OF Adam Jones to Triple-A Tacoma.
2006-08-22,Tampa Bay Devil Rays Activated INF Luis Ordaz from the 60-day disabled list and designated him for assignment.
2006-08-22,Toronto Blue Jays Optioned RHP Dustin McGowan to Triple-A Syracuse.
2006-08-22,Washington Nationals Purchased the contract of INF Henry Mateo from Triple-A New Orleans and designated RHP Travis Hughes for assignment.
2006-08-23,Baltimore Orioles Designated RHP Eddy Rodriguez for assignment; Purchased the contract of RHP Jim Hoey from Double-A Bowie; Optioned RHP Chris Britton to Bowie.
2006-08-23,Chicago Cubs Placed LHP Ryan O'Malley on the 15-day disabled list with a medial left elbow strain and recalled RHP Jae Kuk Ryu from Triple-A Iowa.
2006-08-23,Cincinnati Reds Reinstated LHP Chris Michalak from the bereavement list and optioned OF Norris Hopper to Triple-A Louisville.
2006-08-23,New York Yankees Placed RHP Mike Mussina on the 15-day disabled list and recalled RHP Brian Bruney from Triple-A Columbus; Released RHP Sidney Ponson.
2006-08-23,Pittsburgh Pirates Claimed RHP Juan Perez off waivers from the New York Mets; Activated C Ryan Doumit from the 15-day disabled list.
2006-08-23,San Diego Padres Recalled RHP Brian Sweeney from Triple-A Portland and optioned RHP Tim Stauffer to Portland.
2006-08-23,St. Louis Cardinals Signed free agent IF Jose Vizcaino; Activated LHP Mark Mulder from 15-day disabled list; Placed SS David Eckstein on 15-day disabled list; Designated OF Timo Perez for assignment.
2006-08-23,Tampa Bay Devil Rays Recalled RHP Jason Hammel from Triple-A Durham and placed RHP Jae Seo on the 15-day disabled list with a strained left groin.
2006-08-23,Toronto Blue Jays Activated LHP Gustavo Chacin from the 15-day disabled list.
2006-08-24,Cleveland Indians Acquired LHP Shawn Nottingham from the Seattle Mariners; Optioned OF Franklin Gutierrez to Triple-A Buffalo.
2006-08-24,Los Angeles Angels Recalled SS Erick Aybar from Triple-A Salt Lake; Optioned RHP Greg Jones to Salt Lake.
2006-08-24,Minnesota Twins Optioned OF Josh Rabe to Triple-A Rochester; Activated DH Rondell White from the disabled list.
2006-08-24,New York Mets Designated OF Ricky Ledee for assignment; Activated RHP Brian Bannister from the 60-day disabled list; Transferred C Ramon Castro from the 15-day to the 60-day disabled list; Transferred Duaner Sanchez from the 15-day to the 60-day disabled list; Optioned OF Lastings Milledge to Triple-A Norfolk; Signed C Kelly Stinnett to a minor league contract.
2006-08-24,Philadelphia Phillies Optioned OF Michael Bourn to Triple-A Scranton/Wilkes-Barre.
2006-08-24,Seattle Mariners Sent LHP Shawn Nottingham to the Cleveland Indians.
2006-08-24,Tampa Bay Devil Rays Acquired RHP Evan Meek from the San Diego Padres and either a player to be named later or cash for INF Russell Branyan; Purchased the contract of 1B Kevin Witt from Triple-A Durham.
2006-08-25,Arizona Diamondbacks Activated 1B Tony Clark from the 15-day disabled list; Optioned INF Alberto Callaspo to Triple-A Tucson.
2006-08-25,Atlanta Braves Placed RHP Danys Baez on the 15-day disabled list and recalled RHP Lance Cormier from Triple-A Richmond.
2006-08-25,Cincinnati Reds Outrighted RHP Mike Burns to Triple-A Louisville.
2006-08-25,Cleveland Indians Activated OF/INF Casey Blake from the 15-day disabled list.
2006-08-25,Kansas City Royals Placed OF Reggie Sanders on the 15-day disabled list with a partial tear in his left patellar tendon and a synovial cyst under the bottom of his left kneecap; Recalled INF Jeff Keppinger from Triple-A Omaha.
2006-08-25,New York Mets Optioned RHP Brian Bannister to Triple-A Norfolk; Recalled LHP Oliver Perez from Norfolk.
2006-08-25,"Oakland Athletics Placed SS Bobby Crosby on the 15-day disabled list, retroactive to Aug. 22, with a lower back strain; Selected INF D'Angelo Jimenez from Triple-A Sacramento."
2006-08-25,Philadelphia Phillies Optioned RHP Brian Sanches to Triple-A Scranton/Wilkes-Barre; Recalled LHP Matt Smith from Scranton/Wilkes-Barre.
2006-08-25,San Diego Padres Acquired INF Russell Branyan from the Devil Rays in exchange for Minor League RHP Evan Meek and a player to be named later or cash considerations; Transferred LHP Shawn Estes from the 15-day to the 60-day disabled list.
2006-08-25,Tampa Bay Devil Rays Placed LHP Scott Kazmir on the disabled list with left shoulder tightness; Recalled LHP J.P. Howell from Triple-A Durham.
2006-08-25,Texas Rangers Purchased the contract of INF/OF Eric Young from Triple-A Oklahoma and optioned RHP Nick Masset to Oklahoma.
2006-08-25,Washington Nationals Reinstated C/1BRobert Fick from the 15-day disabled list; Released INF Damian Jackson.
2006-08-26,Baltimore Orioles Released nonroster OF Tony Alvarez.
2006-08-26,Chicago White Sox Recalled OF Jerry Owens from Triple-A Charlotte and placed him on the 15-day disabled list with a sprained right ankle.
2006-08-26,Cleveland Indians Recalled RHP Edward Mujica from Triple-A Buffalo; Optioned RHP Fausto Carmona to Buffalo.
2006-08-26,Colorado Rockies Purchased the contract of C Chris Iannetta from Triple-A Colorado Springs; Designated C Danny Ardoin for assignment.
2006-08-26,Los Angeles Dodgers Recalled LHP Tim Hamulack from Triple-A Las Vegas; Designated RHP Giovanni Carrara for assignment.
2006-08-26,San Diego Padres Placed RHP Scott Williamson on the 15-day disabled list due to a right elbow strain; Recalled RHP Jon Adkins from Triple-A Portland and optioned OF Ben Johnson to Portland.
2006-08-26,Washington Nationals Placed OF Alex Escobar on the 15-day disabled list with a right shoulder separation and purchased the contract of RHP Kevin Gryboski from Triple-A New Orleans.
2006-08-27,Baltimore Orioles Traded OF-1B Jeff Conine and cash considerations to Philadelphia for a player to be named later.
2006-08-27,Chicago Cubs Selected LHP Les Walrond from Triple-A Iowa; optioned RHP Jae Kuk Ryu to Iowa; Transferred RHP Kerry Wood to the 60-day disabled list.
2006-08-27,Detroit Tigers Recalled LHP Andrew Miller from Class A Lakeland; Optioned RHP Colby Lewis to Triple-A Toledo and OF Brent Clevlen to Double-A Erie.
2006-08-27,Philadelphia Phillies Acquired OF Jeff Conine and cash from the Orioles in exchange for a player to be named.
2006-08-27,Seattle Mariners Recalled OF Mike Morse from Triple-A Tacoma; Optioned OF T.J. Bohn to Tacoma.
2006-08-27,Toronto Blue Jays Optioned INF Ryan Roberts to Triple-A Syracuse.
2006-08-28,"Boston Red Sox Acquired RHP Mike Burns from the Reds in exchange for RHP Tim Bausher; Purchased the contract of 1B Carlos Pena from Triple-A Pawtucket and placed LHP Jon Lester on the 15-day disabled list, retroactive to Aug. 24, with a back strain; Placed Adam Stern on the 60-day disabled list; Released RHP Jason Johnson and RHP Rudy Seanez."
2006-08-28,Chicago Cubs Activated 1B Derrek Lee from the 15-day disabled list; Optioned INF Buck Coats to Triple-A Iowa.
2006-08-28,Cincinnati Reds Agreed with C Javier Valentin on a one-year contract extension through the 2007 season with a club option for 2008; Acquired RHP Tim Bausher and cash from the Boston Red Sox in exchange for RHP Mike Burns.
2006-08-28,Houston Astros Recalled INF Eric Bruntlett and C Humberto Quintero from Triple A Round Rock; Optioned C J.R. House and RHP Chris Sampson to Round Rock.
2006-08-28,Philadelphia Phillies Optioned INF Danny Sandoval to Double-A Reading.
2006-08-28,"Pittsburgh Pirates Placed LHP Tom Gorzelanny and LHP Mike Gonzalez on the 15-day disabled list; Designated RHP Britt Reames for assignment, recalled RHP Jonah Bayliss and purchased the contracts of RHP Marty McLeary and RHP Brian Rogers from Triple-A Indianapolis."
2006-08-28,Seattle Mariners Placed RHP Julio Mateo on the 60-day disabled list with a broken left hand; Selected the contract of RHP Jon Huber from Triple-A Tacoma.
2006-08-28,Tampa Bay Devil Rays Placed OF Jonny Gomes on the disabled list with an impingement in his right shoulder; Recalled OF Delmon Young from Triple-A Durham.
2006-08-28,Toronto Blue Jays Recalled INF Russ Adams from Triple-A Syracuse.
2006-08-29,Baltimore Orioles Activated OF David Newhan from the 60-day disabled list.
2006-08-29,Boston Red Sox Purchased the contract of RHP Mike Burns from Triple-A Pawtucket and optioned LHP Kason Gabbard to Pawtucket; Placed RHP David Pauley on the 60-day disabled list.
2006-08-29,Cincinnati Reds Optioned LHP Chris Michalak to Class A Sarasota; Recalled OF Chris Denorfia from Triple-A Louisville.
2006-08-29,Colorado Rockies Purchased the contract of SS Troy Tulowitzki from Double-A Tulsa; Optioned INF Luis A. Gonzalez to Triple-A Colorado Springs.
2006-08-29,Detroit Tigers Purchased the contract of OF Alexis Gomez from Triple-A Toledo; Designated OF Nook Logan for assignment and recalled INF Tony Giarratano and placed him on the 15-day disabled list.
2006-08-30,Baltimore Orioles Claimed C Danny Ardoin from the Colorado Rockies; Designated LHP Tim Byrdak for assignment; Designated INF Ed Rogers for assignment; Acquired INF Angel Chavez from the Philadelphia Phillies as the PTBN.
2006-08-30,Cincinnati Reds Signed RHP Jason Johnson to a minor league contract and assigned him to Triple-A Louisville.
2006-08-30,Los Angeles Dodgers Recalled LHP Hong-Chih Kuo from Triple-A Las Vegas and optioned LHP Tim Hamulack to Class A Vero Beach.
2006-08-30,New York Mets Acquired minor league C Mike Nickeas from the Texas Rangers in exchange for OF Victor Diaz.
2006-08-30,Philadelphia Phillies Traded INF Angel Chavez to Baltimore to complete the deal for OF Jeff Conine.
2006-08-30,Texas Rangers Acquired OF Victor Diaz from the New York Mets for Minor League C Mike Nickeas; Outrighted OF Adam Hyzdu to Oklahoma.
2006-08-31,Atlanta Braves Acquired Daryle Ward from the Nationals in exchange for RHP Luis Atilano; Transferred RHP Phil Stockman from the 15-day to the 60-day disabled list.
2006-08-31,Boston Red Sox Activated LHP Lenny DiNardo from the 60-day disabled list; Traded LHP David Wells to the San Diego Padres for a player to be named or cash considerations; Acquired RHP Kevin Jarvis from the Arizona Diamondbacks for a player to be named and assigned Jarvis to Triple-A Pawtucket.
2006-08-31,Chicago Cubs Traded 1B Phil Nevin and cash considerations to the Twins for a player to be named later.
2006-08-31,Cincinnati Reds Optioned RHP Matt Belisle to Class A Sarasota and recalled INF Brendan Harris from Triple-A Louisville.
2006-08-31,Florida Marlins Optioned RHP Randy Messenger to Class A Jupiter and recalled INF Robert Andino from Triple-A Albuquerque.
2006-08-31,Los Angeles Dodgers Acquired INF Marlon Anderson and cash considerations from the Washington Nationals in exchange for RHP Jhonny Nunez.
2006-08-31,Minnesota Twins Acquired 1B/DH Phil Nevin and cash considerations from the Chicago Cubs in exchange for a player to be named or cash; Transferred OF Shannon Stewart from the 15-day to the 60-day disabled list.
2006-08-31,New York Mets Recalled INF Anderson Hernandez from Triple-A Norfolk; Optioned LHP Dave Williams to Norfolk.
2006-08-31,Oakland Athletics Recalled 1B Dan Johnson from Triple-A Sacramento and sent INF D'Angelo Jimenez outright to Sacramento.
2006-08-31,Philadelphia Phillies Recalled C Carlos Ruiz from Triple-A Scranton/Wilkes-Barre; Optioned LHP Matt Smith to Class A Clearwater.
2006-08-31,San Diego Padres Acquired LHP David Wells from the Red Sox in exchange for a player to be named later or cash considerations; Signed RHP Rudy Seanez; Recalled OF Terrmel Sledge from Triple-A Portland and optioned RHP Mike Thompson to Portland.
2006-08-31,St. Louis Cardinals Purchased the contract of C Mike Rose; placed LHP Mark Mulder on the 15-day disabled list.
2006-08-31,Washington Nationals Acquired Minor League RHP Luis Atilano from the Braves in exchange for INF Daryle Ward; acquired Minor League RHP Jhonny Nunez from the Dodgers in exchange for INF-OF Marlon Anderson.
2006-09-01,Atlanta Braves Activated OF Brian Jordan from the 60-day disabled list; Activated RHP Kyle Davies from the 60-day disabled list; Activated INF Willy Aybar from the 15-day disabled list; Recalled C Brayan Pena and 1B/OF Scott Thorman from Triple-A Richmond; Recalled RHP Joey Devine from Double-A Mississippi.
2006-09-01,Baltimore Orioles Recalled RHP Winston Abreu and RHP Julio Manon from Triple-A Ottawa; Recalled OF Jeff Fiorentino from Double-A Bowie.
2006-09-01,Boston Red Sox Recalled LHP Craig Breslow and OF David Murphy from Triple-A Pawtucket.
2006-09-01,Chicago Cubs Activated LHP Scott Eyre and LHP Sean Marshall from the 15-day disabled list; Activated RHP Wade Miller from the 60-day disabled list; Recalled C Geovany Soto from Triple-A Iowa.
2006-09-01,"Chicago White Sox Recalled RHP Charlie Haeger, LHP Boone Logan and C Chris Stewart from Triple-A Charlotte; Purchased the contract of OF Ryan Sweeney from Charlotte."
2006-09-01,Cincinnati Reds Recalled LHP Brian Shackelford from Triple-A Louisville; Reinstated RHP Gary Majewski and RHP Jason Standridge from the 15-day disabled list.
2006-09-01,Detroit Tigers Recalled IF Ramon Santiago and RHP Jordan Tata from Triple-A Toledo; Traded OF Nook Logan to the Washington Nationals for a PTBN.
2006-09-01,Florida Marlins Recalled RHP Chris Resop and RHP Yusmeiro Petit from Triple-A Albuquerque.
2006-09-01,Kansas City Royals Released LHP Bobby Madritsch.
2006-09-01,Purchased the contract of RHP Ryan Braun from Triple-A Omaha; Transferred OF Reggie Sanders from the 15-day to the 60-day disabled list.
2006-09-01,Los Angeles Angels Recalled RHP Chris Bootcheck and C Jeff Mathis from Triple-A Salt Lake; Activated OF Darin Erstad from the 15-day disabled list; Activated OF Curtis Pride from the 15-day disabled list; Activated 3B Dallas McPherson from the 15-day disabled list and optioned him to Triple-A Salt Lake.
2006-09-01,"Los Angeles Dodgers Recalled OF Matt Kemp, C Einar Diaz and 1B James Loney from Triple-A Las Vegas."
2006-09-01,Milwaukee Brewers Recalled RHP Dennis Sarfate from Triple-A Nashville; Purchased the contract of C Vinny Rottino from Nashville; Transferred 2B Rickie Weeks from the 15-day disabled list to the 60-day disabled list.
2006-09-01,Minnesota Twins Purchased the contract of SS Alexi Casilla from Double-A New Britain; Recalled RHP Scott Baker and C Chris Heintz from Triple-A Rochester.
2006-09-01,New York Mets Recalled LHP Royce Ring and RHP Heath Bell from Triple-A Norfolk.
2006-09-01,New York Yankees Purchased the contract of C Wil Nieves from Triple-A Columbus and designated OF Mitch Jones for assignment; Recalled RHP T.J. Beam and RHP Jose Veras from Triple-A Columbus.
2006-09-01,Philadelphia Phillies Recalled RHP Scott Mathieson and LHP Eude Brito from Triple-A Scranton/Wilkes-Barre; Acquired 1B Randall Simon from the Texas Rangers in exchange for cash considerations.
2006-09-01,Pittsburgh Pirates Activated RHP Josh Sharpless from the 15-day disabled list.
2006-09-01,San Diego Padres Recalled RHP Scott Cassidy from Triple-A Portland.
2006-09-01,"San Francisco Giants Recalled OF Jason Ellison, OF Fred Lewis, 1B Lance Niekro, C Justin Knoedler, RHP Brian Wilson and LHP Jonathan Sanchez from Triple-A Fresno and recalled RHP Scott Munter from Double-A Connecticut."
2006-09-01,Seattle Mariners Recalled RHP Emiliano Fruto from Triple-A Tacoma.
2006-09-01,St. Louis Cardinals Recalled RHP Brad Thompson and OF John Rodriguez from Triple-A Memphis.
2006-09-01,Tampa Bay Devil Rays Activated INF Ty Wigginton from the 15-day disabled list; Recalled RHP Brian Stokes and RHP Edwin Jackson from Triple-A Durham.
2006-09-01,Texas Rangers Recalled RHP Scott Feldman from Triple-A Oklahoma and traded Triple-A 1B Randall Simon to the Philadelphia Phillies for cash considerations.
2006-09-01,Toronto Blue Jays Purchased the contracts of OF Adam Lind and INF Kevin Barker from Triple-A Syracuse.
2006-09-01,Washington Nationals Outrighted RHP Kevin Gryboski to Triple-A New Orleans; Acquired OF Nook Logan from the Detroit Tigers in exchange for a player to be named later or cash considerations.
2006-09-02,Arizona Diamondbacks Recalled C Miguel Montero and LHP Doug Slaten from Triple-A Tucson; Purchased the contract of LHP Randy Choate from Tucson; Activated RHP Greg Aquino and INF Andy Green from the 15-day disabled list.
2006-09-02,Atlanta Braves Recalled RHP Anthony Lerew from Triple-A Richmond.
2006-09-02,Boston Red Sox Purchased the contract of RHP Kevin Jarvis from Triple-A Pawtucket and transferred LHP Jon Lester the 60-day disabled list.
2006-09-02,Cincinnati Reds Recalled OF Norris Hopper from Triple-A Louisville.
2006-09-02,Cleveland Indians Purchased the contract of INF Kevin Kouzmanoff from Triple-A Buffalo.
2006-09-02,Colorado Rockies Purchased the contract of 3B Vinny Castilla from Triple-A Colorado Springs.
2006-09-02,Detroit Tigers Recalled C/1B Chris Shelton from Triple-A Toledo.
2006-09-02,New York Mets Activated OF Cliff Floyd from the 15-day disabled list.
2006-09-02,New York Yankees Activated 1B Andy Phillips from the 15-day disabled list.
