date,transaction
2006-05-23,New York Yankees Activated Gary Sheffield from the 15-day disabled list and designated Colter Bean for assignment; Signed OF Richard Hidalgo to a Minor League contract.
2006-05-23,"San Francisco Giants Placed RHP Tim Worrell on the 15-day disabled list, retroactive to May 21, with a right cervical muscle strain and recalled RHP Brian Wilson from Triple-A Fresno."
2006-05-23,Texas Rangers Recalled DH/OF Jason Botts from Triple-A Oklahoma and optioned INF Drew Meyer to Oklahoma.
2006-05-24,Arizona Diamondbacks Acquired RHP Jorge Julio from the New York Mets in exchange for RHP Orlando Hernandez.
2006-05-24,Baltimore Orioles Activated 2B Brian Roberts from the 15-day disabled list and optioned INF Ed Rogers to Triple-A Ottawa.
2006-05-24,"Boston Red Sox Placed LHP Lenny DiNardo on the 15-day disabled list, retroactive to May 22, with a neck strain and recalled RHP Jermaine Van Buren from Triple-A Pawtucket."
2006-05-24,Kansas City Royals Sent OF Kerry Robinson outright to Triple-A Omaha.
2006-05-24,Placed LHP Mark Redman on the Bereavement List and recalled RHP Leo Nunez from Double-A Wichita.
2006-05-24,Milwaukee Brewers Optioned RHP Chris Demaria to Triple-A Nashville.
2006-05-24,New York Mets Acquired RHP Orlando Hernandez from the Arizona Diamondbacks in exchange for RHP Jorge Julio; Recalled RHP Heath Bell from Triple-A Norfolk.
2006-05-24,New York Yankees Recalled LHP Matt Smith from Triple-A Columbus; Optioned OF Kevin Reese to Columbus; Acquired IF Nick Green from the Devil Rays for cash considerations and assigned him to Columbus.
2006-05-24,"Philadelphia Phillies Placed LHP Cole Hamels on the 15-day disabled list, retroactive to May 19, with a strained left shoulder and recalled RHP Clay Condrey from Triple-A Scranton/Wilkes-Barre."
2006-05-24,Pittsburgh Pirates Reinstated INF/OF Jose Bautista from the Bereavement List and optioned INF/OF Yurendell DeCaster to Triple-A Indianapolis.
2006-05-24,San Francisco Giants Optioned RHP Scott Munter to Double-A Connecticut.
2006-05-24,Toronto Blue Jays Outrighted RHP Josh Towers to Triple-A Syracuse and optioned SS Russ Adams to Syracuse.
2006-05-25,Cincinnati Reds Acquired Minor League RHP Robert Manuel from the New York Mets in exchange for LHP Dave Williams and an undisclosed amount of cash.
2006-05-25,Detroit Tigers Released nonroster RHP Matt Mantei.
2006-05-25,Kansas City Royals Optioned RHP Leo Nunez to Triple-A Omaha and purchased the contract of RHP Bobby Keppel from Omaha.
2006-05-25,Milwaukee Brewers Assigned RHP Justin Lehr outright to the Nashville Sounds.
2006-05-25,New York Mets Acquired LHP Dave Williams from the Cincinnati Reds in exchange for non-roster RHP Robert Manuel and cash; Assigned Williams to Triple-A Norfolk; Designated RHP Jeremi Gonzalez for assignment.
2006-05-25,San Francisco Giants Recalled 1B Travis Ishikawa from Double-A Connecticut and optioned OF Dan Ortmeier to Triple-A Fresno.
2006-05-25,Texas Rangers Activated INF Ian Kinsler from the 15-day disabled list and designated OF Adrian Brown for assignment; Recalled LHP John Rheinecker from Triple-A Oklahoma and optioned RHP Robinson Tejeda to Oklahoma.
2006-05-25,Toronto Blue Jays Signed INF Edgardo Alfonzo to a Minor League contract.
2006-05-26,Arizona Diamondbacks Optioned RHP Casey Daigle to Triple-A Tucson and recalled RHP Enrique Gonzalez.
2006-05-26,Atlanta Braves RHP Travis Smith has declined his assignment to Triple-A Richmond and has become a free agent.
2006-05-26,Boston Red Sox Activated LHP David Wells from the 15-day disabled list and optioned OF Dustan Mohr to Triple-A Pawtucket.
2006-05-26,Chicago Cubs Selected INF Tony Womack from Triple-A Iowa and optioned INF Ryan Theriot to Iowa; Transferred RHP Mark Prior to the 60-day disabled list.
2006-05-26,Cincinnati Reds Traded OF Cody Ross to the Marlins for a player to be named later or cash considerations.
2006-05-26,Activated LHP Kent Mercker from the 15-day disabled list.
2006-05-26,"Colorado Rockies Placed C Danny Ardoin on the 15-day disabled list, retroactive to May 25, with a strained left knee and recalled C J.D. Closser from Triple-A Colorado Springs."
2006-05-26,Detroit Tigers Placed LHP Mike Maroth on the 15-day disabled list; Recalled RHP Chris Spurling from Triple-A Toledo.
2006-05-26,Florida Marlins Optioned OF Chris Aguila to Triple-A Albuquerque.
2006-05-26,Acquired OF Cody Ross from the Cincinnati Reds for a player to be named later or cash; transferred RHP Sergio Mitre to the 60-day disabled list.
2006-05-26,Kansas City Royals Acquired RHP Seth Etherton from the Padres for a player to be named later or cash.
2006-05-26,Los Angeles Angels Selected the contract of RHP Jered Weaver from Triple-A Salt Lake and designated RHP Esteban Yan for assignment.
2006-05-26,Milwaukee Brewers Acquired RHP Jeremi Gonzalez from the Mets in exchange for RHP Mike Adams; Recalled RHP Chris Mabeus from Triple-A Nashville.
2006-05-26,New York Mets Acquired RHP Mike Adams from the Milwaukee Brewers in exchange for RHP Jeremi Gonzalez; Optioned Adams to Triple-A Norfolk.
2006-05-26,New York Yankees Recalled C Koyie Hill from Triple-A Columbus; Optioned LHP Matt Smith to Columbus; Transferred RHP Tanyon Sturtze from the 15-day to the 60-day disabled list.
2006-05-26,Philadelphia Phillies Optioned OF Chris Roberson to Triple-A Scranton/Wilkes-Barre.
2006-05-26,San Francisco Giants Purchased the contract of LHP Jonathan Sanchez from Double-A Connecticut.
2006-05-26,Texas Rangers Recalled RHP Wes Littleton from Double-A Frisco; Sent OF Adrian Brown outright to Triple-A Oklahoma.
2006-05-26,Toronto Blue Jays Purchased the contract of INF Luis Figueroa and recalled LHP Brian Tallet from Triple-A Syracuse.
2006-05-26,"Washington Nationals Activated C Brian Schneider from the 15-day disabled list and placed RHP Felix Rodriguez on the 15-day disabled list, retroactive to May 20, with right shoulder tendinitis."
2006-05-27,"Atlanta Braves Placed C Brian McCann on the 15-day disabled list, retroactive to May 24, with a sprained left ankle; activated LHP Horacio Ramirez from the 15-day disabled list."
2006-05-27,Los Angeles Dodgers Nonroster C Pat Borders announced his retirement.
2006-05-27,Milwaukee Brewers Optioned RHP Carlos Villanueva to Double-A Huntsville.
2006-05-27,Philadelphia Phillies Activated OF Aaron Rowand from 15-day disabled list.
2006-05-27,St. Louis Cardinals Activated RHP Sidney Ponson from 15-day disabled list and optioned 1B/OF Chris Duncan to Triple-A Memphis.
2006-05-27,Tampa Bay Devil Rays Placed LHP Casey Fossum on the 15-day disabled list and recalled RHP James Shields from Triple-A Durham.
2006-05-27,"Washington Nationals Placed OF Jose Guillen on the 15-day disabled list with a right hamstring injury, recalled OF Mike Vento from Triple-A New Orleans and moved RHP Zach Day from the 15-day to the 60-day disabled list."
2006-05-27,Outrighted C Wiki Gonzalez to Triple-A New Orleans and purchased the contract of RHP Shawn Hill from New Orleans.
2006-05-28,Boston Red Sox Activated OF Coco Crisp from 15-day disabled list; Recalled RHP Manny Delcarmen from Pawtucket; Placed RHP Mike Timlin and OF Wily Mo Pena (retroactive to May 27) on 15-day disabled list.
2006-05-28,Chicago Cubs Recalled RHP Jae Kuk Ryu from Triple-A Iowa and optioned RHP Michael Wuertz to Iowa.
2006-05-28,Colorado Rockies Placed INF Luis Gonzalez on the 15-day disabled list with inflammation in both wrists and recalled OF Ryan Spilborghs from Triple-A Colorado Springs.
2006-05-28,Kansas City Royals Optioned RHP Runelvys Hernandez to Triple-A Omaha.
2006-05-28,Los Angeles Dodgers Purchased the contract of OF Matt Kemp from Double-A Jacksonville and optioned RHP Lance Carter to Triple-A Las Vegas; transferred INF Cesar Izturis from the 15-day to the 60-day disabled list.
2006-05-28,Oakland Athletics Recalled RHP Matt Roney from Triple-A Sacramento and optioned RHP Santiago Casilla to Sacramento.
2006-05-28,San Diego Padres Reinstated C Rob Bowen from the 15-day disabled list; Optioned 1B/OF Paul McAnulty to Triple-A Portland.
2006-05-29,Chicago Cubs Recalled RHP David Aardsma from Triple-A Iowa and optioned RHP Jae Kuk Ryu to Iowa.
2006-05-29,Florida Marlins Activated RHP Franklyn German from the 15-day disabled list and optioned LHP Renyel Pinto to Triple-A Albuquerque.
2006-05-29,Kansas City Royals Activated OF David DeJesus from the 15-day disabled list and optioned OF Aaron Guiel to Triple-A Omaha; Purchased the contract of RHP Seth Etherton from Triple-A Omaha and outrighted RHP Brian Bass to Double-A Wichita.
2006-05-29,Philadelphia Phillies Placed RHP Jon Lieber on 15-day disabled list with a strained left groin and recalled RHP Brian Sanches from Triple-A Scranton/Wilkes-Barre.
2006-05-29,Activated C Mike Lieberthal from 15-day disabled list and optioned C Carlos Ruiz to Triple-A Scranton/Wilkes-Barre.
2006-05-29,"Toronto Blue Jays Placed RHP A.J. Burnett on the 60-day disabled list, retroactive to April 22; Placed INF John McDonald on the 15-day disabled list; Purchased the contract of INF Edgardo Alfonzo from Double-A New Hampshire."
2006-05-30,Atlanta Braves Purchased the contract of RHP Tyler Yates from Triple-A Richmond and optioned RHP Lance Cormier to Richmond.
2006-05-30,Cincinnati Reds Placed RHP Matt Belisle on the 15-day disabled list; called up RHP Justin Germano from Triple-A Louisville.
2006-05-30,Acquired RHP Esteban Yan from the Los Angeles Angels of Anaheim and cash in exchange for RHP Kyle Edens.
2006-05-30,New York Mets Placed OF Xavier Nady on the 15-day disabled list; Transferred RHP Brian Bannister from the 15-day to the 60-day disabled list; Recalled OF Lastings Milledge from Triple-A Norfolk.
2006-05-30,San Francisco Giants Activated 1B Lance Niekro from the 15-day disabled list and optioned 1B Travis Ishikawa to Double-A Connecticut.
2006-05-30,Seattle Mariners Requested waivers on OF Matt Lawton for the purpose of granting his unconditional release.
2006-05-30,Requested waivers on OF Matt Lawton for the purpose of granting his unconditional release.
2006-05-30,"Texas Rangers Signed INF Chris Kemp, RHP Luke Massetti and OF Tim Rodriguez."
2006-05-30,Toronto Blue Jays Optioned LHP Brian Tallet to Triple-A Syracuse and activated LHP Gustavo Chacin from the 15-day disabled list.
2006-05-31,Boston Red Sox Placed LHP David Wells on the 15-day disabled list (retroactive to May 27) with a right knee contusion; Recalled RHP David Pauley from Double-A Portland.
2006-05-31,Chicago Cubs Acquired INF Phil Nevin and cash considerations from the Texas Rangers in exchange for INF Jerry Hairston Jr.
2006-05-31,Cincinnati Reds Optioned LHP Brian Shackelford to Louisville and recalled RHP Esteban Yan.
2006-05-31,Detroit Tigers Purchased the contract of RHP Zach Miner from Triple-A Toledo and optioned INF Jack Hannhan to Triple-A Toledo.
2006-05-31,Kansas City Royals Activated LHP Mark Redman from the Bereavement List and optioned RHP Joe Nelson to Triple-A Omaha.
2006-05-31,Los Angeles Angels Sent RHP Esteban Yan and cash to the Cincinnati Reds for RHP Kyle Edens; Signed Kelvim Escobar to a three-year contract extension (through the 2009 season).
2006-05-31,New York Yankees Recalled RHP Darrell Rasner from Triple-A Columbus and designated C Koyie Hill for assignment.
2006-05-31,Philadelphia Phillies Recalled LHP Eude Brito from Triple-A Scranton/Wilkes-Barre.
2006-05-31,San Diego Padres Purchased the contract of RHP Brian Sikorski from Triple-A Portland; Designated RHP Jim Brower for assignment.
2006-05-31,"Texas Rangers Acquired INF/OF Jerry Hairston, Jr. from the Chicago Cubs in exchange for INF Phil Nevin and cash considerations."
2006-05-31,Washington Nationals Placed LHP Joey Eischen on the 60-day disabled list with a thickness tear of one of his left rotator cuff muscles.
2006-06-01,Cincinnati Reds Released nonroster LHP Darrell May.
2006-06-01,Los Angeles Dodgers Placed 2B Jeff Kent on the 15-day disabled list with a sprained wrist and recalled OF Joel Guzman from Triple-A Las Vegas; Acquired nonroster LHP Ben Kozlowski from the Reds to complete the May 26 trade.
2006-06-01,Milwaukee Brewers Sent RHP Chris Mabeus outright to Triple-A Nashville; Optioned LHP Dana Eveland to Nashville; Transferred RHP Rick Helling from the 15-day to the 60-day disabled list.
2006-06-01,Minnesota Twins Optioned RHP Scott Baker to Triple-A Rochester.
2006-06-01,"New York Yankees Placed OF Gary Sheffield on the 15-day disabled list, retroactive to May 30, with a left wrist injury. Purchased the contract of OF Kevin Thompson from Triple-A Columbus."
2006-06-01,"Oakland Athletics Placed 2B Mark Ellis on the 15-day disabled list, retroactive to May 31, with a broken right thumb and recalled C Jeremy Brown from Triple-A Sacramento."
2006-06-01,Texas Rangers Purchased the contract of RHP John Wasdin and optioned LHP CJ Wilson to Triple-A Oklahoma; Acquired nonroster 1B Jason Hart from the Twins for a PTBN.
2006-06-02,"Baltimore Orioles Placed Jay Gibbons on the 15-day disabled list, retroactive to May 27, with soreness in his left hip and right knee."
2006-06-02,Chicago Cubs Released nonroster OF Adam Greenberg.
2006-06-02,Colorado Rockies Activated C Yorvit Torrealba from the 15-day disabled list and optioned C Miguel Ojeda to Triple-A Colorado Springs.
2006-06-02,Florida Marlins Purchased the contract of LHP Taylor Tankersley from Double-A Carolina; Designated RHP Todd Wellemeyer and Franklyn German for assignment; Activated RHP Carlos Martinez from the 15-day disabled list.
2006-06-02,Houston Astros Purchased the contract of RHP Chris Sampson from Triple-A Round Rock; Optioned LHP Mike Gallo to Round Rock; Transferred INF Jeff Bagwell from the 15-day to the 60-day disabled list.
2006-06-02,Kansas City Royals Released nonroster RHP Adam Bernero.
2006-06-02,Minnesota Twins Recalled 3B Terry Tiffee from Triple-A Rochester.
2006-06-02,Philadelphia Phillies Optioned RHP Gavin Floyd to Triple-A Scranton/Wilkes Barre and recalled LHP Eude Brito from Triple-A Scranton/Wilkes-Barre.
2006-06-02,"San Francisco Giants Placed C Mike Matheny on the 15-day disabled list, retroactive to June 1, with symptoms related to a concussion and recalled C Eliezer Alfonzo from Double-A Connecticut."
2006-06-02,Seattle Mariners Released nonroster RHP Kevin Appier.
2006-06-02,St. Louis Cardinals Purchased the contract of OF Timo Perez from Triple-A Memphis; optioned RHP Anthony Reyes to Triple-A Memphis.
2006-06-02,Washington Nationals Placed RHP Santiago Ramirez on the 15-day disabled list with a right elbow strain; Purchased the contract of LHP Bill Bray from Triple-A New Orleans.
2006-06-03,Arizona Diamondbacks Optioned RHP Enrique Gonzalez to Triple-A Tucson and activated LHP Terry Mulholland off the 15-day disabled list.
2006-06-03,Baltimore Orioles Recalled INF Ed Rogers from Triple-A Ottawa.
2006-06-03,Colorado Rockies Designated RHP Sun-Woo Kim and INF Jason Smith for assignment. Recalled RHP Scott Dohmann and INF Omar Quintanilla from Triple-A Colorado Springs.
2006-06-03,Kansas City Royals Recalled 3B Mark Teahen from Triple-A Omaha and optioned INF Andres Blanco to Omaha.
2006-06-03,Milwaukee Brewers Purchased the contracts of LHP Zach Jackson and RHP Allan Simpson from Triple-A Nashville.
2006-06-03,New York Yankees Placed RHP Darrell Rasner on the 15-day disabled list with discomfort in his right shoulder and recalled LHP Matt Smith from Triple-A Columbus.
2006-06-03,Washington Nationals Recalled INF Brendan Harris from Triple-A New Orleans.
2006-06-04,Chicago Cubs RHP Scott Williamson was placed on the 15-day disabled list with elbow soreness and RHP Carlos Marmol was called up from Double-A West Tenn.
2006-06-04,Chicago White Sox Placed RHP Jeff Nelson on the 15-day disabled list and recalled RHP Agustin Montero from Triple-A Charlotte.
2006-06-04,Detroit Tigers Optioned RHP Chris Spurling to Triple-A Toledo.
2006-06-04,Los Angeles Dodgers Optioned LHP Tim Hamulack to Triple-A Las Vegas and recalled LHP Hong-Chih Kuo from Las Vegas.
2006-06-04,Oakland Athletics Optioned C Jeremy Brown and RHP Matt Roney to Triple-A Sacramento; Activated RHP Rich Harden from the 15-day disabled list and optioned LHP Ron Flores to Triple-A Sacramento.
2006-06-04,St. Louis Cardinals Placed 1B Albert Pujols on the 15-day disabled list with a strained right oblique muscle and recalled OF Chris Duncan from Triple-A Memphis.
2006-06-05,Baltimore Orioles Activated RHP Daniel Cabrera from the 15-day disabled list and designated C Raul Chavez for assignment.
2006-06-05,Cincinnati Reds Optioned RHP Justin Germano to Triple-A Louisville.
2006-06-05,Kansas City Royals Optioned RHP Seth Etherton to Triple-A Omaha and recalled RHP Leo Nunez from Omaha.
2006-06-05,Pittsburgh Pirates Placed C Ryan Doumit on the 15-day disabled list with a torn left hamstring and recalled INF/OF Yurendell DeCaster from Triple-A Indianapolis.
2006-06-05,San Francisco Giants Optioned IF Kevin Frandsen to Triple-A Fresno.
2006-06-05,Tampa Bay Devil Rays Activated 2B Jorge Cantu from the disabled and optioned RHP Chad Orvella to Triple-A Durham.
2006-06-06,Arizona Diamondbacks Placed RHP Juan Cruz on the 15-day disabled list; Recalled RHP Dustin Nippert from Triple-A Tucson.
2006-06-06,Activated RHP Russ Ortiz from the 15-day disabled list; Placed LHP Terry Mulholland on the 15-day disabled list with an inner ear infection.
2006-06-06,Boston Red Sox Recalled RHP Craig Hansen from Triple-A Pawtucket and optioned RHP Jermaine Van Buren to Triple-A Pawtucket.
2006-06-06,Cincinnati Reds Purchased the contract of RHP Joe Mays from Triple-A Louisville.
2006-06-06,Detroit Tigers Transferred LHP Mike Maroth from the 15-day to the 60-day disabled list; Recalled OF Alexis Gomez from Triple-A Toledo.
2006-06-06,"Houston Astros Placed RHP Roy Oswalt on the 15-day disabled list, retroactive to May 30, with a mid-back sprain and purchased the contract of LHP Philip Barzilla from Triple A Round Rock; Transferred RHP Brandon Backe from the 15-day to the 60-day disabled list."
2006-06-06,New York Yankees Purchased the contract of INF Nick Green from Triple-A Columbus and designated OF Terrence Long for assignment.
2006-06-06,Oakland Athletics Activated OF Milton Bradley and RHP Jay Witasick from the 15-day disabled list.
2006-06-06,Philadelphia Phillies Activated LHP Cole Hamels from the 15-day disabled list; Optioned RHP Brian Sanches to Triple-A Scranton/Wilkes-Barre.
2006-06-06,San Francisco Giants Activated OF Moises Alou from the 15-day disabled list.
2006-06-06,St. Louis Cardinals Activated RHP Chris Carpenter from the 15-day disabled list and placed OF Larry Bigbie on the 15-day disabled list with an umbilical hernia.
2006-06-06,Tampa Bay Devil Rays Optioned OF Joey Gathright to Triple-A Durham and activated OF Rocco Baldelli from the disabled list.
2006-06-06,Texas Rangers Activated RHP Antonio Alfonseca from the 15-day disabled list and designated INF D'Angelo Jimenez for assignment.
2006-06-07,Arizona Diamondbacks Released RHP Jason Grimsley; Recalled RHP Enrique Gonzalez from Triple-A Tucson.
2006-06-07,Atlanta Braves Activated LHP Chuck James from the 15-day disabled list; optioned James to Triple-A Richmond.
2006-06-07,Chicago White Sox Placed RHP Cliff Politte on the 15-day disabled list (retroactive to June 5) with right shoulder inflammation and recalled RHP Sean Tracey from Triple-A Charlotte; Released nonroster RHP Hideo Nomo; Signed 3B Bobby Smith to a Minor League contract.
2006-06-07,Colorado Rockies Activated SS Josh Wilson from the 60-day disabled list and outrighted him to Triple-A Colorado Springs; Announced that RHP Sun-Woo Kim and INF Jason Smith had cleared waivers and have until Friday to decide whether to accept an assignment to Colorado Springs or declare free agency.
2006-06-07,San Francisco Giants Activated RHP Tim Worrell from the 15-day disabled list and optioned RHP Brian Wilson to Triple-A Fresno.
2006-06-07,Tampa Bay Devil Rays Optioned RHP Doug Waechter to Triple-A Durham and activated LHP Casey Fossum from the disabled list.
2006-06-08,Arizona Diamondbacks Optioned RHP Dustin Nippert to Triple-A Tucson; Recalled RHP Greg Aquino from Tucson.
2006-06-08,Kansas City Royals Purchased the contract of RHP Kyle Snyder from Triple-A Omaha and optioned RHP Denny Bautista to Omaha; Outrighted RHP Seth Etherton to Omaha.
2006-06-08,"Oakland Athletics Activated RHP Esteban Loaiza from the 15-day disabled list and placed RHP Rich Harden on the 15-day disabled list, retroactive to June 5, with a sprained ligament in his right elbow."
2006-06-08,Philadelphia Phillies Signed RHP Adam Bernero to a Minor League contract.
2006-06-08,Seattle Mariners Optioned RHP Sean Green to Triple-A Tacoma; Recalled RHP Emiliano Fruto from Triple-A Tacoma.
2006-06-09,Atlanta Braves Activated C Brian McCann from the disabled list and optioned C Brayan Pena to Triple-A Richmond.
2006-06-09,"Chicago Cubs Placed RHP Kerry Wood on the 15-day disabled list with right shoulder stiffness, retroactive to June 7, and recalled RHP Angel Guzman from Triple-A Iowa."
2006-06-09,"Cincinnati Reds Placed 3B Edwin Encarnacion on 15-day disabled list, retroactive to June 7, with a sprained left ankle; Recalled INF Ray Olmedo from Triple-A Louisville."
2006-06-09,Cleveland Indians Recalled LHP Rafael Perez from Double-A Akron; Designated LHP Scott Sauerbeck for assignment.
2006-06-09,Colorado Rockies Acquired INF Kazuo Matsui and cash considerations from the New York Mets in exchange for OF Eli Marrero; Optioned Matsui to Triple-A Colorado Springs; Recalled OF Jorge Piedra from Colorado Springs.
2006-06-09,"Florida Marlins RHP Franklyn German, designated for assignment on June 2, cleared waivers and was outrighted to Triple-A Albuquerque."
2006-06-09,Kansas City Royals Claimed RHP Todd Wellemeyer off waivers from the Marlins; designated RHP Steve Andrade for assignment.
2006-06-09,Los Angeles Angels Activated INF Maicer Izturis from the 15-day disabled list; optioned SS Erick Aybar to Triple-A Salt Lake.
2006-06-09,Milwaukee Brewers Placed LHP Jorge De La Rosa on the 15-day disabled list with blisters on his right middle finger and recalled RHP Carlos Villanueva from Double-A Huntsville.
2006-06-09,Minnesota Twins Placed RHP Matt Guerrier on the 15-day disabled list with a non-displaced fracture of his right thumb; Recalled RHP Kyle Lohse from Triple-A Rochester.
2006-06-09,New York Mets Acquired C/1B/OF Eli Marrero from the Colorado Rockies in exchange for INF Kazuo Matsui.
2006-06-09,Oakland Athletics Optioned LHP Randy Keisler to Triple-A Sacramento and recalled INF Mike Rouse from Sacramento.
2006-06-09,Philadelphia Phillies Optioned LHP Eude Brito to Triple-A Scranton/Wilkes-Barre; Recalled OF Chris Roberson from Triple-A Scranton/Wilkes-Barre.
2006-06-09,Texas Rangers Purchased the contract of RHP Bryan Corey and designated RHP Antonio Alfonseca for assignment.
2006-06-10,Boston Red Sox Recalled LHP Jon Lester from Triple-A Pawtucket and optioned RHP Craig Hansen to Triple-A Pawtucket.
2006-06-10,Kansas City Royals Obtained RHP Brandon Duckworth from the Pirates for cash considerations.
2006-06-10,Purchased the contract of RHP Todd Wellemeyer; optioned RHP Leo Nunez to Triple-A Omaha.
2006-06-10,Philadelphia Phillies Placed C Mike Lieberthal on 15-day disabled list with left hip strain; Recalled RHP Brian Sanches from Triple-A Scranton/Wilkes-Barre.
2006-06-10,Toronto Blue Jays Placed LHP Gustavo Chacin and RHP Pete Walker on the 15-day disabled list; Recalled RHP Vinnie Chulk and LHP Brian Tallet from Triple-A Syracuse.
2006-06-10,Washington Nationals Activated OF Jose Guillen from the 15-day disabled list; Optioned OF Mike Vento to Triple-A New Orleans.
2006-06-11,Cleveland Indians Recalled INF Ramon Vazquez from Triple-A Buffalo and optioned INF Lou Merloni to Buffalo.
2006-06-11,Kansas City Royals Selected the contract of RHP Brandon Duckworth from Triple-A Omaha and designated RHP Kyle Snyder for assignment.
2006-06-11,New York Yankees Activated RHP Shawn Chacon from the 15-day disabled list and designated RHP Scott Erikson for assignment.
2006-06-12,Baltimore Orioles Activated OF Jay Gibbons from the 15-day disabled list and optioned INF Ed Rogers to Triple-A Ottawa.
2006-06-12,Boston Red Sox Optioned RHP David Pauley to Triple-A Pawtucket.
2006-06-12,Colorado Rockies Activated INF Luis A. Gonzalez from the 15-day disabled list and optioned him to Triple-A Colorado Springs.
2006-06-12,Kansas City Royals Released RHP Frank Brooks.
2006-06-12,Los Angeles Angels Activated OF Darin Erstad from the 15-day disabled list; Optioned OF Tommy Murphy to Triple-A Salt Lake.
2006-06-12,New York Mets Activated RHP John Maine from the 15-day disabled list and optioned him to Triple-A Norfolk.
2006-06-12,Toronto Blue Jays Activated INF John McDonald from the 15-day disabled list and recalled INF Russ Adams from Triple-A Syracuse; Released Edgardo Alfonzo; Sent Luis Figueroa outright to Syracuse.
2006-06-13,Arizona Diamondbacks Designated RHP Russ Ortiz for assignment; Purchased the contract of LHP Randy Choate from Triple-A Tucson.
2006-06-13,"Boston Red Sox Placed RHP Keith Foulke on 15-day disabled list, retroactive to June 12, with tendinitis in his right elbow and recalled RHP Jermaine Van Buren from Triple-A Pawtucket; Activated Mike Timlin from 15-day disabled list."
2006-06-13,Cincinnati Reds Sent Minor League RHP Jeff Stevens to the Cleveland Indians to complete the April 7 deal in which the Reds acquired 2B Brandon Phillips for a PTBNL or cash.
2006-06-13,Cleveland Indians Acquired RHP Jeff Stevens from the Cincinnati Reds and assigned him to Class A Lake County to complete an earlier trade for INF Brandon Phillips; signed 2006 draft pick C Matt McBride.
2006-06-13,Recalled RHP Jeremy Guthrie from Triple-A Buffalo and optioned RHP Jason Davis to Buffalo.
