date,transaction
2006-01-01,Pittsburgh Pirates Signed C Paul Chiaffredo to a Minor League contract.
2006-01-03,"Chicago Cubs Signed OF Marquis Grissom, INF Augie Ojeda and OF Michael Restovich to Minor League contracts with invitations to Spring Training."
2006-01-03,Houston Astros Signed OF Preston Wilson to a one-year contract.
2006-01-03,San Diego Padres Signed RHP Dewon Brazelton to a one-year contract.
2006-01-03,San Francisco Giants Designated LHP Brian Burres for assignment.
2006-01-03,Texas Rangers Signed RHP Joselo Diaz and LHP Brian Anderson to Minor League contracts with invitations to Spring Training.
2006-01-03,Toronto Blue Jays Signed C Jason Phillips to a Minor League contract with an invitation to Spring Training.
2006-01-04,Baltimore Orioles Signed 1B Jeff Conine to a one-year contract with a club option for 2007.
2006-01-04,Chicago White Sox Agreed to terms with INF Rob Mackowiak on a two-year contract with a club option for 2008.
2006-01-04,"Detroit Tigers Signed INF Ramon Santiago, OF Ryan Ludwick and LHP Hector Mercado to Minor League contracts with invitations to Spring Training."
2006-01-04,Florida Marlins Designated C John Baker and INF Josh Wilson for assignment; Signed RHP Kerry Ligtenberg to a Minor League contract with an invitation to Spring Training.
2006-01-04,Los Angeles Dodgers Acquired RHP Jae Seo and LHP Tim Hamulack from the New York Mets in exchange for RHP Duaner Sanchez and RHP Steve Schmoll.
2006-01-04,Milwaukee Brewers Signed RHP Dan Kolb to a one-year contract.
2006-01-04,Minnesota Twins Signed LHP Gabe White to a Minor League contract with an invitation to Spring Training.
2006-01-04,New York Mets Acquired RHP Duaner Sanchez and RHP Steve Schmoll from the Dodgers in exchange for RHP Jae Seo and LHP Tim Hamulack; Signed INF Bret Boone to a Minor League contract with an invitation to Spring Training.
2006-01-04,Pittsburgh Pirates Signed OF Jeromy Burnitz to a one-year contract with a mutual option for 2007 and designated INF J.J. Furmaniak for assignment.
2006-01-04,"San Diego Padres Acquired 1B Adrian Gonzalez, OF Terrmel Sledge and RHP Chris Young from the Texas Rangers in exchange for RHP Adam Eaton, RHP Akinori Otsuka and C Billy Killian."
2006-01-04,"Texas Rangers Acquired RHP Adam Eaton, RHP Akinori Otsuka and C Billy Killian in exchange for RHP Chris Young, 1B Adrian Gonzalez and OF Terrmel Sledge."
2006-01-05,"Minnesota Twins Invited nonroster players C Kyle Geiger, C Kyle Phillips, INF Luis Maza, INF Tommy Watkins, OF Josh Rabe, OF Denard Span, LHP Ricky Barrett, and LHP Glen Perkins to Spring Training; Re-signed INF Glenn Williams to a Minor League contract and invited him to Spring Training."
2006-01-05,New York Yankees Signed INF Miguel Cairo to a one-year contract.
2006-01-05,Oakland Athletics Signed LHP Randy Keisler and C Raul Casanova to Minor League contracts with invitations to Spring Training.
2006-01-05,Philadelphia Phillies Signed RHP Ryan Franklin to a one-year contract.
2006-01-05,"Pittsburgh Pirates Signed RHP Brandon Duckworth, RHP Marty McLeary, LHP C. J. Nitkowski, RHP Nerio Rodriguez, and RHP Scott Strickland to Minor League contracts with invitations to attend Spring Training."
2006-01-05,Seattle Mariners Signed RHP Rafael Soriano to a one-year contract.
2006-01-05,Washington Nationals Signed INF Jamey Carroll to a one-year contract.
2006-01-06,Atlanta Braves Signed Chris Reitsma to a one-year deal and signed Eddie Perez and Brian Jordan to Minor League contracts. Perez and Jordan have been invited to Spring Training camp.
2006-01-06,Baltimore Orioles Claimed LHP Brian Burres off waivers from the San Francisco Giants.
2006-01-06,Boston Red Sox Signed INF J.T. Snow to a one-year contract.
2006-01-06,"Chicago Cubs Invited RHP Bobby Brownlie, LHP Carmen Pignatiello, LHP Raul Valdez, RHP Randy Wells, C Jake Fox, INF Casey McGehee, INF Brandon Sing, OF Buck Coats and OF Adam Greenberg to Spring Training; signed C Dennis Anderson to a Minor League contract and invited him to Spring Traning."
2006-01-06,Colorado Rockies Re-signed RHP Byung-Hyun Kim to a one-year contract and acquired INF Josh Wilson from the Florida Marlins in exchange for a player to be named later or cash.
2006-01-06,Florida Marlins Traded INF Josh Wilson to the Rockies for a player to be named or cash.
2006-01-06,Kansas City Royals Designated RHP Kyle Snyder and RHP Devon Lowery for assignment.
2006-01-06,"Los Angeles Angels Extended non-roster invitations to Spring Training to OFs Tim Salmon and Curtis Pride; INF Brian Specht, SS Brandon Wood, RHPs Jered Weaver, Nicholas Adenhart, David Austen, Tommy Mendoza, Dustin Moseley, Alex Serrano and Bob Zimmermann; LHPs Dan Davidson and Jon Rouwenhorst; INFs Brandon Wood and Brian Specht; Cs Ryan Budde, Michael Collins, Brent Del Chiaro, Brett Martinez and Bobby Wilson; signed LHP Tim Bittner, RHPs Nate Bland, Daniel Davidson, Matt Hensley and OF Curtis Pride to Minor League contracts and invited them to Spring Training."
2006-01-06,Milwaukee Brewers Acquired 3B Corey Koskie from the Blue Jays for Minor League RHP Brian Wolfe.
2006-01-06,"New York Yankees Signed LHP Frank Brooks, RHP Matt Childer, RHP Mark Corey, RHP Jose Veras, C Ben Davis, and INF Russ Johnson to Minor League contracts and invited them to Spring Training; invited nonroster players RHP James Cox, RHP Philip Hughes, RHP Steven White, RHP Kris Wilson, C Jose Gil, C David Parrish, C Omir Santos, 3B Eric Duncan and INF Danny Garcia to Spring Training."
2006-01-06,Signed LHP Al Leiter to a one-year minor league contract and invited him to Spring Training.
2006-01-06,Philadelphia Phillies Claimed OF Josh Kroeger off waivers from Arizona.
2006-01-06,Toronto Blue Jays Acquired RHP Brian Wolfe from the Milwaukee Brewers for 3B Corey Koskie.
2006-01-07,Chicago White Sox Signed RHP Chad Bentz to a Minor League contract and invited him to Spring Training.
2006-01-09,Baltimore Orioles Acquired OF Corey Patterson from the Cubs in exchange for SS Nate Spears and LHP Carlos Perez.
2006-01-09,Chicago Cubs Traded OF Corey Patterson to the Baltimore Orioles in exchange for Minor Leaguers SS Nate Spears and LHP Carlos Perez.
2006-01-09,Chicago White Sox Signed LHPs Javier Lopez and Stephen Randolph to Minor League contracts and invited them to Spring Training.
2006-01-09,Cincinnati Reds Re-signed INF Rich Aurilia to a one-year contract with a mutual option for 2007.
2006-01-09,Cleveland Indians Signed OF Todd Hollandsworth to a Minor League contract with an invitation to Spring Training.
2006-01-09,Colorado Rockies Signed C/OF Eli Marrero on a Minor League contract with an invitation to Spring Training.
2006-01-09,Houston Astros Signed LHP Carlos Hernandez and C Alan Zinter to Minor League contracts and invited them to Spring Training.
2006-01-09,Signed LHP Trever Miller to a one-year contract with a vesting option for 2007.
2006-01-09,Milwaukee Brewers Designated 3B Russell Branyan for assignment.
2006-01-09,Oakland Athletics Signed OF Bobby Kielty to a one-year contract.
2006-01-09,"Seattle Mariners Signed RHP Kevin Appier and INF Fernando Vina to Minor League contracts, including invitations to Spring Training."
2006-01-09,"St. Louis Cardinals Signed RHP Blain Neal and INFs Dave Berg and Kit Pellow to Minor League contracts with invitations to Spring Training; Invited nonroster RHPs Andy Cavazos, Brian Falkenborg, LHP Randy Leek, C Gabe Johnson to Spring Training."
2006-01-09,Washington Nationals Signed RHP Luis Ayala to a two-year contract and OF Michael Tucker to a one-year contract.
2006-01-10,"Atlanta Braves Signed RHP Travis Smith, INF Cesar Crespo, OF David Kelton and OF Michael Ryan to Minor League contracts with invitations to Spring Training; Invited nonroster players RHPs Kevin Barry and Chad Paronto, Cs Steve Pyzik, Jarrod Saltalamacchia and Clint Simmons and 2B Jonathan Schuerholz to Spring Training."
2006-01-10,"Detroit Tigers Signed RHPs Matt Mantei, Chad Durbin, Kevin Hodge and Lee Gardner, C Brian Peterson, INF Josh Phelps, and OF Reggie Taylor to Minor League contracts with invitations to Spring Training; Invited RHP Tim Crabtree, RHP Colby Lewis, LHP Bobby Seay, C Mike Rabelo, C Chris Robinson, C Danilo Sanchez, C Max St. Pierre, INF Mike Hessman, INF Kevin Hooper, and OF Alexis Gomez to Spring Training."
2006-01-10,Minnesota Twins Signed LHP Darrell May to a Minor League contract with an invitation to Spring Training.
2006-01-10,New York Mets Signed RHP Mike Pelfrey to a four-year contract and C Ramon Castro to a one-year contract.
2006-01-10,San Diego Padres Signed LHP Shawn Estes to a one-year contract.
2006-01-10,Tampa Bay Devil Rays Signed INF Ty Wigginton to a one-year contract.
2006-01-11,"Baltimore Orioles Signed RHPs Ricky Bottalico, Brooks Kieschnick and 3B Fernando Tatis to Minor League contracts and invited them to Spring Training."
2006-01-11,Boston Red Sox Signed INF Tony Graffanino to a one-year contract.
2006-01-11,Cleveland Indians Invited nonroster C Armando Camacaro to Spring Training.
2006-01-11,Detroit Tigers Signed LHP Mike Maroth to a two-year contract and 3B Brandon Inge to a one-year contract.
2006-01-11,Houston Astros Signed RHP Joe Valentine to a Minor League contract with an invitation to Spring Training.
2006-01-11,"Philadelphia Phillies Signed RHP Clay Condrey, RHP Jeremy Cummings, RHP Aaron Myette, LHP Matt White, C Dusty Wathan, INF Bobby Scales, INF Joe Thurston, OF Shawn Garrett and OF Peter Bergeron to Minor League contracts with invitations to Spring Training; Invited RHP Ryan Cameron, RHP Travis Minix, RHP Brian Sanches, LHP Cole Hamels, LHP Gio Gonzalez, RHP Aquilino Lopez, 3B Chris Coste, C Tim Gradoville, and C Jason Jaramillo to Spring Training."
2006-01-11,"Tampa Bay Devil Rays Signed RHP Jack Cressend, RHP Travis Driskill, RHP Bart Miadich, RHP Justin Miller, RHP Jason Childers, LHP Wayne Franklin, LHP Mark Malaska, INF Greg Norton, 1B Kevin Witt, C Ryan Christianson, C Mike Rose to Minor League contracts with invitations to Spring Training; Invited nonroster players RHP Juan Salas, RHP Tony Peguero, LHP Ruddy Lugo, C Chairon Isenia, INF Luis Ordaz and OF Darnell McDonald to Spring Training."
2006-01-11,"Signed RHP Shinji Mori to a two-year contract through 2007, with a club option to extend for two years through 2009."
2006-01-11,"Toronto Blue Jays Signed LHP Matt Blank, C Mike Mahoney, INF Luis Figueroa and OF Wayne Lydon to Minor League contracts with invitations to Spring Training; Invited nonroster players LHP Adrian Burnside, LHP David Purcey, LHP Ricardo Romero, C Robinson Diaz, C Erik Kratz, C Curtis Thigpen, 1B Kevin Barker and OF Chad Mottola to Spring Training."
2006-01-11,Signed RHP Ben Weber to a Minor League contract with an invitation to Spring Training.
2006-01-12,Arizona Diamondbacks Signed LHP Terry Mulholland to a Minor League contract and invited him to Spring Training.
2006-01-12,Baltimore Orioles Signed LHP Franklyn Gracesqui and 1B Kevin Millar to one-year contracts and designated LHP Brian Burres for assignment.
2006-01-12,Boston Red Sox Signed RHP Julian Tavarez to a two-year contract with a vesting option for 2008.
2006-01-12,"Cincinnati Reds Signed RHP Grant Balfour to a one-year contract and designated RHP Josh Hancock for assignment; Signed INF Frank Menechino, C Ryan Hanigan and C Steve Torrealba to Minor League contracts with invitations to Spring Training."
2006-01-12,Cleveland Indians Signed 1B Eduardo Perez to a one-year contract with a club option for 2007 and designated LHP Brian Tallet for assignment.
2006-01-12,Milwaukee Brewers Invited non-roster LHP Mitch Stetter to Major League Spring Training.
2006-01-12,"Agreed to terms with right-hander Matt Wise on a two-year, $1.7 million contract."
2006-01-12,Philadelphia Phillies Signed RHP Brett Myers to a one-year contract.
2006-01-12,"San Diego Padres Signed RHP Andy Ashby, RHP Eric Junge, C Jason Hill, INF Manny Alexander, 3B Justin Leone, and OF Eric Valent to Minor League contracts with invitations to Spring Training; Invited LHP Erick Burke and RHP Mike Thompson to Spring Training."
2006-01-12,Signed LHP Alan Embree to a Minor League contract with an invitation to Spring Training.
2006-01-12,"Seattle Mariners Signed RHP Julio Mateo to a two-year contract, and designated RHP Scott Atchison for assignment."
2006-01-12,"Tampa Bay Devil Rays Signed RHP Dan Miceli to a two-year contract through 2007, with a club option for 2008; Designated RHP Franklin Nunez for assignment."
2006-01-12,"Texas Rangers Signed RHP Joaquin Benoit to one-year deal for 2006, avoiding arbitration."
2006-01-13,"Arizona Diamondbacks Signed right-hander Brandon Webb to a contract extension through 2009, with an option for 2010. Agreed to a one-year deal with right-hander Luis Vizcaino."
2006-01-13,Atlanta Braves Signed RHP Jeff Bennett to a Minor League contract with an invitation to Spring Training.
2006-01-13,Baltimore Orioles Designated 1B Walter Young for assignment.
2006-01-13,Colorado Rockies Signed RHP Aaron Cook to a two-year contract through 2007 with an option for 2008.
2006-01-13,Kansas City Royals Sent RHP Kyle Snyder outright to Triple-A Omaha; Sent RHP Devon Lowery outright to Double-A Wichita.
2006-01-14,Los Angeles Angels Signed INF Chone Figgins to three-year contract; signed OF Juan Rivera to two-year contract.
2006-01-14,"Los Angeles Dodgers Signed RHP Aaron Sele to a Minor League contract and invited him to Spring Training; Designated RHP Joel Hanrahan for assignment; Invited nonroster players RHP Chad Billingsley, RHP Justin Orenduff; LHP Eric Stults, C Edwin Bellorin, INF Tony Abreu and OF Matt Kemp to Spring Training."
2006-01-14,Acquired RHP Danys Baez and RHP Lance Carter from the Devil Rays in exchange for RHP Edwin Jackson and LHP Chuck Tiffany.
2006-01-14,Tampa Bay Devil Rays Acquired RHP Edwin Jackson and LHP Chuck Tiffany from the Dodgers in exchange for RHP Danys Baez and RHP Lance Carter.
2006-01-16,"Cincinnati Reds Agreed to terms with OF Austin Kearns on a one-year contract for the 2006 season, avoiding arbitration."
2006-01-16,"Florida Marlins Agreed to terms with LHP Dontrelle Willis on a one-year contract, avoiding arbitration."
2006-01-16,Los Angeles Angels Signed C Jose Molina to two-year contract; signed RHP John Lackey to one-year contract.
2006-01-16,Philadelphia Phillies Signed OF Jason Michaels to a one-year contract.
2006-01-16,Pittsburgh Pirates Sent infielder J.J. Furmaniak outright to Triple-A Indianapolis and invited him to Spring Training.
2006-01-16,"Signed OF/1B Craig Wilson and LHP Oliver Perez to one-year contracts, avoiding arbitration."
2006-01-16,St. Louis Cardinals Signed RHP Jeff Nelson to a Minor League contract with an invitation to Spring Training.
2006-01-16,"Texas Rangers Signed C Rod Barajas to a one-year contract for 2006, avoiding arbitration."
2006-01-16,"Toronto Blue Jays Signed 1B Lyle Overbay to a one-year, $2.525 million contract and LHP Scott Downs to a one-year, $705,000 contract."
2006-01-17,"Arizona Diamondbacks Signed RHPs Brandon Lyon and Claudio Vargas, C Johnny Estrada and INFs Orlando Hudson and Alex Cintron to one-year contracts."
2006-01-17,"Atlanta Braves Signed INF Marcus Giles, LHP Horacio Ramirez and RHP Oscar Villarreal to one-year contracts, thus avoiding salary arbitration."
2006-01-17,Baltimore Orioles Sent LHP Brian Burres outright to Triple-A Ottawa and invited him to Spring Training.
2006-01-17,"Signed Bruce Chen, Erik Bedard, Todd Williams and Corey Patterson to one-year contracts."
2006-01-17,Boston Red Sox Signed RHP Guillermo Mota to a one-year contract.
2006-01-17,"Chicago White Sox Signed 3B Joe Crede to a one-year contract, avoiding arbitration."
2006-01-17,"Cincinnati Reds Agreed a one-year contract with RHP Aaron Harang, avoiding arbitration."
2006-01-17,"Cleveland Indians Acquired RHP Edward ""Bubbie"" Buzachero from the Blue Jays in exchange for LHP Brian Tallet."
2006-01-17,"Signed RHP David Riske to a one-year contract, avoiding arbitration."
2006-01-17,Colorado Rockies Signed RHP Zach Day to a one-year contract.
2006-01-17,Houston Astros Signed RHPs Brad Lidge and Dan Wheeler to one-year contracts.
2006-01-17,"Kansas City Royals Signed RHP Runelvys Hernandez and LHP Jeremy Affeldt to one-year contracts, avoiding arbitration."
2006-01-17,Los Angeles Angels Signed RHP Francisco Rodriguez and RHP Scot Shields to one-year contracts.
2006-01-17,Milwaukee Brewers Announced that INF Russell Branyan cleared waivers and was released.
2006-01-17,Oakland Athletics Signed RHP Juan Cruz and C Adam Melhuse to one-year contracts.
2006-01-17,"Pittsburgh Pirates Signed RHP Kip Wells to a one-year contract, avoiding arbitration."
2006-01-17,"San Francisco Giants Invited the following non-roster players to Spring Training: Ps Jamey Wright, Matt Anderson, Joe Bateman, Justin Hedrick, Matt Kinney, Pedro Liriano, Jeff Miller, Billy Sadler, Brian Wilson, Jonathan Sanchez and Michael Tejera; Cs Todd Jennings and Brian Munhall; INFs Brian Buscher, Tomas de la Rosa, Kevin Frandsen, Derin McMains, Pablo Sandoval and Jake Wald; and OFs John Bowker, Brian Horwitz, Abraham Nunez, Adam Shabala and Clay Timpner."
2006-01-17,Seattle Mariners Agreed to terms with INF Willie Bloomquist on a two-year contract.
2006-01-17,"St. Louis Cardinals Agreed to terms with RHP Jason Marquis on a one-year contract, avoiding arbitration."
2006-01-17,Texas Rangers Signed 1B Mark Teixeira to a two-year contract; Signed OF outfielder Brad Wilkerson to a one-year contract; Signed RHP Adam Eaton to a one-year contract.
2006-01-17,Toronto Blue Jays Signed LHP Ted Lilly to one-year contract; Acquired LHP Brian Tallet from the Cleveland Indians in exchange for RHP Bubbie Buzachero.
2006-01-17,Washington Nationals Signed C Brian Schneider to a four-year contract and 1B Nick Johnson to a one-year contract.
2006-01-18,Boston Red Sox Designated RHP Tim Bausher for assignment.
2006-01-18,"Colorado Rockies Signed RHP Keiichi Yabu, LHP Tom Martin and 1B Carlos Rivera to Minor League contracts with invitations to Spring Training."
2006-01-18,Los Angeles Angels Signed RHP Brendan Donnelly to a one-year contract.
2006-01-18,New York Mets Designated OF Angel Pagan for assignment
2006-01-18,Signed Japanese free agent RHP Yusaku Iriki to a one-year contract.
2006-01-18,"Pittsburgh Pirates Signed RHP Terry Adams and RHP Jorge Vasquez to Minor League contracts and invited them to Spring Training; Invited nonroster players C Carlos Maldonado, C Paul Chiaffredo, OF Andrew McCutchen and OF Ray Sadler to Spring Training."
2006-01-18,Tampa Bay Devil Rays Signed RHP Shawn Camp to a one-year contract and INF Luis Rivas to a Minor League contract with an invitation to Spring Training.
2006-01-19,Boston Red Sox Signed RHP Bronson Arroyo to a three-year contract; Signed INF Willie Harris to a Minor League contract with an invitation to Spring Training.
2006-01-19,"Chicago White Sox Invited nonroster players RHP Lance Broadway, LHP Ray Liotta, LHP Corwin Malone, C Carlos Lee, C Donny Lucy, C Gustavo Molina, INF Angel Gonzalez, INF Tim Hummel, SS Robert Valido, 3B Josh Fields, and OF Ryan Sweeney to Spring Training."
2006-01-19,"Agreed to terms on Minor League contracts with RHP Agustin Montero, RHP Tim Redding, OF Darren Blakely, OF Ben Grieve and INF Jorge Velandia and invited them to Spring Training."
2006-01-19,Cincinnati Reds Outrighted RHP Josh Hancock to Triple-A Louisville with an invitation to Spring Training.
2006-01-19,Cleveland Indians Invited nonroster OF Trevor Crowe to Spring Training.
2006-01-19,San Diego Padres Claimed 1B Walter Young off waivers from the Baltimore Orioles.
2006-01-20,Texas Rangers Acquired INF Aarom Baldiris on a waiver claim from the New York Mets.
2006-01-21,Baltimore Orioles Acquired RHP Kris Benson from the Mets in exchange for RHP Jorge Julio and RHP John Maine.
2006-01-21,New York Mets Acquired RHP Jorge Julio and RHP John Maine from the Orioles in exchange for RHP Kris Benson.
2006-01-23,"Atlanta Braves Signed RHP Jorge Sosa to a one-year contract for the 2006 season, thus avoiding salary arbitration; Signed LHP Mike Remlinger to a Minor League contract with an invitation to attend Spring Training."
2006-01-23,Chicago Cubs Signed RHP Wade Miller to a one-year contract.
2006-01-23,Tampa Bay Devil Rays Signed LHP Casey Fossum to a two-year contract with a club option for 2008.
2006-01-24,"Baltimore Orioles Signed OF Jay Gibbons to a four-year contract; signed 1B Leo Daigle, OF Esix Snead and RHPs Eddy Rodriguez and Tyler Yates to Minor League contracts with invitations to Spring Training; invited nonroster Cs Brian Bock and Ryan Hubele, and nonroster RHPs Cory Morris and Scott Rice to Spring Training."
2006-01-24,"Minnesota Twins Agreed to terms with INF Nick Punto on a one-year contract, avoiding arbitration."
2006-01-24,"New York Yankees Reached an agreement with RHP Aaron Small on a one-year contract, thus avoiding arbitration."
2006-01-24,Toronto Blue Jays Signed RHP James Baldwin to a Minor League contract with an invitation to Spring Training.
2006-01-24,Washington Nationals Signed C Wiki Gonzalez to a Minor League contract and invited him to Spring Training.
2006-01-25,Chicago Cubs Purchased the contract of OF Angel Pagan from the New York Mets.
2006-01-25,Cleveland Indians Agreed to terms with 1B Ben Broussard on a one-year contract.
2006-01-25,"Colorado Rockies Signed RHP Miguel Asencio to a Minor League contract with an invitation to Spring Training, pending a physical; Invited LHPs Justin Hampson and Zack Parker, RHPs Jim Miller, Sandy Nin and Judd Songster, Cs Dan Conway and Chris Iannetta, and INFs Ian Stewart and Troy Tulowitzki to Spring Training."
2006-01-25,Kansas City Royals Signed 1B/DH Ken Harvey to a Minor League contract.
2006-01-25,Oakland Athletics Agreed to terms with Frank Thomas on a one-year contract and designated C John Baker for assignment.
2006-01-26,Seattle Mariners Agreed to terms on a one-year contract with RHP Gil Meche.
2006-01-27,"Boston Red Sox Acquired OF Coco Crisp, RHP David Riske and C Josh Bard from Cleveland for RHP Guillermo Mota, 3B Andy Marte, C Kelly Shoppach, cash considerations, and a player to be named or further cash considerations."
2006-01-27,Cleveland Indians Acquired OF Jason Michaels from Philadelphia for LHP Arthur Rhodes.
2006-01-27,"Acquired RHP Guillermo Mota, 3B Andy Marte, C Kelly Shoppach, cash considerations, and a player to be named or further cash considerations from Boston for OF Coco Crisp, RHP David Riske and C Josh Bard."
2006-01-27,Philadelphia Phillies Acquired LHP Arthur Rhodes from Cleveland for OF Jason Michaels.
2006-01-27,"Seattle Mariners Extended Spring Training invitations to Major League camp to 22 players: Pitchers Kevin Appier, Scott Atchison, Dave Burba, Francisco Cruceta, Rich Dorman, Lindsey Gulin, Jeff Harris, Jeff Heaverlo and Chris Jaile; catchers Corky Miller, Jeff Clement, Andrew Dominique and Rob Johnson; infielders Asdrubal Cabrera, Greg Dobbs, Rayon Lampe, Jose Morbon, Cody Ransom, Todd Sears, Matt Tuiasosopo and Fernando Vina; and outfielder Adam Jones."
2006-01-27,Tampa Bay Devil Rays Agreed to terms with RHP Jesus Colome on a one-year contract.
2006-01-27,Washington Nationals Signed 1B Daryle Ward and LHP Valerio De Los Santos to Minor League contracts with invitations to Spring Training.
2006-01-28,Texas Rangers Agreed to terms on one-year contracts with OF Gary Matthews Jr. and RHP Vicente Padilla.
2006-01-30,"Arizona Diamondbacks Invited the following players to Spring Training: Pitchers Randy Choate, Casey Daigle, Kevin Jarvis, Mike Koplove, Terry Mulholland, Bill Murphy and Neal Musser; catchers Juan Brito and Matt Morgan; infielders Jerry Gil and Justin Upton; outfielders Jarred Ball, Calos Quentin and Marland Williams."
2006-01-30,Tampa Bay Devil Rays Signed RHP Travis Harper to a one-year contract.
2006-01-31,Cincinnati Reds Signed RHP Rick White to a one-year contract.
2006-01-31,Los Angeles Dodgers Signed INF Ramon Martinez and RHP Kurt Ainsworth to Minor League contracts with invitations to Spring Training.
2006-01-31,"Milwaukee Brewers Signed RHPs Mike Jones and Carlos Villanueva, INF Hernan Iribarren, and OFs Nelson Cruz and Brad Nelson to one-year contracts."
2006-01-31,Minnesota Twins Signed DH Ruben Sierra to a Minor League contract and invited him to Major League Spring Training; Signed RHPs Pete Munro and Ryan Glynn and OF Tim Raines Jr. to Minor League contracts and assigned them to report to Minor League Spring Training.
2006-01-31,San Diego Padres Agreed to terms with C Mike Piazza on a one-year contract with a mutual option for 2007.
2006-01-31,Tampa Bay Devil Rays Signed INF Russell Branyan to a Minor League contract with an invitation to Spring Training.
2006-02-01,"Boston Red Sox Invited RHP Tim Bausher, RHP Matt Ginter, RHP Jimmy Serrano, LHP Craig Breslow, LHP Mike Bumatay, LHP Mike Holtz, LHP Phil Seibel, C Ken Huckaby, INF Willie Harris, INF Trent Durrington, INF Luis A. Jimenez, INF Rodney Nye, INF Dustin Pedroia, INF Josh Pressley, INF Enrique Wilson, OF Luke Allen, OF Ron Calloway, OF Gabe Kapler, OF Tyler Minges and OF Dustan Mohr to Spring Training."
2006-02-01,Cincinnati Reds Acquired RHP Rick White and designated RHP Bubba Nelson for assignment; named Mike LaCoss Minor League roving pitching instructor.
2006-02-01,"Kansas City Royals Invited nonroster RHPs Luis Cota, Kyle Snyder and Steve Stemle, and nonroster Cs Adam Donachie and Mat Tupman to Spring Training; Signed RHP Bob Keppel and OF Chad Allen to Minor League contracts with invitations to Spring Training."
2006-02-02,"Chicago Cubs Signed LHP Will Ohman and OF Juan Pierre to one-year contracts, avoiding arbitration."
2006-02-02,Colorado Rockies Signed RHP Sunny Kim and C Yorvit Torrealba to one-year contracts.
2006-02-02,Pittsburgh Pirates Agreed to terms with RHP Bryan Bullington.
